transaction_id,partner_id,store_id,internal_store_id,transaction_type,amount,transaction_date,notes
"3652","2","e64412f3-bbd7-42d3-b534-e32fd6a12344","7","withdraw","844399.94","2025-05-13T11:56:43.962Z","أمشي مرهق عمر واسع يعبر باتجاه هنا."
"3653","6","883ea3c2-8134-4a57-a356-7e437f2f5105","13","deposit","923719.25","2025-05-13T10:30:36.255Z","صغير اقف إليك لكن الة ليّن ضيق خطأ ثالاسانوس سريع."
"3654","1","f332130d-1973-437e-989c-ee33d384be15","18","withdraw","348275.12","2025-05-13T17:32:38.987Z","مثل شاب معركة يتمتع رسمي مثاب يفصل ماء وفير يفصل."
"3655","3","01e32a4b-7a37-479f-8118-fc77e2522bdc","19","discount","373883.35","2025-05-13T17:04:18.522Z","فضة حسنة لذا يزيل إمضاء."
"3656","3","ccf027ac-5288-4fe1-84c4-82130ed52df8","3","withdraw","91645.76","2025-05-13T13:17:35.752Z","شريك أرى حل تقطر المختارون يفتح."
"3657","2","1c2063fe-e9a9-49aa-8e07-1d2d3d3135d9","22","deposit","181888.35","2025-05-13T19:18:47.373Z","كنز مربع الكل مواطن يناسب بعيد صدر الفراء الجاد."
"3658","2","1c2063fe-e9a9-49aa-8e07-1d2d3d3135d9","22","deposit","762932.34","2025-05-13T15:35:07.727Z","أَخَّاذ ما ثالاسانوس المد."
"3659","3","43fdbc4f-9368-4f49-addb-f1ca5385b275","24","deposit","822303.63","2025-05-13T03:52:20.562Z","إخلاء اضفت متأخر يقلق أطفئ نتهم."
"3660","6","ba9d73ff-19f3-4898-9589-a2a9e66c44a1","12","deposit","893273.71","2025-05-12T21:04:34.574Z","صالح نستنتج يسير."
"3661","2","1c2063fe-e9a9-49aa-8e07-1d2d3d3135d9","22","withdraw","80234.61","2025-05-13T04:52:50.176Z","العنوان اضع عزيزي تعتاد."
"3662","1","4742e4af-77fe-4e0d-818e-20c52c134eae","23","deposit","625812.27","2025-05-13T05:19:17.691Z","رأى التفاضل على."
"3663","2","962bf6f6-2579-4e29-a560-cffb0ab5636b","25","discount","344873.5","2025-05-13T00:54:23.148Z","سلام الجميع أسلم متشوق شائع عدالة الحمدون لوت فحم أَخَّاذ."
"3664","5","cc83be41-c904-42e1-880f-969edd5c59ed","21","discount","824222.07","2025-05-13T12:13:21.804Z","صدقة مُطبَّق أساعد مزايا تدليك حاضر مرسوم حل شعر ينمو."
"3665","1","255236cf-98e5-4bf5-b282-cc3ef02ae9f1","6","withdraw","687770.91","2025-05-12T23:13:28.341Z","أقل ينتقد الماء آدم مستمع رأس عزيزتي أحب سريع الرقص."
"3666","4","2b3220b2-294e-4f52-9687-c3c75ddef9c7","11","deposit","697908.07","2025-05-13T09:16:13.785Z","المد مختفي كنز توربيني القوي أقدر."
"3667","6","b715432a-113d-45f7-8330-a7a02bafcd79","26","deposit","737317.08","2025-05-13T18:32:43.135Z","الأمل المقصود يفعل واسع سبورة مكاتب."
"3668","2","30a966ef-3aef-4c6c-b4a4-92aa218b318f","14","withdraw","621628.52","2025-05-13T10:33:27.711Z","باقية حقا أقوي نجح أطلق."
"3669","3","cc27c8a9-a99f-4cae-9c32-7cfe4f93b9ea","9","deposit","911324.32","2025-05-13T15:54:38.867Z","اخماد أبدي أميل ضجة تصل أتفق بالتأكيد."
"3670","2","962bf6f6-2579-4e29-a560-cffb0ab5636b","25","withdraw","396745.5","2025-05-13T07:16:38.634Z","رعاية أوزة الأكثر."
"3671","6","3f59d9ac-e7c7-4ce9-b2a8-88bb8c1b3fa1","4","withdraw","125014.13","2025-05-13T04:08:23.804Z","قبلت يأتي يساهم اتحداك فارغ دورة اخترت."
"3672","5","cc83be41-c904-42e1-880f-969edd5c59ed","21","discount","845174.5","2025-05-13T10:45:23.867Z","مائة ضد باقية الجبر لذا."
"3673","1","4742e4af-77fe-4e0d-818e-20c52c134eae","23","discount","936620.51","2025-05-13T14:41:44.802Z","زجاجة وسوف يقدموا مصطنع أنمو مرة عريض."
"3674","4","2b3220b2-294e-4f52-9687-c3c75ddef9c7","11","discount","822157.86","2025-05-13T11:28:53.585Z","سلم محبوب رقابة ماهر كريم ماء ولا."
"3675","5","9dea6436-b5cd-4cd6-b546-b9058bde0d0d","20","withdraw","800968.7","2025-05-13T18:41:41.816Z","باهظ يساعد صندوق بالفعل نفسها دخول."
"3676","2","1c2063fe-e9a9-49aa-8e07-1d2d3d3135d9","22","discount","24885.41","2025-05-13T04:58:19.188Z","بالفعل عريض أنا الجرأة فريق برعاية."
"3677","6","3f59d9ac-e7c7-4ce9-b2a8-88bb8c1b3fa1","4","withdraw","949666.71","2025-05-13T07:36:32.737Z","اخذت بهجة أفتقد."
"3678","2","778512a9-1763-407b-8f16-1868d3d5738b","16","deposit","990246.16","2025-05-13T12:26:30.159Z","كبير أبدي بقدر كتف يتقدم."
"3679","2","96b80634-dfb5-4769-b131-ff259593df47","8","withdraw","828972.47","2025-05-13T11:51:35.714Z","العمل رحلة فشيأ يجب يقلق تبعًا فن أسقط سهم مبروك."
"3680","2","1c2063fe-e9a9-49aa-8e07-1d2d3d3135d9","22","withdraw","705892.07","2025-05-13T05:10:55.105Z","تكون نهاية هم الأليف."
"3681","3","2c9da0e7-c032-444c-b643-121c4c395f60","2","withdraw","193564.57","2025-05-13T08:47:33.205Z","فحم ويل معركة يقي."
"3682","3","6df2e177-2920-4477-8841-7db21d003020","5","deposit","475732.36","2025-05-13T00:54:21.656Z","كيف تجمع المرسول رحلة ذيل الجناح كوب."
"3683","2","77f0aeb1-e784-4233-b5ed-725aa5ff841c","10","withdraw","64047.84","2025-05-13T05:10:45.320Z","بكمل انهم صدقة الجميع مدح اناقش مزيج حق."
"3684","6","ba9d73ff-19f3-4898-9589-a2a9e66c44a1","12","withdraw","230930.35","2025-05-13T18:09:21.563Z","تدوس محل الحضارة كل أقل حزينين هم."
"3685","5","8a1f0c2c-36fb-47c7-918c-1b6386b82b54","1","discount","801876.8","2025-05-13T04:21:48.537Z","حزن يستخدم أتصل البقية رعاية."
"3686","6","3f59d9ac-e7c7-4ce9-b2a8-88bb8c1b3fa1","4","discount","771765.1","2025-05-13T18:45:11.445Z","يتعلم أفعل هذا مأخوذ اهداء مجموعة."
"3687","5","cc83be41-c904-42e1-880f-969edd5c59ed","21","withdraw","426535.62","2025-05-13T08:51:03.530Z","ينمو حق هو تصدع الجنون."
"3688","6","3f59d9ac-e7c7-4ce9-b2a8-88bb8c1b3fa1","4","withdraw","837673.92","2025-05-12T21:44:59.420Z","الأكثر ساطع مخزون كلا سلسلة ليتم سنة المشي."
"3689","3","ccf027ac-5288-4fe1-84c4-82130ed52df8","3","discount","557522.08","2025-05-13T07:38:01.937Z","أبداً خطة أعيش خادمة سنشتاق العزلة مرات متنوع سأفتح جميع."
"3690","5","9dea6436-b5cd-4cd6-b546-b9058bde0d0d","20","discount","852405.61","2025-05-13T05:09:32.065Z","ذاهب سمة أن بالاسفل فضول رهيب غائب طاولة."
"3691","5","cc83be41-c904-42e1-880f-969edd5c59ed","21","discount","408395.72","2025-05-13T07:57:56.261Z","تجريبي تخمين إخلاء تحية تصويت فوز حساب هذا."
"3692","3","2c9da0e7-c032-444c-b643-121c4c395f60","2","deposit","686919.58","2025-05-13T04:33:02.466Z","ذهبي جري اخذت يرتجف الحال عدد عشر نائب جرس."
"3693","3","01e32a4b-7a37-479f-8118-fc77e2522bdc","19","deposit","254273.57","2025-05-13T09:37:48.018Z","غالباً كوب اخماد بالرغم الشاعر يدق قديم."
"3694","1","4742e4af-77fe-4e0d-818e-20c52c134eae","23","deposit","400645.03","2025-05-13T18:42:05.197Z","صيف عم العاشر كثيرة يحضر أقل عدد وفير سبب دولة."
"3695","1","4742e4af-77fe-4e0d-818e-20c52c134eae","23","deposit","104768.42","2025-05-13T08:49:32.940Z","يهرب تذوق لوم مهارات أعتقد."
"3696","2","962bf6f6-2579-4e29-a560-cffb0ab5636b","25","deposit","454439.23","2025-05-13T12:17:50.112Z","خشن أغنية أدوس سويا وفير يقدموا إيداع حر روح."
"3697","6","3f59d9ac-e7c7-4ce9-b2a8-88bb8c1b3fa1","4","discount","739685.16","2025-05-12T21:05:48.782Z","مع ربيع شاهد السماع ناعم كما فشيأ وحشي يقرر فارغ."
"3698","6","b715432a-113d-45f7-8330-a7a02bafcd79","26","withdraw","869995.04","2025-05-12T23:01:38.118Z","كافٍ عشر عادة."
"3699","2","30a966ef-3aef-4c6c-b4a4-92aa218b318f","14","withdraw","873342.09","2025-05-12T22:48:56.658Z","امتياز العائلة حياة أحب جمع تجريبي."
"3700","1","4742e4af-77fe-4e0d-818e-20c52c134eae","23","discount","477725.94","2025-05-13T13:14:24.446Z","لحية المد اخذت أسقط حسنة بقرة."
"3701","3","2c9da0e7-c032-444c-b643-121c4c395f60","2","discount","157630.58","2025-05-13T01:56:06.196Z","نَسِيج كثيرة أساعد مهد ألحق على مرتين."
"3702","1","f79e0d2a-6bb6-4634-be8c-f25330f9ff88","15","withdraw","571976.36","2025-05-13T16:55:43.236Z","نشأ اخر الفائز عزيزتي نفسه مرارًا ماهر الشفق ثلاثون."
"3703","3","01e32a4b-7a37-479f-8118-fc77e2522bdc","19","discount","724260.92","2025-05-13T15:47:32.942Z","يمثل ينظف طعام."
"3704","6","b715432a-113d-45f7-8330-a7a02bafcd79","26","discount","75893.22","2025-05-13T06:51:01.283Z","فائدة كلا صحة أقدر اعتدال نهاية عجز أخسر ثم."
"3705","5","cc83be41-c904-42e1-880f-969edd5c59ed","21","discount","643120.49","2025-05-13T17:44:17.061Z","احب الذات مريح حزينين مؤلف."
"3706","1","255236cf-98e5-4bf5-b282-cc3ef02ae9f1","6","withdraw","643250.72","2025-05-13T18:46:04.451Z","ل الترحيل أب سبورة عفوية قبول."
"3707","1","255236cf-98e5-4bf5-b282-cc3ef02ae9f1","6","discount","312072.87","2025-05-13T10:52:06.315Z","ربيع المشي يقلق."
"3708","1","f79e0d2a-6bb6-4634-be8c-f25330f9ff88","15","discount","310217.41","2025-05-13T16:10:42.073Z","تخمين سهم إذا يقرر يبحث حر."
"3709","4","2b3220b2-294e-4f52-9687-c3c75ddef9c7","11","discount","947064.03","2025-05-13T07:41:33.835Z","أخرى بداهة متطابقة قيمة الثعالب أي فن تاج يصدق."
"3710","3","01e32a4b-7a37-479f-8118-fc77e2522bdc","19","deposit","264554.08","2025-05-13T01:46:02.217Z","الاستخدام شيء يفترض ظل أقول ثابت بعنف يفصل عصفور."
"3711","1","255236cf-98e5-4bf5-b282-cc3ef02ae9f1","6","withdraw","742996.15","2025-05-13T17:05:45.854Z","سن كريم سيصيبني شريك."
"3712","6","3f59d9ac-e7c7-4ce9-b2a8-88bb8c1b3fa1","4","deposit","43664.87","2025-05-13T16:34:25.988Z","مواطن سألتصق يحضر المختارون يلائم مراعاة الشاعر وأود قصير مثاب."
"3713","1","4742e4af-77fe-4e0d-818e-20c52c134eae","23","deposit","262796.15","2025-05-13T15:02:36.240Z","صده فليكن الخدع ألفت دعوى حزين."
"3714","3","01e32a4b-7a37-479f-8118-fc77e2522bdc","19","discount","594723.41","2025-05-13T01:55:04.860Z","رابطة اقول بدأت سنشتاق."
"3715","2","778512a9-1763-407b-8f16-1868d3d5738b","16","withdraw","79273.49","2025-05-12T19:29:14.924Z","سيارة مزايا لذلك ضد حزين ليونة يظهر مزايا."
"3716","6","3f59d9ac-e7c7-4ce9-b2a8-88bb8c1b3fa1","4","deposit","426874.25","2025-05-12T19:27:24.261Z","الحمامات صندوق سيصيبني يساهم مصلح غداً."
"3717","6","883ea3c2-8134-4a57-a356-7e437f2f5105","13","deposit","569257.95","2025-05-12T23:50:19.782Z","حقيقة اكثر الذات ثالاسانوس باقية انتصار."
"3718","6","883ea3c2-8134-4a57-a356-7e437f2f5105","13","withdraw","581858.35","2025-05-13T15:36:27.698Z","نفسه أقول كارثة اجل أفتقد بالباص."
"3719","1","4742e4af-77fe-4e0d-818e-20c52c134eae","23","deposit","870383.95","2025-05-12T23:27:41.634Z","سوف مخترع بالرغم السماع ماء فرن وظائف قطة عتيق مخترع."
"3720","5","9dea6436-b5cd-4cd6-b546-b9058bde0d0d","20","withdraw","249746.88","2025-05-13T13:03:09.785Z","ربط يفعل ديون الملابس غرفة عقل سأخبرك أعلى لكن ل."
"3721","1","255236cf-98e5-4bf5-b282-cc3ef02ae9f1","6","withdraw","496142.26","2025-05-13T03:29:21.012Z","عليه ذهبي رسمي إلى عصا مرهق كرمة الموعد."
"3722","3","ccf027ac-5288-4fe1-84c4-82130ed52df8","3","discount","287486.39","2025-05-13T14:13:32.470Z","حساب مضيف يغني دخول مرة مأخوذ ذاهب."
"3723","2","1c2063fe-e9a9-49aa-8e07-1d2d3d3135d9","22","deposit","460449.6","2025-05-13T14:06:15.728Z","غالباً راحة خيار باهظ بكمل استوديو مرة الجبر."
"3724","2","96b80634-dfb5-4769-b131-ff259593df47","8","deposit","612956.23","2025-05-13T07:05:03.758Z","سبورة يفضل ثم مقابلة يستثني حجرة ينتقد آلام صيف أريد."
"3725","5","8a1f0c2c-36fb-47c7-918c-1b6386b82b54","1","deposit","308075.93","2025-05-12T22:21:26.406Z","مصلح اخذت آخر حسنة نشأ وميض عادة."
"3726","1","255236cf-98e5-4bf5-b282-cc3ef02ae9f1","6","deposit","388217.26","2025-05-13T04:03:11.022Z","شريك صيف قيمة الكبرى التسلق."
"3727","2","96b80634-dfb5-4769-b131-ff259593df47","8","deposit","136094.27","2025-05-12T20:23:51.589Z","أكون فضائي صداقة منحنى حضري العليا اسمنت نعسان عالي غائب."
"3728","4","2b3220b2-294e-4f52-9687-c3c75ddef9c7","11","withdraw","314143.17","2025-05-13T13:35:39.100Z","وسوف عشاء تحمل قادم عدد معماري مرهق غداً."
"3729","2","1c2063fe-e9a9-49aa-8e07-1d2d3d3135d9","22","deposit","214430.41","2025-05-12T20:21:52.221Z","أعتقد قبول ويل لذلك الشاعر لو منجلي اجد لذا تصويت."
"3730","1","f79e0d2a-6bb6-4634-be8c-f25330f9ff88","15","withdraw","724613.93","2025-05-12T22:25:04.915Z","ملموس متزوجة كيك أنا عزيزي هواء فضائي بهجة."
"3731","5","cc83be41-c904-42e1-880f-969edd5c59ed","21","discount","682934.76","2025-05-13T16:24:29.822Z","حقا أعتبر يفحص أكون حضن شاب مشهور ملكنا."
"3732","3","43fdbc4f-9368-4f49-addb-f1ca5385b275","24","withdraw","725376.63","2025-05-13T18:38:16.454Z","ازعم أعلن مساء نسج توربيني إخلاء معتاد لطيف أسلم فرن."
"3733","3","01e32a4b-7a37-479f-8118-fc77e2522bdc","19","withdraw","49315.4","2025-05-13T06:08:35.996Z","اسم ابن مدح إلى."
"3734","2","1c2063fe-e9a9-49aa-8e07-1d2d3d3135d9","22","discount","695703.34","2025-05-13T07:07:07.980Z","المحدد بحكمة يبعد سويا يفصل ليتم طباشير السرج ركن أقسى."
"3735","2","778512a9-1763-407b-8f16-1868d3d5738b","16","withdraw","773284.19","2025-05-13T14:33:28.841Z","نقود تحمل يغني."
"3736","1","f332130d-1973-437e-989c-ee33d384be15","18","deposit","307694.22","2025-05-13T04:14:11.301Z","بِكر اهداء تصدع الحال يسامح يقارن مرات أرتب."
"3737","1","255236cf-98e5-4bf5-b282-cc3ef02ae9f1","6","withdraw","734888.19","2025-05-13T17:17:28.805Z","نائب مواطنة بحكمة ينمو مواطنون اقتراح."
"3738","2","77f0aeb1-e784-4233-b5ed-725aa5ff841c","10","withdraw","142033.29","2025-05-13T10:59:44.805Z","الجنون دعوى صامت."
"3739","1","1a120ada-8dd5-4b93-a6b0-90a1a0d0022e","17","discount","615821.92","2025-05-13T06:48:03.048Z","طباشير آتي فجأة امن أثاث يوم."
"3740","6","ba9d73ff-19f3-4898-9589-a2a9e66c44a1","12","discount","356059.39","2025-05-13T15:49:07.179Z","بداهة لكم هواء سرور بكمل صنعت تدليك."
"3741","6","883ea3c2-8134-4a57-a356-7e437f2f5105","13","withdraw","3049.68","2025-05-13T16:39:27.465Z","مقنع الجنون رمي فيما اشرب يعرفون فارغ أخيرا."
"3742","1","f79e0d2a-6bb6-4634-be8c-f25330f9ff88","15","discount","194980.15","2025-05-12T20:58:10.663Z","امتعة بطريقة نظيف وَسَط ثم حسنة لوم أدافع فضول غرفة."
"3743","6","b715432a-113d-45f7-8330-a7a02bafcd79","26","deposit","731691.73","2025-05-13T15:15:40.122Z","مكان بسرعة ظل."
"3744","1","4742e4af-77fe-4e0d-818e-20c52c134eae","23","discount","355632.35","2025-05-13T02:05:53.444Z","اعتدال نائب أنهض."
"3745","6","883ea3c2-8134-4a57-a356-7e437f2f5105","13","deposit","479168.25","2025-05-13T07:49:21.121Z","الثعالب أشياء عشاء إلى معركة عباس يأتي صحيح."
"3746","5","cc83be41-c904-42e1-880f-969edd5c59ed","21","deposit","398210.15","2025-05-13T15:03:41.160Z","شاهد المرونة ربيع مبتذلة."
"3747","3","6df2e177-2920-4477-8841-7db21d003020","5","deposit","822208.09","2025-05-13T17:11:08.111Z","الرافض يحشد كلا دولة تعال جوية بطريقة ويل."
"3748","3","6df2e177-2920-4477-8841-7db21d003020","5","discount","868567.17","2025-05-12T19:47:38.231Z","زال سأفتح رعاية مشط."
"3749","2","1c2063fe-e9a9-49aa-8e07-1d2d3d3135d9","22","withdraw","898622.93","2025-05-12T20:56:12.736Z","بالباص الحقيقة نجمة."
"3750","5","cc83be41-c904-42e1-880f-969edd5c59ed","21","deposit","653579.42","2025-05-13T13:45:01.228Z","شائع أحسن باهظ سيل سيصيبني يأخذ ثقافة."
"3751","2","1c2063fe-e9a9-49aa-8e07-1d2d3d3135d9","22","discount","801634.61","2025-05-13T06:04:24.044Z","معماري عتيق منتصف أعتقد مصلح."
"3752","3","6df2e177-2920-4477-8841-7db21d003020","5","withdraw","557616.1","2025-05-13T17:46:14.144Z","مخترع ملاك جهد يقود ديون."
"3753","3","01e32a4b-7a37-479f-8118-fc77e2522bdc","19","deposit","142156.66","2025-05-13T10:04:09.613Z","أُطرُوحَة غائب أي إليك."
"3754","2","96b80634-dfb5-4769-b131-ff259593df47","8","discount","713815.39","2025-05-13T18:26:01.521Z","أخرى فيما يصلح عزيزي والنسيج مِرفَق ثلاثون ملموس."
"3755","2","96b80634-dfb5-4769-b131-ff259593df47","8","withdraw","235581.72","2025-05-12T19:45:08.157Z","الموت أحسن يضحك ينمو عزيز دورة اجلس السرج أعلى."
"3756","6","883ea3c2-8134-4a57-a356-7e437f2f5105","13","discount","829192.08","2025-05-12T22:57:37.323Z","تهور أمشط أسمع ازعم سير رفض يقود جميع اصرخ الوادي."
"3757","3","43fdbc4f-9368-4f49-addb-f1ca5385b275","24","withdraw","789600.74","2025-05-13T05:15:44.135Z","الطريق عاصف يرتقع يحشد حقيقي أدوس يهمني الخصم."
"3758","3","2c9da0e7-c032-444c-b643-121c4c395f60","2","deposit","784505.41","2025-05-13T06:00:23.067Z","معبد أمشط الدير أتذكر حذر امتعة أوافق."
"3759","5","cc83be41-c904-42e1-880f-969edd5c59ed","21","deposit","813698.31","2025-05-13T13:30:55.807Z","ابن دخول آمل المنشئ يكتسب تماثيل رسغ تدريبات أعمى."
"3760","3","ccf027ac-5288-4fe1-84c4-82130ed52df8","3","deposit","107811.91","2025-05-12T20:13:40.801Z","الثعالب الرافض أعلن اكثر يتردد مستمر البقية معظم معبد يقولون."
"3761","5","cc83be41-c904-42e1-880f-969edd5c59ed","21","discount","764675.11","2025-05-13T14:05:30.507Z","أقترح هم بعنف العنوان مثاب."
"3762","4","2b3220b2-294e-4f52-9687-c3c75ddef9c7","11","discount","357077.35","2025-05-12T20:15:38.529Z","الاستخدام اخماد مشرق زوجة عادة يسامح خط فشيأ."
"3763","6","b715432a-113d-45f7-8330-a7a02bafcd79","26","discount","137816.27","2025-05-12T21:31:59.581Z","عفوية أسمع يهرب أساس يفتح مرارًا آكل يعبر صندوق."
"3764","3","2c9da0e7-c032-444c-b643-121c4c395f60","2","discount","758272.5","2025-05-13T14:57:52.114Z","تم وفير فقير يتردد."
"3765","6","3f59d9ac-e7c7-4ce9-b2a8-88bb8c1b3fa1","4","deposit","305141.06","2025-05-13T18:17:28.017Z","محل أشياء مجمع مصلح."
"3766","4","2b3220b2-294e-4f52-9687-c3c75ddef9c7","11","deposit","899880.76","2025-05-13T05:01:35.629Z","للمتابعة يعبر القليل معظم ذراع."
"3767","3","01e32a4b-7a37-479f-8118-fc77e2522bdc","19","deposit","986633.91","2025-05-13T10:57:29.248Z","انتهاء أساس قليل راحة ملاك منهم اخماد العنوان."
"3768","3","43fdbc4f-9368-4f49-addb-f1ca5385b275","24","deposit","144126.25","2025-05-12T20:13:32.294Z","تبعًا يعرفون ماء يفترض."
"3769","2","e64412f3-bbd7-42d3-b534-e32fd6a12344","7","withdraw","564358.83","2025-05-13T09:10:18.275Z","جهد حق مضيف أفتقد ذهبي ألفت ينظر أعمى."
"3770","5","9dea6436-b5cd-4cd6-b546-b9058bde0d0d","20","deposit","22352.71","2025-05-13T07:58:27.415Z","يبدو مواطنون أستسلم آدم إنني كيف أب تذوق حاضر."
"3771","3","ccf027ac-5288-4fe1-84c4-82130ed52df8","3","discount","619498.71","2025-05-13T12:09:06.715Z","مواطن إنه بالرغم."
"3772","2","962bf6f6-2579-4e29-a560-cffb0ab5636b","25","deposit","111664.94","2025-05-13T06:33:07.189Z","يترتب و رقابة."
"3773","2","e64412f3-bbd7-42d3-b534-e32fd6a12344","7","deposit","174662.69","2025-05-13T14:39:23.431Z","كرامة يتبنى محبوب السرج."
"3774","1","1a120ada-8dd5-4b93-a6b0-90a1a0d0022e","17","withdraw","975883.53","2025-05-13T08:27:10.375Z","صدر إخلاء سهم أين يكتسب نفسها جهد."
"3775","2","1c2063fe-e9a9-49aa-8e07-1d2d3d3135d9","22","withdraw","64490.29","2025-05-13T05:41:17.847Z","مهندس تماثيل أسلم وسوف صدوق ايقاد اقف طبقة."
"3776","1","f79e0d2a-6bb6-4634-be8c-f25330f9ff88","15","discount","949195.69","2025-05-13T10:51:12.198Z","مع بالرغم عزيزتي قال كارثة."
"3777","1","255236cf-98e5-4bf5-b282-cc3ef02ae9f1","6","discount","11554.26","2025-05-13T04:03:04.337Z","يتذكر فليكن آخر خلوق مريح."
"3778","2","1c2063fe-e9a9-49aa-8e07-1d2d3d3135d9","22","deposit","661450.82","2025-05-12T22:04:51.134Z","غرفة فضيلة العنوان مشط."
"3779","2","1c2063fe-e9a9-49aa-8e07-1d2d3d3135d9","22","withdraw","519226.56","2025-05-13T04:36:50.990Z","مجموع حقيقة توربيني."
"3780","1","255236cf-98e5-4bf5-b282-cc3ef02ae9f1","6","deposit","608961.08","2025-05-12T22:14:34.337Z","حضري الأليف وَرَاءَ يقفز يقود يليق مهدئ بقدر يتحقق الحمامات."
"3781","5","8a1f0c2c-36fb-47c7-918c-1b6386b82b54","1","discount","397737.89","2025-05-12T23:41:53.388Z","أركل يحذب فليكن."
"3782","3","43fdbc4f-9368-4f49-addb-f1ca5385b275","24","withdraw","88754.26","2025-05-12T22:42:52.506Z","أب الأمل الخدع مستقر أقترح نفع السترة لون."
"3783","5","9dea6436-b5cd-4cd6-b546-b9058bde0d0d","20","withdraw","145477.65","2025-05-13T01:05:20.075Z","شيء كتف حجاب اضع الكبرى الإحسان."
"3784","2","77f0aeb1-e784-4233-b5ed-725aa5ff841c","10","discount","378678.59","2025-05-13T10:51:18.457Z","أحمل عمة معتاد رقبة الجاد ماهر خزان يسامح اهداء النزاع."
"3785","4","2b3220b2-294e-4f52-9687-c3c75ddef9c7","11","deposit","171637.15","2025-05-12T23:53:31.144Z","عادة الموجة بعيد السماع أفعل بشكل."
"3786","2","962bf6f6-2579-4e29-a560-cffb0ab5636b","25","deposit","900876.6","2025-05-13T10:05:45.839Z","الحضارة الملابس المعجل معظم."
"3787","2","30a966ef-3aef-4c6c-b4a4-92aa218b318f","14","discount","248643.95","2025-05-13T17:41:23.354Z","بوق أين يفحص ألحق."
"3788","1","f332130d-1973-437e-989c-ee33d384be15","18","withdraw","196123.79","2025-05-13T17:17:17.982Z","جرس من معبد."
"3789","3","2c9da0e7-c032-444c-b643-121c4c395f60","2","discount","228715.63","2025-05-13T06:58:30.304Z","يسلم رأس أي الغرفة قبلت يأسر قبول ذراع الريح."
"3790","4","2b3220b2-294e-4f52-9687-c3c75ddef9c7","11","discount","957650.41","2025-05-13T03:09:59.981Z","النفخ طريق زال."
"3791","5","9dea6436-b5cd-4cd6-b546-b9058bde0d0d","20","deposit","144669.46","2025-05-13T05:12:17.317Z","سبب فضول دعوى بقدر المحسن يأسر أكون أكون."
"3792","5","8a1f0c2c-36fb-47c7-918c-1b6386b82b54","1","withdraw","978234.89","2025-05-13T04:36:18.916Z","أعلق مستمع ماشية المدفأة يكتسب جهاز فاجأ يقارن إنها دعه."
"3793","3","2c9da0e7-c032-444c-b643-121c4c395f60","2","withdraw","79146.3","2025-05-13T13:56:38.809Z","أذن فقير السرج الوصول."
"3794","3","cc27c8a9-a99f-4cae-9c32-7cfe4f93b9ea","9","discount","110199.11","2025-05-13T14:22:40.166Z","الوصول بالاسفل السرج."
"3795","5","8a1f0c2c-36fb-47c7-918c-1b6386b82b54","1","deposit","908269.21","2025-05-13T07:23:02.788Z","كائن لوم يفعل السجلات قبول ناعم."
"3796","2","77f0aeb1-e784-4233-b5ed-725aa5ff841c","10","withdraw","609786.62","2025-05-13T05:46:45.258Z","الغرفة اضفت أعترف مريح فضائي ساحقة صديق حزين."
"3797","2","96b80634-dfb5-4769-b131-ff259593df47","8","deposit","807805.91","2025-05-13T11:45:29.867Z","العنوان ذراع توربيني مُطبَّق مراعاة فائدة."
"3798","2","e64412f3-bbd7-42d3-b534-e32fd6a12344","7","deposit","288047.15","2025-05-13T03:59:38.710Z","سن برعاية وذلك قوة ينضم بحرص لإختيار بالغ أذن عاقل."
"3799","5","cc83be41-c904-42e1-880f-969edd5c59ed","21","discount","331422.2","2025-05-13T18:19:33.250Z","مرآة كلمة جَذّاب ينام وأود رمي."
"3800","3","01e32a4b-7a37-479f-8118-fc77e2522bdc","19","discount","410022.2","2025-05-13T14:16:42.714Z","مِرفَق إليك فرن بطريقة جَذّاب ذاهب هم مشرق سهم عشاء."
"3801","5","8a1f0c2c-36fb-47c7-918c-1b6386b82b54","1","discount","324920.78","2025-05-13T12:50:57.178Z","الة مدح يتمتع."
"3802","3","6df2e177-2920-4477-8841-7db21d003020","5","discount","350846.34","2025-05-13T09:40:44.794Z","الجناح الجبر عصفور."
