transaction_id,partner_id,store_id,internal_store_id,transaction_type,amount,amount_platform_commission,transaction_date,notes
"2519","6","c5ca28a6-daca-4ca6-b69c-ea651ec6fce7","13","discount","190503.84","19050.384","2025-05-20T20:58:37.486Z","إضافي صغير كتف يعرفون."
"2520","1","b8817740-801d-447d-b06e-ffa40fc47cd6","5","deposit","360225.79","36022.579","2025-05-21T00:10:14.777Z","يلاحظ مربع جرس القليل."
"2521","3","8acd48d7-90d7-4dc9-922e-cc30744dbc4e","23","discount","649242.3","64924.23","2025-05-21T03:01:35.339Z","عباس يبحث ايام ابن الكل."
"2522","6","9361d272-2f4a-4d82-9103-83ff91fdbcff","3","discount","842215.55","84221.55500000001","2025-05-20T22:37:12.929Z","هواء يتحقق سوف."
"2523","3","c5ea39ac-aea0-4ec7-96dd-5ac8578de5c1","8","withdraw","268647.27","26864.727000000003","2025-05-20T22:05:05.856Z","مزيج أتفق خزانة امن."
"2524","3","8acd48d7-90d7-4dc9-922e-cc30744dbc4e","23","deposit","34036.46","3403.6459999999997","2025-05-20T21:02:13.027Z","اجل مهدئ ل رقبة يتدحرج رمي باهظ."
"2525","3","eedddfb1-7bfc-4de8-93f9-a2b08d928eca","7","withdraw","208171.98","20817.198","2025-05-21T06:11:45.442Z","مأخوذ أوافق كيك قبل."
"2526","4","1ed59d90-52f8-40b0-85a3-0fd936236ca9","24","discount","479856.25","47985.625","2025-05-21T05:39:35.882Z","جيد خشن يبدو نفع رماد آتي يدق مهد حزينين."
"2527","1","186d743e-3e9c-43b7-85aa-f089298a0aa9","4","deposit","704157.05","70415.705","2025-05-21T06:36:03.107Z","لوت أميل الناس قال تحت بعنف النفخ مع."
"2528","6","1394a8cb-e88e-48ce-9fc5-c6732abf2fdb","9","withdraw","999072.41","99907.24100000001","2025-05-21T03:24:59.230Z","أساس فوق باهظ أشياء اضفت تملق سهل أشياء السرج."
"2529","3","c5ea39ac-aea0-4ec7-96dd-5ac8578de5c1","8","discount","176657.87","17665.787","2025-05-21T06:10:05.630Z","نائب الكل تملق."
"2530","3","7cb68b97-a7ae-4acf-b669-7e20b6e501ad","19","withdraw","691185.11","69118.511","2025-05-20T17:57:22.646Z","أغطي اكثر يقام أغنية بشكل."
"2531","5","1055a1e9-b52f-4209-8a66-5f489f73bebb","22","deposit","596867.63","59686.763","2025-05-21T05:11:02.360Z","رأى أعتقد متع مجمع ذراع سيل سيل بداهة أقترح لوت."
"2532","1","06a97fb2-838b-4060-8fff-799663e53f31","21","deposit","836663.02","83666.302","2025-05-21T01:50:09.577Z","سيصيبني قليل عزيزي أعيش اخر ملعقة مع معك."
"2533","5","1ef452d3-ba25-4ed6-908b-0a7b523a1350","14","withdraw","33941.61","3394.161","2025-05-20T20:04:22.383Z","يتبنى لأن قديم واحد ثالاسانوس التي ذيل."
"2534","3","2cb56510-2ea7-40fe-be56-2f07b3267606","26","discount","303981.58","30398.158000000003","2025-05-21T04:19:29.728Z","أمان أدوس كومة."
"2535","6","dfe59ac2-9d52-4815-902f-43c4426470a2","17","deposit","10663.56","1066.356","2025-05-20T15:12:13.840Z","ماء يصدق فاجأ المختارون."
"2536","5","00c6a871-dcc5-458a-b59c-6f14fc89e385","6","discount","154640.95","15464.095000000001","2025-05-21T02:34:39.552Z","قادم إذا كوب السماع بالكاد المرسول."
"2537","5","00c6a871-dcc5-458a-b59c-6f14fc89e385","6","deposit","586992.44","58699.24399999999","2025-05-20T15:25:24.851Z","مرات مواطن وسيم."
"2538","2","b1bccddd-8c55-496a-8ecf-f6b02b78e576","16","withdraw","275412.18","27541.218","2025-05-20T19:32:00.005Z","سيل التسلق ناعم أطير اسمنت."
"2539","3","eedddfb1-7bfc-4de8-93f9-a2b08d928eca","7","withdraw","444219.74","44421.974","2025-05-21T05:13:38.312Z","عليه تصويت مشط انتصار."
"2540","1","cd95745d-43ff-4815-a47e-d7a7662863ff","12","discount","124610.16","12461.016","2025-05-21T02:01:19.080Z","سلسلة جمال مشهور صدقة فارغ مقبول متطور نَسِيج معظم."
"2541","5","1ef452d3-ba25-4ed6-908b-0a7b523a1350","14","deposit","787277.54","78727.754","2025-05-20T14:16:00.642Z","فيما الفائز عالميا أعترف رياح يمارس آكل أحسن."
"2542","2","47d1ef8e-6265-444f-9e10-c5f690f2d146","1","withdraw","517062.03","51706.203","2025-05-20T23:25:10.510Z","رمي أنت حجرة اخماد انزعها أخرى خزانة الحمامات اقف طعام."
"2543","1","186d743e-3e9c-43b7-85aa-f089298a0aa9","4","deposit","594997.75","59499.775","2025-05-20T22:17:57.715Z","يكلف الشفق أتذكر صديق قف بحكمة يبدو يقلق إنني."
"2544","6","1394a8cb-e88e-48ce-9fc5-c6732abf2fdb","9","withdraw","902489.36","90248.936","2025-05-21T03:54:49.113Z","سن سليم الكل."
"2545","6","9361d272-2f4a-4d82-9103-83ff91fdbcff","3","discount","102051.35","10205.135","2025-05-20T14:13:53.134Z","مستمع مائة لذلك مرحبا يستوعب."
"2546","1","186d743e-3e9c-43b7-85aa-f089298a0aa9","4","deposit","513629.12","51362.912","2025-05-21T08:26:36.333Z","متطوع مبتذلة المد بالطبع."
"2547","3","8acd48d7-90d7-4dc9-922e-cc30744dbc4e","23","discount","967708.8","96770.88","2025-05-20T16:25:35.818Z","الرافض الوصول ماذا."
"2548","1","cd95745d-43ff-4815-a47e-d7a7662863ff","12","withdraw","522615.6","52261.56","2025-05-20T20:25:59.936Z","هو يقفز كرامة الثعالب العمل يبحث قبل ديون."
"2549","3","f9b98118-c29d-416b-8042-2f7441c1be61","2","withdraw","32190.76","3219.076","2025-05-20T16:22:18.692Z","حسنة الإحسان مختفي زحف فضيلة."
"2550","3","f9b98118-c29d-416b-8042-2f7441c1be61","2","discount","994611.2","99461.12","2025-05-21T01:16:30.922Z","توربيني الغزل تصدع."
"2551","3","7cb68b97-a7ae-4acf-b669-7e20b6e501ad","19","deposit","837159.52","83715.952","2025-05-21T06:03:06.477Z","امن أعترف ذهب متى جاذبية الاقتراع شراب."
"2552","1","06a97fb2-838b-4060-8fff-799663e53f31","21","discount","399190.04","39919.004","2025-05-20T22:06:26.813Z","يأتي المحسن إيداع متطابقة."
"2553","6","b5be6eaa-7747-4707-934b-a9ac9671a1d3","25","deposit","119244.58","11924.458","2025-05-21T03:44:55.644Z","جداً آمل حلاق."
"2554","5","da3156cf-60e4-4978-beaf-a3fed77cd6a7","10","deposit","377188.91","37718.890999999996","2025-05-20T14:45:23.256Z","إنه الملابس أسلم اجلس لو."
"2555","6","dfe59ac2-9d52-4815-902f-43c4426470a2","17","withdraw","520816.19","52081.619","2025-05-20T22:16:22.047Z","منطقة يقي حزن مرهق تقطر برعاية عالميا انتصار زال بالكاد."
"2556","1","ba63ad31-b90a-4291-a438-c0e53fb46692","15","discount","989254.85","98925.485","2025-05-20T20:59:11.496Z","اقف له متساوي ملاك."
"2557","2","47d1ef8e-6265-444f-9e10-c5f690f2d146","1","withdraw","85565.57","8556.557","2025-05-20T12:14:58.518Z","ايقاد المرونة الطريق كارثة السجلات رقابة إعجاب عصا فارغ القيء."
"2558","5","1ba1157f-48f2-46c3-b4d3-bcc47c1af231","20","discount","600788.65","60078.865000000005","2025-05-20T21:39:06.854Z","يغني يتردد أقدر أقوي يرتقع ألحق موافق الترحيل يبعد."
"2559","6","1394a8cb-e88e-48ce-9fc5-c6732abf2fdb","9","withdraw","628063.25","62806.325","2025-05-20T22:19:36.348Z","أبدي حال شراب احب صحيح حزين."
"2560","1","cd95745d-43ff-4815-a47e-d7a7662863ff","12","discount","68495.64","6849.564","2025-05-20T18:17:07.928Z","جري استطيع شيأ الإحسان امراء معبد محكمة المنشئ أقسم."
"2561","4","1ed59d90-52f8-40b0-85a3-0fd936236ca9","24","deposit","827238.82","82723.882","2025-05-20T17:48:26.715Z","حذاء بهجة حقيقي باقية الوادي مربع لماذا خجول يتمتع ابن."
"2562","6","dfe59ac2-9d52-4815-902f-43c4426470a2","17","withdraw","214279.04","21427.904000000002","2025-05-21T04:22:57.499Z","اضع ذلك سمة حزين الفائز عليه."
"2563","4","1ed59d90-52f8-40b0-85a3-0fd936236ca9","24","deposit","32695.38","3269.538","2025-05-21T02:26:07.216Z","أتذكر العاشر ذهبي الأليف متأخر ما."
"2564","3","eedddfb1-7bfc-4de8-93f9-a2b08d928eca","7","deposit","138092.65","13809.265","2025-05-21T01:49:43.791Z","يرتقع بعيد المرونة متشوق يقرر مشرق يفضل لا شمس راحة."
"2565","5","da3156cf-60e4-4978-beaf-a3fed77cd6a7","10","deposit","369452.81","36945.281","2025-05-20T16:51:22.168Z","أطلق كثيرة ألفت."
"2566","1","186d743e-3e9c-43b7-85aa-f089298a0aa9","4","discount","777637.58","77763.758","2025-05-21T09:43:21.137Z","خفض لون أخضر دعه وَرَاءَ بلطف أقول اكثر مرحبًا."
"2567","1","ba63ad31-b90a-4291-a438-c0e53fb46692","15","deposit","626000.22","62600.022","2025-05-20T16:19:30.767Z","تاج أحب عشر فيما شروط ويل عالميا ماء يوم."
"2568","3","7cb68b97-a7ae-4acf-b669-7e20b6e501ad","19","deposit","16059.17","1605.917","2025-05-21T09:51:31.230Z","عمل الماء صحيح مثل."
"2569","6","c5ca28a6-daca-4ca6-b69c-ea651ec6fce7","13","withdraw","965528.08","96552.80799999999","2025-05-20T14:39:41.244Z","حذر أبداً آخرون ضيق راحة القوي بالفعل ممتع السرج ذاهب."
"2570","2","b1bccddd-8c55-496a-8ecf-f6b02b78e576","16","deposit","351752.96","35175.296","2025-05-21T02:29:59.174Z","أساس أحمل قيد سبب الأساسي اشرب التي."
"2571","3","8acd48d7-90d7-4dc9-922e-cc30744dbc4e","23","deposit","273326.98","27332.697999999997","2025-05-21T08:09:24.125Z","مدهش حقا المقصود جسم."
"2572","3","7cb68b97-a7ae-4acf-b669-7e20b6e501ad","19","withdraw","463151.75","46315.175","2025-05-20T18:04:35.096Z","عاقل اسم طريق اخترت غير."
"2573","5","1ef452d3-ba25-4ed6-908b-0a7b523a1350","14","discount","118027.47","11802.747","2025-05-20T17:32:42.256Z","قليل مدهش الإحسان سبورة رابطة بكمل ايام سبورة إضافي."
"2574","5","1055a1e9-b52f-4209-8a66-5f489f73bebb","22","withdraw","331438.17","33143.816999999995","2025-05-20T23:20:25.620Z","ثلاثون ماذا إنني متع."
"2575","6","1394a8cb-e88e-48ce-9fc5-c6732abf2fdb","9","withdraw","510046.65","51004.665","2025-05-20T11:50:07.452Z","شريك الذي أخيرا بأغلبية متأثر النزاع نستنتج عدالة حقيقة."
"2576","2","47d1ef8e-6265-444f-9e10-c5f690f2d146","1","deposit","333042.46","33304.246","2025-05-20T16:15:37.831Z","أدافع خزان الطريق وسعنا كشط رابطة تدليك عمر كاحل."
"2577","1","b8817740-801d-447d-b06e-ffa40fc47cd6","5","deposit","107807.29","10780.729","2025-05-20T19:04:35.855Z","أدوس مادة صداقة اقول احترام أمشي تحت سبورة السماع."
"2578","5","1ba1157f-48f2-46c3-b4d3-bcc47c1af231","20","deposit","145771.39","14577.139000000001","2025-05-20T15:32:48.748Z","يفترض أحمل نعسان متطابقة."
"2579","5","00c6a871-dcc5-458a-b59c-6f14fc89e385","6","withdraw","777030.11","77703.011","2025-05-20T19:29:13.805Z","مثل مستمر أثاث صبرا."
"2580","3","8acd48d7-90d7-4dc9-922e-cc30744dbc4e","23","deposit","425045.14","42504.514","2025-05-20T17:35:39.754Z","بالفعل ادافع اهداء بالغ صامت صوت."
"2581","3","8acd48d7-90d7-4dc9-922e-cc30744dbc4e","23","discount","653022.86","65302.286","2025-05-20T22:15:48.894Z","مدينة هو أساس وقت محكمة أسقط فضول."
"2582","4","1ed59d90-52f8-40b0-85a3-0fd936236ca9","24","discount","217407.92","21740.792","2025-05-21T09:12:06.046Z","واع ينظف وَسَط اللطف يفعل."
"2583","6","c5ca28a6-daca-4ca6-b69c-ea651ec6fce7","13","deposit","2798.76","279.87600000000003","2025-05-20T22:19:03.716Z","شهرة العليا متع مجال العمل اشرب طباشير زال."
"2584","2","b1bccddd-8c55-496a-8ecf-f6b02b78e576","16","deposit","229299.57","22929.957000000002","2025-05-20T17:46:05.896Z","مسرح آدم طويل مبروك."
"2585","6","b5be6eaa-7747-4707-934b-a9ac9671a1d3","25","discount","822527.21","82252.72099999999","2025-05-20T21:07:10.181Z","التفاضل حاضر صلب عليه رأس الحقيقة جار سماء برونز التشقلب."
"2586","5","da3156cf-60e4-4978-beaf-a3fed77cd6a7","10","withdraw","824574.22","82457.42199999999","2025-05-20T12:28:49.105Z","خادمة ساحقة عصفور معتاد يناسب خزان الحمامات."
"2587","6","dfe59ac2-9d52-4815-902f-43c4426470a2","17","deposit","20484.45","2048.445","2025-05-21T00:11:27.662Z","الجاد أحسن واع اناقش مكعب."
"2588","6","dfe59ac2-9d52-4815-902f-43c4426470a2","17","discount","384223.75","38422.375","2025-05-21T07:43:51.569Z","الجميع يستثني يصدق أقدر رياح اعتدال."
"2589","3","f9b98118-c29d-416b-8042-2f7441c1be61","2","deposit","347106.62","34710.662","2025-05-21T06:48:28.278Z","يمارس مال جهاز إنني صداقة يساهم."
"2590","6","c5ca28a6-daca-4ca6-b69c-ea651ec6fce7","13","withdraw","611904.64","61190.464","2025-05-21T06:33:27.415Z","والتكامل الحال احترام حامض مرهق عير تصدع قديم بقرة."
"2591","6","c5ca28a6-daca-4ca6-b69c-ea651ec6fce7","13","deposit","365249.34","36524.934","2025-05-20T17:09:51.824Z","أجوف الرقص دورة."
"2592","1","cd95745d-43ff-4815-a47e-d7a7662863ff","12","discount","354355.15","35435.515","2025-05-20T12:45:56.417Z","الثعالب هذا أحاول يتدحرج كلب مصطنع سمة الكبرى أوزة ممتع."
"2593","1","ba63ad31-b90a-4291-a438-c0e53fb46692","15","deposit","502938.21","50293.821","2025-05-20T17:26:23.865Z","ثقافة جهاز سمحت برعاية صريح مؤلف حضري منجلي مرسوم سيصيبني."
"2594","6","9361d272-2f4a-4d82-9103-83ff91fdbcff","3","deposit","812970.66","81297.066","2025-05-21T08:57:50.405Z","يحفظ ديكور قَوس مربع مؤلف."
"2595","3","2cb56510-2ea7-40fe-be56-2f07b3267606","26","withdraw","111624.67","11162.467","2025-05-20T15:07:05.381Z","آكل آكل صريح."
"2596","3","8acd48d7-90d7-4dc9-922e-cc30744dbc4e","23","deposit","232373.7","23237.370000000003","2025-05-21T03:49:17.227Z","بدأت فن جاذبية العنكبوت مخزون."
"2597","3","8acd48d7-90d7-4dc9-922e-cc30744dbc4e","23","deposit","304588.31","30458.831","2025-05-21T07:17:43.100Z","متع منحنى آخر نجح مقبول."
"2598","1","ba63ad31-b90a-4291-a438-c0e53fb46692","15","withdraw","914654.21","91465.421","2025-05-20T20:45:43.554Z","يبعد جاذبية الملابس زعتر."
"2599","6","b5be6eaa-7747-4707-934b-a9ac9671a1d3","25","deposit","119144.77","11914.477","2025-05-20T12:54:13.859Z","هو احصل آتي ثقافة عير مدح ليّن متساوي ملاك بِكر."
"2600","5","1ef452d3-ba25-4ed6-908b-0a7b523a1350","14","deposit","714156.75","71415.675","2025-05-20T21:45:00.748Z","لكن أظن أتفق إنها فقير اسم جهد إليك كنز أعتقد."
"2601","6","b5be6eaa-7747-4707-934b-a9ac9671a1d3","25","withdraw","451492.1","45149.21","2025-05-20T19:12:14.608Z","عباس النفخ بالفعل بطريقة أعلن اخذت."
"2602","1","186d743e-3e9c-43b7-85aa-f089298a0aa9","4","deposit","254194.2","25419.420000000002","2025-05-20T20:56:56.243Z","نظيف عضوية دور منهم مدح نائب نهاية عجز الوصول."
"2603","6","b5be6eaa-7747-4707-934b-a9ac9671a1d3","25","deposit","711126.8","71112.68000000001","2025-05-21T09:28:10.382Z","مثاب علاج الجبر."
"2604","3","7cb68b97-a7ae-4acf-b669-7e20b6e501ad","19","deposit","539878.26","53987.826","2025-05-21T01:37:49.524Z","متماسك موافق إنه إيداع سليم حقيقي ويل اضع مستمر الجنون."
"2605","3","8acd48d7-90d7-4dc9-922e-cc30744dbc4e","23","withdraw","554494.11","55449.411","2025-05-20T15:01:05.230Z","أقسم السماع جهاز الرقص مدهش صدوق الشفق مريح مهدئ."
"2606","3","f9b98118-c29d-416b-8042-2f7441c1be61","2","discount","238582.84","23858.284","2025-05-20T13:16:48.861Z","وُلِدّ مقرر سلب تدوس."
"2607","5","00c6a871-dcc5-458a-b59c-6f14fc89e385","6","deposit","843736.27","84373.62700000001","2025-05-20T15:06:43.435Z","الاستخدام يسامح يستوعب."
"2608","3","eedddfb1-7bfc-4de8-93f9-a2b08d928eca","7","discount","417773.13","41777.313","2025-05-21T02:48:04.591Z","التشقلب تصدع مؤلف تذوق المحسن بالرغم السترة ديكور."
"2609","6","9361d272-2f4a-4d82-9103-83ff91fdbcff","3","deposit","915957.57","91595.757","2025-05-20T14:38:24.516Z","تماثيل أحمل انزعها مال أَخَّاذ."
"2610","3","5e962467-ee7d-4204-840e-cbc4a1239861","18","deposit","875593.71","87559.371","2025-05-21T03:29:15.976Z","شروط مشين تكون يقلق يصدق أتذكر كشط تصويت نسج."
"2611","3","c5ea39ac-aea0-4ec7-96dd-5ac8578de5c1","8","withdraw","410599.7","41059.97","2025-05-20T15:37:48.252Z","السرج الأمل ثلاث كائن يناسب حامض المقصود."
"2612","3","8acd48d7-90d7-4dc9-922e-cc30744dbc4e","23","discount","944526.25","94452.625","2025-05-21T05:48:49.951Z","اقف يدق رقبة مشرق غرفة تم."
"2613","1","ba63ad31-b90a-4291-a438-c0e53fb46692","15","deposit","782343.52","78234.352","2025-05-20T12:51:46.364Z","مكان أكون خادمة شرط."
"2614","5","da3156cf-60e4-4978-beaf-a3fed77cd6a7","10","deposit","641495.01","64149.501000000004","2025-05-20T21:39:40.739Z","اسم مختفي المعجل حضن قَوس عير فوق التفاضل متوسط."
"2615","3","2cb56510-2ea7-40fe-be56-2f07b3267606","26","discount","606898.04","60689.804000000004","2025-05-20T21:12:48.728Z","جهاز ل الحياة متأخر ملائم أساس اغادر ينتقد آلام معركة."
"2616","2","b1bccddd-8c55-496a-8ecf-f6b02b78e576","16","withdraw","223768.07","22376.807","2025-05-21T07:58:54.521Z","بطريقة ايام خشن خط."
"2617","3","f9b98118-c29d-416b-8042-2f7441c1be61","2","deposit","845234.81","84523.481","2025-05-20T11:07:01.991Z","زال لذلك غالباً واحد شجيرة الجانبين معتاد ألم الوصاية."
"2618","2","b1bccddd-8c55-496a-8ecf-f6b02b78e576","16","withdraw","508320.3","50832.03","2025-05-20T12:35:17.469Z","عنوان عصفور مستمع آمل يأخذ كوب الذات."
"2619","6","9361d272-2f4a-4d82-9103-83ff91fdbcff","3","withdraw","435866.26","43586.626000000004","2025-05-21T03:51:45.994Z","الريح حال نعسان رقبة نحن الترحيل الملابس نتهم فضول صامت."
"2620","1","06a97fb2-838b-4060-8fff-799663e53f31","21","discount","864460.8","86446.08","2025-05-20T22:47:54.887Z","حبيب عن تاج مختفي ضد يقدموا رأس يلائم نهاية."
"2621","3","2cb56510-2ea7-40fe-be56-2f07b3267606","26","deposit","687841.09","68784.109","2025-05-20T15:11:49.549Z","الخصم بجوار على لك مجال أعلن ديون حسنًا."
"2622","3","8acd48d7-90d7-4dc9-922e-cc30744dbc4e","23","discount","742536.11","74253.611","2025-05-20T17:05:55.622Z","بطريقة جهد غالباً مجمع صامت منحنى خفض يحضر."
"2623","6","1394a8cb-e88e-48ce-9fc5-c6732abf2fdb","9","discount","136928.21","13692.821","2025-05-21T01:30:27.120Z","جداً قوي الثعالب."
"2624","5","da3156cf-60e4-4978-beaf-a3fed77cd6a7","10","withdraw","163965.93","16396.593","2025-05-21T10:03:32.975Z","ضيق رماد ل مال إنه الثعالب ثقافة التي."
"2625","6","b5be6eaa-7747-4707-934b-a9ac9671a1d3","25","withdraw","984373.96","98437.396","2025-05-21T05:31:12.970Z","صبرا بلطف عريض غداً من الحقيقة المنشئ."
"2626","3","7cb68b97-a7ae-4acf-b669-7e20b6e501ad","19","discount","913977.87","91397.787","2025-05-20T15:03:21.646Z","بلدة يلمس معركة."
"2627","2","47d1ef8e-6265-444f-9e10-c5f690f2d146","1","discount","574441.82","57444.18199999999","2025-05-20T19:30:37.881Z","بعنف انهم شعر فقير يستوعب."
"2628","5","1ef452d3-ba25-4ed6-908b-0a7b523a1350","14","withdraw","925577.95","92557.795","2025-05-20T18:44:29.163Z","أسمع يعبر ثقافة."
"2629","3","f9b98118-c29d-416b-8042-2f7441c1be61","2","deposit","747367.76","74736.776","2025-05-21T05:15:42.057Z","ملاك لوم منتصف ما."
"2630","1","ba63ad31-b90a-4291-a438-c0e53fb46692","15","deposit","264282.23","26428.222999999998","2025-05-21T08:31:42.660Z","يقلق صدوق ليونة بدانة مع لكن بعيد كل محكمة."
"2631","6","b5be6eaa-7747-4707-934b-a9ac9671a1d3","25","discount","429290.71","42929.071","2025-05-21T10:21:56.942Z","يستثني ذهبي ملائم نكون الماء."
"2632","6","1394a8cb-e88e-48ce-9fc5-c6732abf2fdb","9","withdraw","60122.48","6012.2480000000005","2025-05-21T06:48:31.612Z","الكل تجريبي الناس."
"2633","3","7cb68b97-a7ae-4acf-b669-7e20b6e501ad","19","discount","549402.33","54940.23299999999","2025-05-21T08:15:17.398Z","يتردد شهرة بكثرة يكون."
"2634","6","1394a8cb-e88e-48ce-9fc5-c6732abf2fdb","9","discount","382362.28","38236.228","2025-05-21T07:43:47.198Z","يقي شاب دولة مستقر أمشي خشن الجناح متى كائن."
"2635","5","da3156cf-60e4-4978-beaf-a3fed77cd6a7","10","discount","788487.09","78848.709","2025-05-21T05:06:53.930Z","مدهش خطة يقرر يوم الفصل."
"2636","2","b1bccddd-8c55-496a-8ecf-f6b02b78e576","16","discount","548395.44","54839.543999999994","2025-05-21T10:08:38.781Z","لجأ يسلم تحمل سليم."
"2637","1","cd95745d-43ff-4815-a47e-d7a7662863ff","12","withdraw","125625.48","12562.547999999999","2025-05-20T23:33:41.256Z","غائب خلف سليم."
"2638","3","8acd48d7-90d7-4dc9-922e-cc30744dbc4e","23","discount","618075.9","61807.590000000004","2025-05-20T21:12:03.453Z","فقير أوافق أب سمحت عالميا يزيل الحال آتي."
"2639","6","1394a8cb-e88e-48ce-9fc5-c6732abf2fdb","9","deposit","338420.01","33842.001000000004","2025-05-20T15:19:15.503Z","رجولي اقتراح مرحبًا ذراع صالح أدير المسالك."
"2640","5","1ba1157f-48f2-46c3-b4d3-bcc47c1af231","20","deposit","208736.75","20873.675","2025-05-21T05:37:31.847Z","ملموس كثيرة إخلاء أحمل ثلاثة ملائم شيأ قال سرور يلائم."
"2641","6","1394a8cb-e88e-48ce-9fc5-c6732abf2fdb","9","withdraw","781530.83","78153.083","2025-05-21T01:45:56.899Z","منتصف ايام فضيلة إبعاد عشر فضة."
"2642","1","cd95745d-43ff-4815-a47e-d7a7662863ff","12","withdraw","541218.12","54121.812","2025-05-20T20:22:21.154Z","ينضم أسود تحميل بحرص يأتي هؤلاء مساء قَوس نقود."
"2643","6","1394a8cb-e88e-48ce-9fc5-c6732abf2fdb","9","deposit","516689.44","51668.944","2025-05-21T07:54:58.173Z","اكثر برودة يستوعب ينظر نجح رعاية يتدحرج كان عمل."
"2644","6","1394a8cb-e88e-48ce-9fc5-c6732abf2fdb","9","withdraw","359273.49","35927.349","2025-05-21T00:23:06.372Z","أقل صدقة شروط امن يسامح حامض تماثيل الفراء سماء."
"2645","3","2cb56510-2ea7-40fe-be56-2f07b3267606","26","deposit","934204.42","93420.44200000001","2025-05-21T09:09:22.103Z","أخرى صحة يوضح يتردد المنشئ باهظ تصويت حقا."
"2646","2","47d1ef8e-6265-444f-9e10-c5f690f2d146","1","withdraw","333606.87","33360.687","2025-05-21T10:05:26.444Z","مجموعة بسرعة أعتقد الوصاية مخزون تحميل."
"2647","5","1055a1e9-b52f-4209-8a66-5f489f73bebb","22","discount","235763.77","23576.377","2025-05-20T20:55:52.667Z","مفيد المحسنات يكون خطة نكون الطريق أقول الوصول مزيج ضد."
"2648","1","40f869cb-350c-4f36-940c-1735da09e52c","11","withdraw","97244.37","9724.437","2025-05-21T08:31:32.544Z","المسالك بالرغم طعام فرن مع."
"2649","5","da3156cf-60e4-4978-beaf-a3fed77cd6a7","10","deposit","182833.46","18283.345999999998","2025-05-20T12:56:54.317Z","كرس باستمرار حق يضحك يزيل ثالث مريح."
"2650","5","1055a1e9-b52f-4209-8a66-5f489f73bebb","22","discount","9152.12","915.2120000000001","2025-05-21T02:05:18.723Z","يقي تواصل راحة يضحك فريق جمع أوزة صحيح."
"2651","6","1394a8cb-e88e-48ce-9fc5-c6732abf2fdb","9","deposit","924994.97","92499.497","2025-05-21T05:45:52.718Z","مواطن نَسِيج تملق نكون ضد الفصل جرس مستقر أبدًا المحسنات."
"2652","5","1ef452d3-ba25-4ed6-908b-0a7b523a1350","14","discount","20283.24","2028.324","2025-05-21T05:12:58.714Z","المرونة حلها طالب."
"2653","6","9361d272-2f4a-4d82-9103-83ff91fdbcff","3","discount","675348.51","67534.851","2025-05-20T23:49:21.504Z","احصل عنوان يدفع شعر أعترف السترة مفيد ماهر بأغلبية عجز."
"2654","5","1055a1e9-b52f-4209-8a66-5f489f73bebb","22","discount","247730.98","24773.098","2025-05-21T01:18:43.510Z","آمل سليم لطيف الشفق منتج يفحص عزيزتي الكل تبني كرامة."
"2655","1","186d743e-3e9c-43b7-85aa-f089298a0aa9","4","deposit","448539.06","44853.906","2025-05-21T09:20:39.095Z","السترة دواء يفصل."
"2656","1","b8817740-801d-447d-b06e-ffa40fc47cd6","5","discount","404899.79","40489.979","2025-05-20T18:02:09.239Z","كرس فليكن ماذا عدد."
"2657","1","b8817740-801d-447d-b06e-ffa40fc47cd6","5","withdraw","128722.44","12872.244","2025-05-20T12:03:24.875Z","منتصف تواصل أفتقد سريع أركل يهمني."
"2658","1","cd95745d-43ff-4815-a47e-d7a7662863ff","12","deposit","407984.61","40798.460999999996","2025-05-20T22:33:35.088Z","كل هم انزعها كارثة ذهبي خيره."
