transaction_id,partner_id,store_id,internal_store_id,transaction_type,amount,transaction_date,notes
"2442","1","f79e0d2a-6bb6-4634-be8c-f25330f9ff88","15","deposit","57193.99","2025-05-13T17:30:24.864Z","منهم ماهر آمل كشط محبوب معماري أخرى."
"2443","3","cc27c8a9-a99f-4cae-9c32-7cfe4f93b9ea","9","withdraw","79011.81","2025-05-13T09:38:41.625Z","العائلة سيصيبني معركة مواطن واسع كاحل يساعد ثابت ليّن."
"2444","6","b715432a-113d-45f7-8330-a7a02bafcd79","26","withdraw","542026.48","2025-05-13T10:22:55.564Z","أوزة حب بالكاد ألحق."
"2445","2","1c2063fe-e9a9-49aa-8e07-1d2d3d3135d9","22","deposit","548692.59","2025-05-13T07:39:02.137Z","أخت أقسم يدفع بقدر الوصول المحسن."
"2446","6","883ea3c2-8134-4a57-a356-7e437f2f5105","13","deposit","576160.32","2025-05-12T19:50:58.408Z","اقف سلب مشرق صداقة القليل."
"2447","6","b715432a-113d-45f7-8330-a7a02bafcd79","26","withdraw","988552.56","2025-05-12T22:14:08.312Z","بهجة أخت ويل موافق وظائف ديكور حصلت إيداع."
"2448","6","883ea3c2-8134-4a57-a356-7e437f2f5105","13","discount","66814.02","2025-05-13T14:49:30.782Z","يحفظ أي محل معك اقرر الوادي."
"2449","1","4742e4af-77fe-4e0d-818e-20c52c134eae","23","deposit","536263.61","2025-05-12T19:42:31.289Z","برعاية هم ديكور القوي ينام."
"2450","2","1c2063fe-e9a9-49aa-8e07-1d2d3d3135d9","22","withdraw","303845.73","2025-05-13T13:19:31.117Z","مفيد دولة ادافع مثل خجول عمة."
"2451","5","9dea6436-b5cd-4cd6-b546-b9058bde0d0d","20","withdraw","274899.4","2025-05-13T16:44:37.221Z","نتيجة يقرر آلام يقود."
"2452","3","2c9da0e7-c032-444c-b643-121c4c395f60","2","deposit","511616.48","2025-05-13T06:58:23.824Z","رسمي حصلت ملكنا زوجة حقا رياح السماوي هنا ينتقد لطيف."
"2453","5","cc83be41-c904-42e1-880f-969edd5c59ed","21","deposit","344722.15","2025-05-13T15:17:25.027Z","يفتح يكتسب حياة."
"2454","2","1c2063fe-e9a9-49aa-8e07-1d2d3d3135d9","22","withdraw","456761.9","2025-05-13T14:35:59.903Z","احب عالي إبعاد مهارات يقرر متى نحن إعجاب."
"2455","1","f332130d-1973-437e-989c-ee33d384be15","18","discount","941379.94","2025-05-12T22:57:30.841Z","مجموع التسلق رسغ كثيرة عزيزتي يقولون يقفز يتقدم."
"2456","1","255236cf-98e5-4bf5-b282-cc3ef02ae9f1","6","discount","122221.99","2025-05-13T13:45:01.437Z","أسلم مدهش الأليف صيف سمحت."
"2457","5","8a1f0c2c-36fb-47c7-918c-1b6386b82b54","1","discount","417668.05","2025-05-12T22:50:19.181Z","يزيل تبني الجسم ايام ملموس يرتفع القوي."
"2458","3","2c9da0e7-c032-444c-b643-121c4c395f60","2","deposit","870952.81","2025-05-13T01:31:12.621Z","صدوق اهداء اضفت لجأ أعلى عادة يتردد بقرة."
"2459","2","1c2063fe-e9a9-49aa-8e07-1d2d3d3135d9","22","withdraw","23097.3","2025-05-13T14:51:39.140Z","رعاية احصل باقية يناسب باتجاه مهدئ فضول."
"2460","2","e64412f3-bbd7-42d3-b534-e32fd6a12344","7","withdraw","932926.78","2025-05-13T16:36:17.943Z","ثالاسانوس حقًا بقرة ماذا أدير شعر الأليف السرج حزن زحف."
"2461","6","883ea3c2-8134-4a57-a356-7e437f2f5105","13","discount","832206.51","2025-05-13T01:35:45.678Z","عمل التفاضل بسرعة."
"2462","6","883ea3c2-8134-4a57-a356-7e437f2f5105","13","discount","814806.05","2025-05-13T12:54:16.121Z","ألم استطيع ثقافة رهيب أسقط."
"2463","2","30a966ef-3aef-4c6c-b4a4-92aa218b318f","14","withdraw","941199.07","2025-05-13T11:57:12.067Z","يحشد تكون حق خلوق مدهش."
"2464","5","9dea6436-b5cd-4cd6-b546-b9058bde0d0d","20","withdraw","855004.98","2025-05-13T02:29:54.997Z","مرارًا شيء احصل."
"2465","6","b715432a-113d-45f7-8330-a7a02bafcd79","26","discount","833123.49","2025-05-13T12:30:07.622Z","معك تعتاد عدالة سهل العنوان تهور نقود ثقافة جمع."
"2466","1","f332130d-1973-437e-989c-ee33d384be15","18","deposit","164014.31","2025-05-13T08:57:55.052Z","آتي نتهم عصا السترة فزت تحميل خادمة يفتح أدير توربيني."
"2467","2","1c2063fe-e9a9-49aa-8e07-1d2d3d3135d9","22","discount","72183.59","2025-05-13T19:00:40.197Z","تملق نجحت عير سلام ثابت يعرفون مواطنون."
"2468","2","778512a9-1763-407b-8f16-1868d3d5738b","16","deposit","661501.58","2025-05-13T06:44:32.384Z","صدوق علي نظيف تواصل كرس نفع."
"2469","1","f79e0d2a-6bb6-4634-be8c-f25330f9ff88","15","discount","324322.61","2025-05-13T09:53:28.357Z","أفتقد عتيق عقل وأود العنوان خطة نجح دعه يصلح."
"2470","3","ccf027ac-5288-4fe1-84c4-82130ed52df8","3","discount","97037.78","2025-05-13T10:50:30.306Z","حجرة اعتدال صبرا جمع الضرورات يساهم ثلاثة وقت."
"2471","5","9dea6436-b5cd-4cd6-b546-b9058bde0d0d","20","deposit","883196.32","2025-05-13T15:44:31.644Z","الضرورات مرآة شيء تحدث هي يوم ويفر عمر يتدحرج."
"2472","6","b715432a-113d-45f7-8330-a7a02bafcd79","26","deposit","585735.88","2025-05-13T02:13:14.725Z","إيداع مربع عم أنت."
"2473","2","e64412f3-bbd7-42d3-b534-e32fd6a12344","7","withdraw","720016.75","2025-05-13T15:10:19.079Z","يلاحظ انعش خاشع مع."
"2474","6","ba9d73ff-19f3-4898-9589-a2a9e66c44a1","12","withdraw","640286.31","2025-05-13T10:06:25.194Z","بأغلبية ساحقة البقية زيادة الثعالب قف موافق المسرح."
"2475","1","4742e4af-77fe-4e0d-818e-20c52c134eae","23","withdraw","632868.65","2025-05-13T07:02:24.299Z","الأمل بلطف خادمة عدد يسامح أَخَّاذ مأخوذ زيادة بوق."
"2476","3","43fdbc4f-9368-4f49-addb-f1ca5385b275","24","deposit","41880.47","2025-05-13T12:46:54.661Z","رأى ناعم كشط صدقة ادافع مرحبا بالفعل."
"2477","2","77f0aeb1-e784-4233-b5ed-725aa5ff841c","10","withdraw","364475.28","2025-05-13T17:25:40.082Z","بيئة السرج أعترف الموجة شيء آكل العليا يساعد أقسى."
"2478","1","1a120ada-8dd5-4b93-a6b0-90a1a0d0022e","17","discount","538785","2025-05-13T03:17:40.894Z","تخمين عمل غائب تماثيل سيصيبني النفخ يوم وفير أرض."
"2479","6","3f59d9ac-e7c7-4ce9-b2a8-88bb8c1b3fa1","4","deposit","860012.34","2025-05-13T00:36:21.271Z","الناس أعتقد بعنف مقابلة الرقص مادة كان السترة."
"2480","6","ba9d73ff-19f3-4898-9589-a2a9e66c44a1","12","discount","3650.73","2025-05-13T15:42:44.727Z","تحميل أحسن دور يصدق لطيف مهدئ."
"2481","5","cc83be41-c904-42e1-880f-969edd5c59ed","21","withdraw","399418.2","2025-05-13T19:25:45.587Z","بهجة مواطنة لوم يشمل إنني يترتب بلطف يفضل."
"2482","2","e64412f3-bbd7-42d3-b534-e32fd6a12344","7","discount","411067.49","2025-05-12T20:20:45.825Z","اتحداك و كنز شمس يتقدم ازعم."
"2483","1","f79e0d2a-6bb6-4634-be8c-f25330f9ff88","15","withdraw","887404.28","2025-05-12T22:54:18.721Z","كان اسم لك جمال اضفت انتصار ينظف مثل قيد انعش."
"2484","5","9dea6436-b5cd-4cd6-b546-b9058bde0d0d","20","deposit","362824.99","2025-05-13T06:11:41.138Z","جمهور اخماد مرسوم تبني الكل وقت مدينة فحم ينتقد."
"2485","2","30a966ef-3aef-4c6c-b4a4-92aa218b318f","14","discount","741163.78","2025-05-13T00:00:43.556Z","الناس كارثة حق سماء سلم."
"2486","3","01e32a4b-7a37-479f-8118-fc77e2522bdc","19","withdraw","351458.78","2025-05-13T10:48:07.160Z","بالباص ساحقة مشهور أرى دولة جمع ايام مواطنون."
"2487","3","43fdbc4f-9368-4f49-addb-f1ca5385b275","24","withdraw","325172.7","2025-05-13T07:55:59.470Z","لذا ألفت السرج اقف."
"2488","6","3f59d9ac-e7c7-4ce9-b2a8-88bb8c1b3fa1","4","withdraw","489348.78","2025-05-13T06:21:41.079Z","جمال القوي آكل."
"2489","6","b715432a-113d-45f7-8330-a7a02bafcd79","26","discount","697472","2025-05-12T21:13:17.300Z","ملل أرى كشط حسنة ممتع شجرة قبلت."
"2490","1","1a120ada-8dd5-4b93-a6b0-90a1a0d0022e","17","deposit","36427.59","2025-05-13T17:16:24.080Z","ثقافة يمسح حقيقة يقلق والنسيج عادة ثالث."
"2491","2","96b80634-dfb5-4769-b131-ff259593df47","8","discount","282176.46","2025-05-13T17:40:23.929Z","زحف سن مخترع أساعد يحذب تحدث الحمدون الناس متطابقة متع."
"2492","2","e64412f3-bbd7-42d3-b534-e32fd6a12344","7","discount","503628.23","2025-05-13T18:40:52.944Z","يقفز مرسوم الذات امراء واع."
"2493","1","255236cf-98e5-4bf5-b282-cc3ef02ae9f1","6","deposit","355428.69","2025-05-12T21:14:24.428Z","جسم اليقظة رأس بعنف كريم جسم نتيجة."
"2494","3","2c9da0e7-c032-444c-b643-121c4c395f60","2","deposit","142240.24","2025-05-13T03:25:10.281Z","يهرب رسغ متع الاستخدام علاج العزلة وسوف."
"2495","1","1a120ada-8dd5-4b93-a6b0-90a1a0d0022e","17","withdraw","436490.24","2025-05-13T05:43:53.819Z","الطريق القيء يصلح يكون أبدًا أفتح الموجة صغير باقية."
"2496","3","2c9da0e7-c032-444c-b643-121c4c395f60","2","withdraw","305422.85","2025-05-13T14:27:24.006Z","لأن أغطي مستقر."
"2497","6","b715432a-113d-45f7-8330-a7a02bafcd79","26","discount","298867.71","2025-05-12T20:30:51.151Z","تماثيل ساحقة ممتع."
"2498","4","2b3220b2-294e-4f52-9687-c3c75ddef9c7","11","discount","557682.04","2025-05-13T04:14:02.050Z","مدهش تجمع مرارًا سلسلة يليق ساطع سير."
"2499","2","30a966ef-3aef-4c6c-b4a4-92aa218b318f","14","deposit","298599.91","2025-05-13T00:15:20.595Z","يفحص شيء كومة."
"2500","2","30a966ef-3aef-4c6c-b4a4-92aa218b318f","14","withdraw","741918.43","2025-05-13T06:58:59.026Z","صالح ساحقة أدافع كتف قف كومة محفوظ النفخ سليم صالح."
"2501","5","8a1f0c2c-36fb-47c7-918c-1b6386b82b54","1","withdraw","780377.69","2025-05-13T19:14:06.662Z","ملل مجال يقام حلاق حسنًا ماء يمسح الرقص نجحت يقلق."
"2502","1","f332130d-1973-437e-989c-ee33d384be15","18","withdraw","92193.19","2025-05-13T02:03:44.993Z","يحب اللطف الطريق بقرة."
"2503","5","9dea6436-b5cd-4cd6-b546-b9058bde0d0d","20","deposit","701873.7","2025-05-13T11:25:38.705Z","كرمة زجاجة يقفز فليكن بدأت يتعقب عزيز أحضر كنيس تجمع."
"2504","2","e64412f3-bbd7-42d3-b534-e32fd6a12344","7","discount","910155.19","2025-05-13T12:56:11.530Z","خفض الحقيقة مكان دخول يصدق."
"2505","3","6df2e177-2920-4477-8841-7db21d003020","5","withdraw","490411.92","2025-05-13T05:05:37.835Z","مواطنة صدقة بسرعة يكلف احب معركة متع الأساسي تهور لوت."
"2506","6","3f59d9ac-e7c7-4ce9-b2a8-88bb8c1b3fa1","4","deposit","579083.1","2025-05-13T17:44:50.717Z","مُطبَّق مواطن على و الموت ينظف تم آلام بأغلبية واحد."
"2507","2","e64412f3-bbd7-42d3-b534-e32fd6a12344","7","deposit","552718.18","2025-05-13T10:21:53.680Z","لا ممتع فاجأ برونز يرتفع مقابلة الجرأة."
"2508","5","9dea6436-b5cd-4cd6-b546-b9058bde0d0d","20","withdraw","532572.01","2025-05-13T11:29:21.568Z","يلائم العنوان عشر اكثر."
"2509","2","e64412f3-bbd7-42d3-b534-e32fd6a12344","7","deposit","994964.06","2025-05-13T08:36:58.539Z","مشهور مدهش عنوان منهم المجلد متطوع قيد مدينة تدليك."
"2510","5","9dea6436-b5cd-4cd6-b546-b9058bde0d0d","20","withdraw","15652.3","2025-05-13T04:53:44.563Z","أكون سنشتاق تعال وَرَاءَ بحرص إعجاب يتحقق."
"2511","2","30a966ef-3aef-4c6c-b4a4-92aa218b318f","14","withdraw","414128.19","2025-05-13T10:35:14.406Z","تحت جداً آلام سير أي أحب النزاع بكثرة."
"2512","6","3f59d9ac-e7c7-4ce9-b2a8-88bb8c1b3fa1","4","discount","68451.08","2025-05-13T11:26:25.250Z","بكثرة تحية أركل رماد يعرفون حب."
"2513","3","43fdbc4f-9368-4f49-addb-f1ca5385b275","24","discount","202424.75","2025-05-13T12:16:55.164Z","سبب ينظر تم."
"2514","1","f79e0d2a-6bb6-4634-be8c-f25330f9ff88","15","discount","880917.92","2025-05-13T02:36:12.059Z","كرمة رأى المسالك ألم الحمامات جرس مخترع يتدحرج."
"2515","5","8a1f0c2c-36fb-47c7-918c-1b6386b82b54","1","withdraw","973211.66","2025-05-13T09:59:11.755Z","إعجاب مرحبًا كوب متطابقة فارغ."
"2516","6","b715432a-113d-45f7-8330-a7a02bafcd79","26","withdraw","127643.55","2025-05-13T17:13:24.544Z","البقية فضائي تحت الذات آمل."
"2517","3","01e32a4b-7a37-479f-8118-fc77e2522bdc","19","discount","138436.46","2025-05-13T00:40:38.812Z","يسلم الأليف اللطف آمن مرسوم منحن."
"2518","3","6df2e177-2920-4477-8841-7db21d003020","5","discount","805312.12","2025-05-13T18:47:15.965Z","ثم سريع ارباح رفض نتهم."
"2519","1","f332130d-1973-437e-989c-ee33d384be15","18","deposit","668950.11","2025-05-13T07:02:44.797Z","متأثر مضت الجناح اجلس أفتقد استراحة غرفة متوسط الغرفة رابطة."
"2520","6","ba9d73ff-19f3-4898-9589-a2a9e66c44a1","12","discount","282213.08","2025-05-12T21:54:46.888Z","حب يسير المحدد بهجة أجبر."
"2521","3","2c9da0e7-c032-444c-b643-121c4c395f60","2","withdraw","708971.2","2025-05-12T21:31:26.669Z","أسمع اقول تعتاد طبقة يحل تريد المسرح أو أوزة."
"2522","6","ba9d73ff-19f3-4898-9589-a2a9e66c44a1","12","discount","457751.29","2025-05-13T08:50:05.715Z","الاقتراع الأساسي ادافع امن."
"2523","2","778512a9-1763-407b-8f16-1868d3d5738b","16","withdraw","284806.66","2025-05-13T05:08:17.913Z","دعه متوسط أثاث يمين العائلة احب يكون أرض نفسها."
"2524","3","43fdbc4f-9368-4f49-addb-f1ca5385b275","24","discount","390007.8","2025-05-13T04:51:22.107Z","الأليف بحكمة حب تستوعب فارغ حضري."
"2525","2","77f0aeb1-e784-4233-b5ed-725aa5ff841c","10","withdraw","167040.59","2025-05-13T07:15:48.716Z","أحسن صيف تكون جيد."
"2526","1","255236cf-98e5-4bf5-b282-cc3ef02ae9f1","6","discount","383350.26","2025-05-13T18:17:04.579Z","ليونة رهيب الجاد."
"2527","1","4742e4af-77fe-4e0d-818e-20c52c134eae","23","withdraw","909678.34","2025-05-13T03:20:13.005Z","أرى الإحسان ملل المختارون."
"2528","1","4742e4af-77fe-4e0d-818e-20c52c134eae","23","discount","294713.78","2025-05-13T01:04:48.204Z","غرفة بأغلبية هم حزينين أدعم الناس."
"2529","3","43fdbc4f-9368-4f49-addb-f1ca5385b275","24","deposit","267141.45","2025-05-12T21:00:52.303Z","كومة وقت كنيس."
"2530","3","cc27c8a9-a99f-4cae-9c32-7cfe4f93b9ea","9","deposit","374567.53","2025-05-13T14:40:29.763Z","أعتبر تهور انعش."
"2531","3","ccf027ac-5288-4fe1-84c4-82130ed52df8","3","discount","413341","2025-05-13T10:00:21.847Z","طباشير قطة ذاهب حسنًا الكبرى الجنون تواصل."
"2532","6","b715432a-113d-45f7-8330-a7a02bafcd79","26","deposit","611205.82","2025-05-13T16:13:36.970Z","ذهبي إذا حساس أركل."
"2533","5","8a1f0c2c-36fb-47c7-918c-1b6386b82b54","1","discount","132666.06","2025-05-13T19:25:38.005Z","رسغ أن لوم."
"2534","3","01e32a4b-7a37-479f-8118-fc77e2522bdc","19","withdraw","962000.56","2025-05-13T08:22:18.986Z","بهجة متوسط خطأ آدم منتصف بدانة حسنة."
"2535","6","ba9d73ff-19f3-4898-9589-a2a9e66c44a1","12","discount","731068.23","2025-05-13T13:23:48.146Z","ماشية حلاق فضة ينظر أفترض كبير ساطع فقط."
"2536","6","3f59d9ac-e7c7-4ce9-b2a8-88bb8c1b3fa1","4","withdraw","185121.15","2025-05-12T21:16:50.577Z","صده يبعد عشر انتصار."
"2537","2","778512a9-1763-407b-8f16-1868d3d5738b","16","deposit","898132.6","2025-05-13T07:33:07.730Z","الرأفة المدفأة بأغلبية أفضل التشقلب يرتقع كنز يقولون أحاول."
"2538","6","3f59d9ac-e7c7-4ce9-b2a8-88bb8c1b3fa1","4","discount","621174.59","2025-05-13T06:33:33.716Z","أعتبر دعوى إضافي مصلح اتحداك أطفئ."
"2539","1","4742e4af-77fe-4e0d-818e-20c52c134eae","23","withdraw","682118.22","2025-05-13T00:11:55.573Z","بجوار مرات صغير يصدق."
"2540","5","9dea6436-b5cd-4cd6-b546-b9058bde0d0d","20","discount","339020.69","2025-05-13T00:29:22.677Z","يقي نسج شيأ."
"2541","3","6df2e177-2920-4477-8841-7db21d003020","5","deposit","357089.23","2025-05-13T12:57:57.751Z","لإختيار امتعة فقير العاشر اعتدال ويفر."
"2542","1","1a120ada-8dd5-4b93-a6b0-90a1a0d0022e","17","discount","281611.17","2025-05-13T07:29:25.802Z","الشاعر مشط الحضارة حضن تأكيد عمل ينظر وحشي سمحت صديق."
"2543","2","96b80634-dfb5-4769-b131-ff259593df47","8","withdraw","490727.5","2025-05-13T03:25:41.987Z","طالب لوت المدفأة قطة سبب."
"2544","2","30a966ef-3aef-4c6c-b4a4-92aa218b318f","14","discount","732486.15","2025-05-13T11:50:49.140Z","مجمع نجمة خط متطابقة."
"2545","3","cc27c8a9-a99f-4cae-9c32-7cfe4f93b9ea","9","deposit","409870.8","2025-05-12T21:01:06.426Z","قصير جمال يفترض."
"2546","5","cc83be41-c904-42e1-880f-969edd5c59ed","21","discount","446647.37","2025-05-13T11:32:52.316Z","مخترع مواطن فوز شهرة يمثل ادافع مقاطعة في كافٍ أفتح."
"2547","1","4742e4af-77fe-4e0d-818e-20c52c134eae","23","withdraw","905969.92","2025-05-13T06:13:40.443Z","تذوق بجوار شجيرة حضن."
"2548","5","8a1f0c2c-36fb-47c7-918c-1b6386b82b54","1","withdraw","985055.55","2025-05-12T19:56:50.690Z","مسرح لحية رفض زوجة احترام جمهور."
"2549","1","4742e4af-77fe-4e0d-818e-20c52c134eae","23","deposit","470580.92","2025-05-13T04:52:14.461Z","الغرفة أساعد نفع محفوظ السماع الجبر."
"2550","6","3f59d9ac-e7c7-4ce9-b2a8-88bb8c1b3fa1","4","discount","470274.93","2025-05-13T03:03:07.945Z","على بداهة يبدو يكنس."
"2551","3","6df2e177-2920-4477-8841-7db21d003020","5","withdraw","208823.8","2025-05-12T22:07:49.541Z","حضن يساعد حجاب."
"2552","5","9dea6436-b5cd-4cd6-b546-b9058bde0d0d","20","withdraw","139718.98","2025-05-13T03:29:20.170Z","العنكبوت ألم تحمل نفسها منهم ازعم هؤلاء."
"2553","6","ba9d73ff-19f3-4898-9589-a2a9e66c44a1","12","withdraw","171439.52","2025-05-13T13:06:33.788Z","حامض توربيني حذاء جمع."
"2554","6","883ea3c2-8134-4a57-a356-7e437f2f5105","13","discount","356005.18","2025-05-13T18:00:18.502Z","المدفأة بالطبع حقًا مستقر حذر شيء أدوس المحسن المدفأة."
"2555","2","e64412f3-bbd7-42d3-b534-e32fd6a12344","7","discount","392259.47","2025-05-13T00:01:52.198Z","بدأت خيار ثلاث."
"2556","6","ba9d73ff-19f3-4898-9589-a2a9e66c44a1","12","withdraw","93128.02","2025-05-12T22:10:29.683Z","مُطبَّق يقود أعتبر يقارن أدعم متطور عريض."
"2557","2","962bf6f6-2579-4e29-a560-cffb0ab5636b","25","withdraw","703998.79","2025-05-13T17:26:07.482Z","أستسلم مهد أنا سهل مبتذلة ادافع مشهور."
"2558","1","f79e0d2a-6bb6-4634-be8c-f25330f9ff88","15","discount","668028.08","2025-05-13T13:45:50.035Z","مهدئ نفع أدافع."
"2559","1","4742e4af-77fe-4e0d-818e-20c52c134eae","23","deposit","622734.15","2025-05-12T23:08:18.113Z","مؤلف العائلة يلمس احترام سنشتاق تملق فضول التسلق أقول يناسب."
"2560","5","9dea6436-b5cd-4cd6-b546-b9058bde0d0d","20","discount","511512.28","2025-05-13T16:59:51.263Z","أُطرُوحَة كلب نظيف حساس فائدة."
"2561","2","962bf6f6-2579-4e29-a560-cffb0ab5636b","25","withdraw","628482.34","2025-05-12T20:25:27.372Z","ثالث نجحت فقير مدح مشهد المد."
"2562","2","30a966ef-3aef-4c6c-b4a4-92aa218b318f","14","withdraw","89510.81","2025-05-13T11:01:01.056Z","اضع غالباً أنمو بكثرة خطة يتدحرج الضرورات سريع جري."
"2563","6","3f59d9ac-e7c7-4ce9-b2a8-88bb8c1b3fa1","4","deposit","600392.85","2025-05-12T22:03:18.323Z","تعرُّف الموت يغني أجبر نفسه أحد."
"2564","5","cc83be41-c904-42e1-880f-969edd5c59ed","21","discount","160954.52","2025-05-13T14:56:32.712Z","سبورة حضري أو يبدو عضوية زوجة أقوي زوجة ضيق."
"2565","3","01e32a4b-7a37-479f-8118-fc77e2522bdc","19","discount","296593.43","2025-05-13T09:22:28.716Z","اخذت معظم قبلت لماذا واع صدر مفيد كارثة الشاعر و."
"2566","2","77f0aeb1-e784-4233-b5ed-725aa5ff841c","10","deposit","134004.65","2025-05-13T08:26:06.714Z","اناقش اشرب اجلس المشي أتفق صده."
"2567","1","1a120ada-8dd5-4b93-a6b0-90a1a0d0022e","17","withdraw","96140.36","2025-05-12T21:27:40.617Z","خلف نسر المدفأة الأساسي الكبرى عباس."
"2568","5","8a1f0c2c-36fb-47c7-918c-1b6386b82b54","1","withdraw","611953.94","2025-05-13T05:37:29.720Z","الموسم المسرح انتهاء."
"2569","1","255236cf-98e5-4bf5-b282-cc3ef02ae9f1","6","withdraw","497188.91","2025-05-13T02:02:02.313Z","و تخمين الذات مكاتب امراء أحمل."
"2570","6","ba9d73ff-19f3-4898-9589-a2a9e66c44a1","12","discount","379084.86","2025-05-12T21:39:23.871Z","تم سبورة وَرَاءَ أفضل."
"2571","2","77f0aeb1-e784-4233-b5ed-725aa5ff841c","10","discount","427969.69","2025-05-13T04:33:29.947Z","اللطف اقرر يرفع ممتع وقت."
"2572","3","2c9da0e7-c032-444c-b643-121c4c395f60","2","withdraw","343244.76","2025-05-13T00:48:47.704Z","يتدحرج الكبرى إلى لون معركة يحفظ."
"2573","5","9dea6436-b5cd-4cd6-b546-b9058bde0d0d","20","deposit","590777.41","2025-05-13T12:07:53.531Z","أفعل عصفور متنوع."
"2574","1","f332130d-1973-437e-989c-ee33d384be15","18","deposit","246158.8","2025-05-13T18:07:36.324Z","ولا آمن الاقتراع منهم النزاع أحمل سألتصق مكان يوم أخت."
"2575","4","2b3220b2-294e-4f52-9687-c3c75ddef9c7","11","deposit","630303.87","2025-05-13T14:32:49.983Z","مبنى هنا عقل يقام."
"2576","3","01e32a4b-7a37-479f-8118-fc77e2522bdc","19","discount","752373.91","2025-05-13T02:45:02.271Z","الجبر شائع لوم يفترض منتصف ليتم."
"2577","5","9dea6436-b5cd-4cd6-b546-b9058bde0d0d","20","deposit","874299.04","2025-05-13T19:07:41.060Z","المحسنات ل اللطف مضت ثلاثة انتصار بدانة."
"2578","5","cc83be41-c904-42e1-880f-969edd5c59ed","21","withdraw","703049.76","2025-05-13T18:07:52.961Z","أين غير دورة بكثرة تدليك كيك للرفض."
"2579","3","6df2e177-2920-4477-8841-7db21d003020","5","deposit","696439.98","2025-05-13T00:14:01.959Z","شئ الغزل العنوان."
"2580","2","1c2063fe-e9a9-49aa-8e07-1d2d3d3135d9","22","deposit","191815.83","2025-05-13T03:32:47.744Z","تحدث رحلة أفضل لون خفض المسالك مخزون الأكثر ألم."
"2581","2","962bf6f6-2579-4e29-a560-cffb0ab5636b","25","discount","843549.02","2025-05-13T16:38:04.745Z","قيمة العنوان الحمدون عصفور جمهور طبقة اغادر بشكل."
"2582","2","96b80634-dfb5-4769-b131-ff259593df47","8","deposit","875310.95","2025-05-13T01:27:33.521Z","مستمر خيار مراعاة."
"2583","1","f332130d-1973-437e-989c-ee33d384be15","18","deposit","999156.6","2025-05-13T06:44:40.403Z","كومة تكون ثابت يصدق قال ابرم حقيقي متأخر."
"2584","2","30a966ef-3aef-4c6c-b4a4-92aa218b318f","14","discount","717908.96","2025-05-13T00:52:13.817Z","أخضر تهور قبلت حلها الشفق يمثل."
"2585","6","ba9d73ff-19f3-4898-9589-a2a9e66c44a1","12","discount","569587.76","2025-05-12T20:56:55.765Z","ماذا سبورة شجرة ماشية ابن."
"2586","3","43fdbc4f-9368-4f49-addb-f1ca5385b275","24","withdraw","510098.05","2025-05-13T05:22:52.999Z","أعلن منحنى أمشي."
"2587","5","8a1f0c2c-36fb-47c7-918c-1b6386b82b54","1","discount","628676.11","2025-05-12T22:26:14.278Z","خاشع شهرة يفضل كلمة ذلك."
"2588","5","cc83be41-c904-42e1-880f-969edd5c59ed","21","withdraw","668615.23","2025-05-12T22:54:10.817Z","هؤلاء مهارات مختفي أقسى."
"2589","3","ccf027ac-5288-4fe1-84c4-82130ed52df8","3","deposit","38389.06","2025-05-12T20:52:20.519Z","الثعالب أريد يقرر زحف متقلب رجل استطيع بجوار الجميع."
"2590","5","cc83be41-c904-42e1-880f-969edd5c59ed","21","deposit","611220.38","2025-05-13T12:14:17.632Z","اكثر أحاول عادة الحمامات مجمع العزلة استراحة نَسِيج له."
"2591","1","1a120ada-8dd5-4b93-a6b0-90a1a0d0022e","17","withdraw","358564.98","2025-05-13T01:38:50.949Z","مهارات حامض ثم ذاهب اكل يستثني أقول."
"2592","5","8a1f0c2c-36fb-47c7-918c-1b6386b82b54","1","withdraw","134620.53","2025-05-13T13:04:23.001Z","غير المرونة اناقش جار لطيف صوت أفعل سبب اغادر الريح."
"2593","4","2b3220b2-294e-4f52-9687-c3c75ddef9c7","11","discount","636506.94","2025-05-13T16:04:13.298Z","محبوب منحنى حذاء مزيج."
"2594","1","1a120ada-8dd5-4b93-a6b0-90a1a0d0022e","17","deposit","138984.35","2025-05-13T12:26:48.362Z","دولة مكاتب حتى نظيف أريد."
