transaction_id,partner_id,store_id,internal_store_id,transaction_type,amount,transaction_date,notes
"1","2","96b80634-dfb5-4769-b131-ff259593df47","8","discount","908029.57","2025-05-13T13:09:42.818Z","مبنى مرحبًا قبلت زعتر يفضل."
"2","2","77f0aeb1-e784-4233-b5ed-725aa5ff841c","10","discount","706356.16","2025-05-13T13:00:39.018Z","بالرغم ولا ماء حال ضد."
"3","3","6df2e177-2920-4477-8841-7db21d003020","5","deposit","264342.08","2025-05-13T05:19:38.477Z","يهرب لو مرهق قادم أظن."
"4","3","2c9da0e7-c032-444c-b643-121c4c395f60","2","deposit","301401.9","2025-05-13T04:17:04.670Z","مجموع سماء أعتقد مؤلف بعنف."
"5","5","cc83be41-c904-42e1-880f-969edd5c59ed","21","discount","457045.52","2025-05-13T17:50:18.585Z","جَذّاب المحيط خفض نعل المشي متشوق نقود."
"6","6","b715432a-113d-45f7-8330-a7a02bafcd79","26","withdraw","910439.84","2025-05-13T16:35:05.126Z","جيد عشاء تجريبي حذر أنهض دواء أغنية يحب."
"7","3","ccf027ac-5288-4fe1-84c4-82130ed52df8","3","withdraw","217737.31","2025-05-13T02:43:03.100Z","مرحبًا فقط ينظر قادم انتصار اتحداك مهد."
"8","1","f79e0d2a-6bb6-4634-be8c-f25330f9ff88","15","deposit","457429.97","2025-05-12T21:42:46.681Z","أخرى يحب أخشى."
"9","2","30a966ef-3aef-4c6c-b4a4-92aa218b318f","14","withdraw","817925.73","2025-05-13T04:08:50.862Z","فليكن تجمع مقنع الجانبين خفض يتعقب حزين."
"10","6","883ea3c2-8134-4a57-a356-7e437f2f5105","13","deposit","403272.53","2025-05-12T21:22:55.297Z","تأكيد كاحل مخمن منحنى."
"11","2","30a966ef-3aef-4c6c-b4a4-92aa218b318f","14","deposit","44288.07","2025-05-13T12:31:06.460Z","ماشية مرحبًا حقيقة حساب يقفز جار."
"12","2","1c2063fe-e9a9-49aa-8e07-1d2d3d3135d9","22","discount","103022.19","2025-05-13T07:56:08.481Z","الملابس متطور كرس ازعم دعوى الطريق ليتم أين تكون."
"13","1","4742e4af-77fe-4e0d-818e-20c52c134eae","23","withdraw","674828.72","2025-05-13T01:35:27.939Z","أين يجب رأس ألحق فضول حزينين نفع."
"14","3","2c9da0e7-c032-444c-b643-121c4c395f60","2","deposit","465779.51","2025-05-13T15:56:15.021Z","مجموعة بالكاد بقرة كومة وقت مرتين اسم أتفق أطير حضن."
"15","3","6df2e177-2920-4477-8841-7db21d003020","5","discount","329915.55","2025-05-13T03:23:32.336Z","أنمو الحضارة طاولة."
"16","2","30a966ef-3aef-4c6c-b4a4-92aa218b318f","14","deposit","700355.87","2025-05-13T17:22:17.062Z","تماثيل رحلة سأفتح رفض ضيق."
"17","6","b715432a-113d-45f7-8330-a7a02bafcd79","26","withdraw","275909.18","2025-05-13T15:21:58.913Z","سمحت مهجور أساس نَسِيج سأفتح مزيج يرتفع حال ثلاثون ليتم."
"18","5","9dea6436-b5cd-4cd6-b546-b9058bde0d0d","20","deposit","693640.58","2025-05-13T17:27:50.677Z","يناسب صندوق أركل شمس المجلد شاهد صده يقرر."
"19","6","ba9d73ff-19f3-4898-9589-a2a9e66c44a1","12","deposit","741605.9","2025-05-12T22:19:41.691Z","العنكبوت المحدد عاقل ماء يدفع."
"20","6","3f59d9ac-e7c7-4ce9-b2a8-88bb8c1b3fa1","4","discount","49678.18","2025-05-13T05:26:46.490Z","يقفز شاهد مقاطعة صداقة غائب."
"21","2","1c2063fe-e9a9-49aa-8e07-1d2d3d3135d9","22","withdraw","908348.17","2025-05-12T23:56:28.317Z","قوة هواء ملعقة الجانبين عالي يرفع مشط يفصل يغني كبير."
"22","1","1a120ada-8dd5-4b93-a6b0-90a1a0d0022e","17","discount","802489.34","2025-05-13T14:58:50.258Z","جمهور ربيع مهارات قوة."
"23","3","2c9da0e7-c032-444c-b643-121c4c395f60","2","deposit","334657.4","2025-05-13T05:09:28.691Z","يحشد تنبيه أغطي القيء أخرى يساهم إنها نشط إضافي على."
"24","2","77f0aeb1-e784-4233-b5ed-725aa5ff841c","10","discount","712168.44","2025-05-13T01:05:17.004Z","يستخدم منحن يمسح المحدد ولا بلدة قيد إنها أوزة إخلاء."
"25","5","8a1f0c2c-36fb-47c7-918c-1b6386b82b54","1","withdraw","680831.32","2025-05-13T12:04:09.969Z","آخر صنعت صندوق ضيق أكون امن حضن."
"26","6","ba9d73ff-19f3-4898-9589-a2a9e66c44a1","12","deposit","113380.41","2025-05-13T05:29:14.514Z","معظم اقرر امتعة راحة."
"27","3","01e32a4b-7a37-479f-8118-fc77e2522bdc","19","discount","428883.5","2025-05-13T04:41:33.458Z","بالرغم شراب جري يدق مشهور الكبرى."
"28","2","77f0aeb1-e784-4233-b5ed-725aa5ff841c","10","discount","767863.8","2025-05-13T04:32:06.943Z","متع الكبرى مع."
"29","1","f332130d-1973-437e-989c-ee33d384be15","18","deposit","22273.42","2025-05-13T07:48:35.168Z","رابطة برعاية الجرأة القوي غرفة."
"30","3","2c9da0e7-c032-444c-b643-121c4c395f60","2","withdraw","629885.54","2025-05-12T20:24:52.252Z","أمشط رسغ مهارات."
"31","1","f332130d-1973-437e-989c-ee33d384be15","18","withdraw","654102.93","2025-05-13T01:19:38.678Z","أقترح تم مواطن سمحت يحفظ أعتقد يتدحرج عصا."
"32","1","1a120ada-8dd5-4b93-a6b0-90a1a0d0022e","17","discount","372388.8","2025-05-12T23:36:49.904Z","أَخَّاذ متأثر ليتم ملعقة بجوار مريح."
"33","1","f79e0d2a-6bb6-4634-be8c-f25330f9ff88","15","deposit","183578.02","2025-05-12T20:23:02.628Z","سيصيبني محفوظ تقطر في ليتم."
"34","2","96b80634-dfb5-4769-b131-ff259593df47","8","discount","289884.84","2025-05-13T16:40:51.994Z","أَخَّاذ نسج متطابقة التفاضل حقا نسج."
"35","1","4742e4af-77fe-4e0d-818e-20c52c134eae","23","discount","72155.99","2025-05-12T23:43:19.632Z","رياح كل ذاهب مرة اغادر اقرر فزت."
"36","2","1c2063fe-e9a9-49aa-8e07-1d2d3d3135d9","22","deposit","96172.33","2025-05-13T10:04:41.300Z","جرس تماثيل مبتذلة غرفة عزيزي رقابة مرسوم بأغلبية أقدر أوافق."
"37","6","883ea3c2-8134-4a57-a356-7e437f2f5105","13","withdraw","158955.11","2025-05-13T08:43:08.777Z","أقول انتصار عاقل الأليف عاصف عدالة اليقظة ألحق أميل فليكن."
"38","3","cc27c8a9-a99f-4cae-9c32-7cfe4f93b9ea","9","discount","841263.26","2025-05-13T14:19:15.876Z","مبروك أوافق بالطبع ثالث اخر."
"39","1","f332130d-1973-437e-989c-ee33d384be15","18","withdraw","481743.8","2025-05-13T16:32:38.445Z","العنكبوت يستخدم يمارس يحل عالميا."
"40","1","f332130d-1973-437e-989c-ee33d384be15","18","discount","182778.28","2025-05-13T11:52:00.122Z","تحت كارثة ثابت أحضر تحدث أعيش صغير."
"41","3","6df2e177-2920-4477-8841-7db21d003020","5","withdraw","609851.38","2025-05-13T15:36:00.629Z","والتكامل إلى أُطرُوحَة مُطبَّق زعتر مفيد."
"42","6","883ea3c2-8134-4a57-a356-7e437f2f5105","13","deposit","507832.57","2025-05-13T10:12:03.180Z","نَسِيج مرآة ذهب القوي يلاحظ."
"43","2","30a966ef-3aef-4c6c-b4a4-92aa218b318f","14","deposit","274157.05","2025-05-13T04:05:54.494Z","تقطر انعش باهظ."
"44","2","1c2063fe-e9a9-49aa-8e07-1d2d3d3135d9","22","withdraw","513288.29","2025-05-13T05:13:55.775Z","هواء أبداً فجأة منحن نفسها ثلاثة سلسلة."
"45","6","3f59d9ac-e7c7-4ce9-b2a8-88bb8c1b3fa1","4","withdraw","647410.25","2025-05-13T15:27:12.576Z","العنكبوت مقنع الناس كومة أدير المعجل آتي ينمو متزوجة."
"46","4","2b3220b2-294e-4f52-9687-c3c75ddef9c7","11","withdraw","848670.18","2025-05-13T03:22:41.548Z","ثقافة هي طباشير كيك الرأفة مرحبا."
"47","2","778512a9-1763-407b-8f16-1868d3d5738b","16","discount","376557.9","2025-05-12T23:52:42.567Z","مكان تهور نجح جميل أخت منتصف."
"48","4","2b3220b2-294e-4f52-9687-c3c75ddef9c7","11","discount","96084.73","2025-05-13T08:30:10.225Z","أخضر صنعت متساوي النزاع آمن."
"49","2","77f0aeb1-e784-4233-b5ed-725aa5ff841c","10","withdraw","156307.24","2025-05-13T08:31:26.642Z","حجاب شئ مساء يزيل."
"50","3","cc27c8a9-a99f-4cae-9c32-7cfe4f93b9ea","9","deposit","279032.3","2025-05-13T04:44:27.314Z","الجانبين قيد حبيب."
"51","1","1a120ada-8dd5-4b93-a6b0-90a1a0d0022e","17","withdraw","668029.13","2025-05-13T15:40:14.305Z","كلب كلب أو سليم فوز."
"52","1","f332130d-1973-437e-989c-ee33d384be15","18","withdraw","821589.3","2025-05-12T19:56:48.391Z","الطريق صدر شيء المحدد أتذكر مكعب تحت ليتم اهداء."
"53","1","4742e4af-77fe-4e0d-818e-20c52c134eae","23","deposit","561558.62","2025-05-12T23:05:32.522Z","منتصف العائلة خيار."
"54","5","8a1f0c2c-36fb-47c7-918c-1b6386b82b54","1","deposit","372588.36","2025-05-13T00:35:16.864Z","عضوية حقا مزايا."
"55","2","77f0aeb1-e784-4233-b5ed-725aa5ff841c","10","withdraw","497122.71","2025-05-13T08:44:43.442Z","الحياة أدافع خجول العمل."
"56","3","ccf027ac-5288-4fe1-84c4-82130ed52df8","3","discount","617783.64","2025-05-13T16:57:30.009Z","دخول ظل مبنى ذيل خزان اضحك."
"57","6","b715432a-113d-45f7-8330-a7a02bafcd79","26","deposit","367204.12","2025-05-12T19:34:02.784Z","يساهم سأفتح قميص التفاضل عريض نفسها إخلاء فضة يدفع شرط."
"58","6","883ea3c2-8134-4a57-a356-7e437f2f5105","13","deposit","850848.28","2025-05-13T14:10:41.878Z","رسمي صحة مضت رجل جمهور."
"59","1","1a120ada-8dd5-4b93-a6b0-90a1a0d0022e","17","withdraw","529354.92","2025-05-13T12:55:44.155Z","مشهور مواطنة له ينظر دعوى اقف السماوي حجاب."
"60","6","b715432a-113d-45f7-8330-a7a02bafcd79","26","deposit","969300.05","2025-05-13T00:23:10.305Z","مهندس يمين وسعنا."
"61","5","cc83be41-c904-42e1-880f-969edd5c59ed","21","withdraw","907022.34","2025-05-13T16:29:06.088Z","عاصف أعترف يتبنى بدانة مرهق صحيح الفصل مدهش إذا الرقص."
"62","5","8a1f0c2c-36fb-47c7-918c-1b6386b82b54","1","withdraw","934573.08","2025-05-13T13:18:32.446Z","ثم الأساسي أنمو الجناح والتكامل نعل شعر وسوف."
"63","5","8a1f0c2c-36fb-47c7-918c-1b6386b82b54","1","withdraw","956954.37","2025-05-13T17:06:52.156Z","مجموعة تدوس مكان نسج ألفت لماذا أغنية خزان."
"64","2","96b80634-dfb5-4769-b131-ff259593df47","8","deposit","441987.88","2025-05-13T11:50:45.699Z","قليل تهور ذهبي الخصم وَرَاءَ سلب علي يرتفع."
"65","6","3f59d9ac-e7c7-4ce9-b2a8-88bb8c1b3fa1","4","withdraw","676472.89","2025-05-13T01:42:10.924Z","يعبر أتذكر سنة امتياز يبحث خاشع يمين."
"66","5","8a1f0c2c-36fb-47c7-918c-1b6386b82b54","1","discount","52278.61","2025-05-13T16:42:14.950Z","مزيج صدقة مرتين أسقط معماري الأمل."
"67","1","4742e4af-77fe-4e0d-818e-20c52c134eae","23","discount","499496.99","2025-05-13T13:12:26.551Z","ذهب مشط الكبرى."
"68","2","77f0aeb1-e784-4233-b5ed-725aa5ff841c","10","deposit","728841.96","2025-05-12T19:52:56.708Z","قبل سبب محبوب عدالة أركل مظلمة أدافع حب مشين واع."
"69","2","77f0aeb1-e784-4233-b5ed-725aa5ff841c","10","discount","131280.35","2025-05-13T18:38:35.480Z","دعه بقدر الموعد."
"70","2","77f0aeb1-e784-4233-b5ed-725aa5ff841c","10","deposit","351847.86","2025-05-13T17:36:49.826Z","تتدفق يقود بالباص."
"71","3","ccf027ac-5288-4fe1-84c4-82130ed52df8","3","deposit","190767.1","2025-05-13T05:38:19.671Z","خجول جداً مشهور جَذّاب ثقافة ادافع حقًا المشي."
"72","5","8a1f0c2c-36fb-47c7-918c-1b6386b82b54","1","discount","796676.57","2025-05-12T21:22:25.675Z","سلام أنمو يسير أخضر شيأ يمارس غير منحنى دور."
"73","2","778512a9-1763-407b-8f16-1868d3d5738b","16","discount","981818.09","2025-05-12T22:12:19.888Z","قوي مدهش مقنع الأليف."
"74","3","ccf027ac-5288-4fe1-84c4-82130ed52df8","3","deposit","217076.4","2025-05-12T22:12:41.400Z","مشين شراب طبقة تكون مؤلف يفحص يعيق."
"75","5","9dea6436-b5cd-4cd6-b546-b9058bde0d0d","20","deposit","67101.96","2025-05-13T03:34:25.512Z","اخترت اصرخ ادافع راحة مبتذلة ملكنا تنبيه الأليف مسرح."
"76","3","ccf027ac-5288-4fe1-84c4-82130ed52df8","3","deposit","255261.92","2025-05-12T21:17:28.800Z","أخسر محبوب أتذكر نكون مسرح."
"77","1","f79e0d2a-6bb6-4634-be8c-f25330f9ff88","15","deposit","630684.45","2025-05-13T12:59:21.423Z","ربط إنه مع دخول منتصف استراحة يجب امراء عزيز."
"78","5","8a1f0c2c-36fb-47c7-918c-1b6386b82b54","1","discount","442100.56","2025-05-13T17:47:21.120Z","يتحقق يكتسب الشفق أعتبر يرفع يلمس."
"79","6","b715432a-113d-45f7-8330-a7a02bafcd79","26","discount","49977.37","2025-05-13T18:31:11.029Z","كارثة عالي علي."
"80","5","8a1f0c2c-36fb-47c7-918c-1b6386b82b54","1","withdraw","94296.87","2025-05-13T00:01:41.537Z","تحية سرور كرامة العمل غالباً مساء الخصم مكعب."
"81","3","6df2e177-2920-4477-8841-7db21d003020","5","withdraw","382204.96","2025-05-13T19:00:37.700Z","يصدق امتعة مدهش يقود امن الكبرى لماذا أتذكر جمال."
"82","4","2b3220b2-294e-4f52-9687-c3c75ddef9c7","11","withdraw","363306.96","2025-05-13T19:21:11.811Z","رجل صده كارثة فاجأ مكان عمل."
"83","1","4742e4af-77fe-4e0d-818e-20c52c134eae","23","deposit","78400.04","2025-05-13T05:05:02.106Z","المدفأة السعة متى أطفئ المشي شهرة."
"84","2","778512a9-1763-407b-8f16-1868d3d5738b","16","withdraw","135118.89","2025-05-13T17:17:53.782Z","الأليف لون يقود سمحت تاج رجولي شروط سأخبرك أخشى متنوع."
"85","3","43fdbc4f-9368-4f49-addb-f1ca5385b275","24","withdraw","716457.59","2025-05-13T11:02:40.607Z","فوق ذاهب يرفع خشن جار الأمل الموجة."
"86","2","962bf6f6-2579-4e29-a560-cffb0ab5636b","25","deposit","207969.21","2025-05-13T05:25:08.162Z","أوافق أرى نعسان يغني صده تحدث أمان انتصار."
"87","1","4742e4af-77fe-4e0d-818e-20c52c134eae","23","deposit","328029.34","2025-05-13T08:46:27.061Z","تجمع العائلة يأسر عصا تواصل يحفظ بدأت ذاهب الأساسي ثالاسانوس."
"88","2","778512a9-1763-407b-8f16-1868d3d5738b","16","withdraw","732119.99","2025-05-13T18:03:28.083Z","بجوار المنشئ جهاز يقرر يقدموا مشهور آكل أخسر رمي أدعم."
"89","6","ba9d73ff-19f3-4898-9589-a2a9e66c44a1","12","deposit","907437.74","2025-05-13T03:37:09.542Z","يأسر عن قال ديون الترحيل ادافع معماري."
"90","3","01e32a4b-7a37-479f-8118-fc77e2522bdc","19","discount","51131.43","2025-05-13T08:11:28.971Z","ملائم الموقف عدالة قبلت كشط مقنع شخص يتردد يناسب ربط."
"91","1","f79e0d2a-6bb6-4634-be8c-f25330f9ff88","15","discount","214672.65","2025-05-13T09:01:45.747Z","منجلي يمارس أعترف الموت يكتسب جري."
"92","6","b715432a-113d-45f7-8330-a7a02bafcd79","26","deposit","887792.27","2025-05-13T02:42:23.364Z","يتحقق أميل ازعم."
"93","2","962bf6f6-2579-4e29-a560-cffb0ab5636b","25","withdraw","204951.95","2025-05-13T15:06:42.251Z","سيصيبني بالتأكيد امراء السترة."
"94","3","ccf027ac-5288-4fe1-84c4-82130ed52df8","3","discount","110932.14","2025-05-12T21:23:55.825Z","متألق يقفز المقصود حياة عم النفخ عزيز طريق بأغلبية."
"95","3","6df2e177-2920-4477-8841-7db21d003020","5","withdraw","89301.89","2025-05-13T04:55:21.145Z","فحم فجأة يعرفون الكبرى نَسِيج أكون تصل مشهد."
"96","6","883ea3c2-8134-4a57-a356-7e437f2f5105","13","deposit","754382.85","2025-05-13T02:10:45.197Z","أساعد شيأ فن آخر لوت العزلة يكتسب مدح عصا تخمين."
"97","1","f332130d-1973-437e-989c-ee33d384be15","18","deposit","962535.26","2025-05-13T12:15:22.508Z","اسمنت رسغ يرتجف مرتين حامض نسج."
"98","2","96b80634-dfb5-4769-b131-ff259593df47","8","withdraw","126077.75","2025-05-13T09:36:52.543Z","ذاهب أستسلم يترتب من حضن نقود."
"99","1","4742e4af-77fe-4e0d-818e-20c52c134eae","23","discount","542513.03","2025-05-13T07:58:50.857Z","ماذا حجاب الدير."
"100","6","ba9d73ff-19f3-4898-9589-a2a9e66c44a1","12","discount","803860.06","2025-05-13T00:05:15.252Z","جَذّاب القليل مرآة أخرى صحة شهرة مساء اهداء وسعنا أعتقد."
"101","5","9dea6436-b5cd-4cd6-b546-b9058bde0d0d","20","discount","110052.57","2025-05-12T20:05:30.280Z","أساس الأساسي يلمس معتاد اغادر تصل دولة محبوب القوي."
"102","6","b715432a-113d-45f7-8330-a7a02bafcd79","26","discount","816110.54","2025-05-13T05:46:12.725Z","أذن ينظر أعتبر الأكثر طويل قديم تصويت آلام."
"103","2","962bf6f6-2579-4e29-a560-cffb0ab5636b","25","discount","378537.99","2025-05-13T00:22:34.579Z","السماوي الفراء الحضارة حساب قف."
"104","6","ba9d73ff-19f3-4898-9589-a2a9e66c44a1","12","discount","614591.59","2025-05-13T06:22:14.074Z","أقدر الإحسان أعلق ملل لذا."
"105","1","f332130d-1973-437e-989c-ee33d384be15","18","withdraw","381354.95","2025-05-13T05:56:59.534Z","أدير الأليف اختراعات لإختيار."
"106","3","cc27c8a9-a99f-4cae-9c32-7cfe4f93b9ea","9","withdraw","823323.8","2025-05-12T19:36:59.912Z","كثيرة تتدفق عشر هي شخص ثابت تذوق يكلف قصير أمشط."
"107","3","6df2e177-2920-4477-8841-7db21d003020","5","deposit","637220.02","2025-05-13T10:45:35.196Z","الأساسي يفعل الماء."
"108","3","2c9da0e7-c032-444c-b643-121c4c395f60","2","deposit","944519.5","2025-05-12T22:46:08.854Z","مزايا ليتم قوي اقود معظم يعيق."
"109","1","1a120ada-8dd5-4b93-a6b0-90a1a0d0022e","17","withdraw","483276.14","2025-05-13T15:40:55.997Z","ألفت ملعقة صنعت."
"110","2","e64412f3-bbd7-42d3-b534-e32fd6a12344","7","discount","215566.72","2025-05-13T18:27:30.310Z","ملكنا ينضم خيار ادافع تنبيه ذهبي اعتدال أثاث يلائم."
"111","3","cc27c8a9-a99f-4cae-9c32-7cfe4f93b9ea","9","deposit","602858.08","2025-05-13T18:44:34.939Z","يساهم عير سرور جمع اقرر يتحقق."
"112","1","4742e4af-77fe-4e0d-818e-20c52c134eae","23","deposit","380409.96","2025-05-13T08:01:52.518Z","معظم لجأ مدينة تخمين يقود بالباص."
"113","2","30a966ef-3aef-4c6c-b4a4-92aa218b318f","14","discount","983872.74","2025-05-13T03:27:41.380Z","بِكر أوافق بالغ."
"114","6","b715432a-113d-45f7-8330-a7a02bafcd79","26","deposit","266823.72","2025-05-13T08:27:06.998Z","كيك مقنع جار لأن بالكاد سنشتاق أتفق فزت ل."
"115","5","9dea6436-b5cd-4cd6-b546-b9058bde0d0d","20","deposit","234657.11","2025-05-13T10:41:27.672Z","والنسيج شاهد متع تصويت عزيز مخزون غرفة تكون إليك."
"116","2","962bf6f6-2579-4e29-a560-cffb0ab5636b","25","discount","906387.74","2025-05-13T03:11:57.738Z","يبحث ارباح خجول كلب نجمة الإحسان يمين المعجل ممتع محبوب."
"117","4","2b3220b2-294e-4f52-9687-c3c75ddef9c7","11","withdraw","55671.36","2025-05-13T00:49:08.176Z","طالب ادافع تدليك."
"118","1","4742e4af-77fe-4e0d-818e-20c52c134eae","23","deposit","234852.05","2025-05-12T21:40:12.283Z","حاضر هؤلاء أطير."
"119","3","01e32a4b-7a37-479f-8118-fc77e2522bdc","19","withdraw","393861.71","2025-05-13T16:38:59.190Z","اصرخ تخمين حذاء أخشى."
"120","1","1a120ada-8dd5-4b93-a6b0-90a1a0d0022e","17","withdraw","597538.9","2025-05-13T19:06:58.850Z","نعسان الجانبين مربع أخضر."
"121","2","1c2063fe-e9a9-49aa-8e07-1d2d3d3135d9","22","withdraw","161440.6","2025-05-12T20:33:54.915Z","مال أبداً جسم."
"122","5","8a1f0c2c-36fb-47c7-918c-1b6386b82b54","1","withdraw","251833.37","2025-05-13T12:49:44.962Z","مرسوم صورة لوم عصا الجنون رفيع."
"123","2","77f0aeb1-e784-4233-b5ed-725aa5ff841c","10","discount","767904.61","2025-05-13T00:27:54.628Z","نقود الجاد كان حذاء أعلن."
"124","3","cc27c8a9-a99f-4cae-9c32-7cfe4f93b9ea","9","discount","176830.04","2025-05-13T01:45:16.298Z","بوق غير جهد أن نائب عن."
"125","1","f332130d-1973-437e-989c-ee33d384be15","18","withdraw","517215.1","2025-05-13T01:33:17.502Z","إلا دعه بدانة يحب فريق واسع تجريبي أخشى."
"126","5","9dea6436-b5cd-4cd6-b546-b9058bde0d0d","20","deposit","984144.85","2025-05-13T02:08:55.541Z","تخمين انهم أركل نحن تاج أنت."
"127","6","3f59d9ac-e7c7-4ce9-b2a8-88bb8c1b3fa1","4","deposit","147726.26","2025-05-13T00:56:57.217Z","فيما القيء سلام صدوق باهظ اعتدال."
"128","1","255236cf-98e5-4bf5-b282-cc3ef02ae9f1","6","withdraw","2632.58","2025-05-13T18:45:25.901Z","نعسان مساء صغير وَسَط أستسلم بيئة الجميع أعلى كائن إنها."
"129","3","6df2e177-2920-4477-8841-7db21d003020","5","deposit","411453.39","2025-05-13T01:28:56.756Z","أظن أمشي لجأ تجمع آخرون أعمى رسمي يلائم."
"130","1","f332130d-1973-437e-989c-ee33d384be15","18","deposit","978509.86","2025-05-13T09:58:13.648Z","أثاث ضد يأتي يحل مختفي."
"131","2","962bf6f6-2579-4e29-a560-cffb0ab5636b","25","withdraw","536390.63","2025-05-12T23:52:05.714Z","الإحسان وذلك بالكاد شيأ حجرة مقرر جسم."
"132","3","ccf027ac-5288-4fe1-84c4-82130ed52df8","3","deposit","556601.33","2025-05-13T13:07:08.678Z","لك كلا لوم إنها سبب يقود أجبر."
"133","6","883ea3c2-8134-4a57-a356-7e437f2f5105","13","deposit","501888.45","2025-05-13T11:21:12.897Z","رسمي سألتصق متقلب لأن شمس مبتذلة العنكبوت."
"134","2","962bf6f6-2579-4e29-a560-cffb0ab5636b","25","discount","35694.37","2025-05-13T15:37:40.645Z","كومة يحل سبب ويل عضوية تريد ماهر أقول الفصل حب."
"135","5","8a1f0c2c-36fb-47c7-918c-1b6386b82b54","1","deposit","188707.7","2025-05-13T05:09:39.726Z","واحد عقل انتهاء مع شخص سنشتاق."
"136","3","43fdbc4f-9368-4f49-addb-f1ca5385b275","24","withdraw","55530.4","2025-05-13T13:37:50.824Z","لوم ليونة زوجة الملابس يرفع تحمل."
"137","2","1c2063fe-e9a9-49aa-8e07-1d2d3d3135d9","22","deposit","808302.62","2025-05-12T22:13:12.542Z","أخضر مهجور يفضل."
"138","6","b715432a-113d-45f7-8330-a7a02bafcd79","26","discount","16260.53","2025-05-13T15:05:43.149Z","ماشية شجيرة يوضح مجموعة فجأة."
"139","2","778512a9-1763-407b-8f16-1868d3d5738b","16","deposit","794484.15","2025-05-13T12:20:43.316Z","احب يأخذ كان حلها يستثني متوسط."
"140","2","96b80634-dfb5-4769-b131-ff259593df47","8","discount","114368.2","2025-05-13T17:33:32.515Z","أحاول يرتجف أفترض أخيرا يرتجف قبلت لون."
"141","2","30a966ef-3aef-4c6c-b4a4-92aa218b318f","14","withdraw","351248.33","2025-05-13T18:02:03.242Z","حصلت التشقلب تدليك أجوف."
"142","1","4742e4af-77fe-4e0d-818e-20c52c134eae","23","withdraw","873618.21","2025-05-13T15:59:32.168Z","متطوع حجاب أمان سن العمل المشي."
"143","2","30a966ef-3aef-4c6c-b4a4-92aa218b318f","14","withdraw","164847.63","2025-05-13T13:43:05.022Z","بداهة حتى ربيع نسج."
"144","6","b715432a-113d-45f7-8330-a7a02bafcd79","26","deposit","376080.28","2025-05-13T13:12:17.296Z","المدينة احصل المختارون مثل إليك والنسيج مرحبا تريد ملكنا."
"145","1","1a120ada-8dd5-4b93-a6b0-90a1a0d0022e","17","deposit","385484.95","2025-05-13T16:05:14.244Z","التفاضل مرسوم امن حر له والنسيج قديم متع مُطبَّق."
"146","3","cc27c8a9-a99f-4cae-9c32-7cfe4f93b9ea","9","discount","898177.02","2025-05-13T09:32:56.491Z","حبيب بالكاد برودة رمي مقرر."
"147","2","30a966ef-3aef-4c6c-b4a4-92aa218b318f","14","deposit","755258.89","2025-05-13T10:37:06.185Z","القليل نائب ملاك."
"148","1","4742e4af-77fe-4e0d-818e-20c52c134eae","23","withdraw","20777.05","2025-05-12T23:29:51.717Z","السرج خلوق ملل عزيزتي انعش يساهم أعلن زوجة سن مشين."
"149","3","01e32a4b-7a37-479f-8118-fc77e2522bdc","19","withdraw","411565.55","2025-05-12T19:28:15.048Z","جار تعتاد حزن واحد تخمين الوصول حبيب."
"150","6","3f59d9ac-e7c7-4ce9-b2a8-88bb8c1b3fa1","4","discount","658199.59","2025-05-13T10:06:15.340Z","يلائم مرهق جمهور زيادة يقلق هو."
"151","5","9dea6436-b5cd-4cd6-b546-b9058bde0d0d","20","discount","14596.28","2025-05-13T00:53:52.824Z","ابن ينمو خيار برودة صغير إيداع مزيج نتيجة قوي."
"152","5","cc83be41-c904-42e1-880f-969edd5c59ed","21","discount","607758.85","2025-05-12T23:09:50.314Z","اكل أُطرُوحَة غداً مرتين يتمتع بحكمة الفراء يفعل."
"153","2","778512a9-1763-407b-8f16-1868d3d5738b","16","discount","87078.48","2025-05-13T09:58:41.940Z","ليّن شاب العاشر يفعل رجل يفتح سيارة دورة."
"154","2","77f0aeb1-e784-4233-b5ed-725aa5ff841c","10","withdraw","57270.37","2025-05-12T20:03:07.957Z","معبد أطير تأكيد الخصم لذا يصلح أحب الثعالب يفتح."
