transaction_id,partner_id,store_id,internal_store_id,transaction_type,amount,amount_platform_commission,transaction_date,notes
"1266","5","da3156cf-60e4-4978-beaf-a3fed77cd6a7","10","discount","879927.75","87992.775","2025-05-21T08:09:17.217Z","حلاق خطة غرفة ناعم يمارس ناعم أعلق وذلك غائب."
"1267","6","9361d272-2f4a-4d82-9103-83ff91fdbcff","3","discount","703522.87","70352.287","2025-05-20T15:36:13.024Z","عن لون حقيقة ذاهب رأس ملموس."
"1268","6","1394a8cb-e88e-48ce-9fc5-c6732abf2fdb","9","deposit","568677.45","56867.744999999995","2025-05-20T10:39:27.604Z","فائدة الموسم أفتقد منهم مخمن الاستخدام تحمل السجلات كارثة."
"1269","1","cd95745d-43ff-4815-a47e-d7a7662863ff","12","withdraw","258292.63","25829.263","2025-05-21T08:55:29.235Z","عشاء أنت أعيش التشقلب ماء."
"1270","5","1ef452d3-ba25-4ed6-908b-0a7b523a1350","14","deposit","84393.66","8439.366","2025-05-20T14:06:46.555Z","يمثل الأمل عزيز اضحك."
"1271","3","c5ea39ac-aea0-4ec7-96dd-5ac8578de5c1","8","discount","669175","66917.5","2025-05-21T03:58:53.341Z","لا الرافض خفض بالتأكيد لطيف."
"1272","6","1394a8cb-e88e-48ce-9fc5-c6732abf2fdb","9","discount","429077.66","42907.765999999996","2025-05-21T05:09:46.395Z","مدح الذات إنه صيف مادة لك أقسم فشيأ تهور."
"1273","6","c5ca28a6-daca-4ca6-b69c-ea651ec6fce7","13","withdraw","870505.91","87050.591","2025-05-21T01:44:18.937Z","العائلة يأمل يغني نحن."
"1274","1","ba63ad31-b90a-4291-a438-c0e53fb46692","15","withdraw","121321.74","12132.174","2025-05-21T07:50:42.670Z","أقسم خطأ متشوق مكعب العاشر يناسب كرس أخسر."
"1275","5","1ba1157f-48f2-46c3-b4d3-bcc47c1af231","20","discount","815379.43","81537.943","2025-05-21T09:40:32.936Z","حقيقة أبدًا ثابت يحفظ."
"1276","1","40f869cb-350c-4f36-940c-1735da09e52c","11","deposit","152786.74","15278.673999999999","2025-05-20T11:26:56.534Z","مرحبا ينظر ألم رابطة أرتب."
"1277","6","9361d272-2f4a-4d82-9103-83ff91fdbcff","3","deposit","877877.66","87787.766","2025-05-21T06:23:05.621Z","لماذا النفخ حجرة يضحك."
"1278","1","06a97fb2-838b-4060-8fff-799663e53f31","21","deposit","50020.33","5002.033","2025-05-21T01:14:03.811Z","أريد أنهض ثلاثة فضول ساحقة متطور الجنون يظهر يهرب."
"1279","1","06a97fb2-838b-4060-8fff-799663e53f31","21","deposit","71697.17","7169.717","2025-05-21T08:36:16.410Z","ايقاد سيصيبني وميض مجموعة القوي يتحقق."
"1280","5","da3156cf-60e4-4978-beaf-a3fed77cd6a7","10","discount","580965.42","58096.542","2025-05-20T22:10:22.167Z","لذلك مهجور أحد يعبر أفترض اصرخ نفسها أعلى شاهد."
"1281","6","9361d272-2f4a-4d82-9103-83ff91fdbcff","3","deposit","500148.63","50014.863","2025-05-21T02:32:23.860Z","ذيل الناس مضيف حامض أسود مواطن."
"1282","3","2cb56510-2ea7-40fe-be56-2f07b3267606","26","deposit","247678.47","24767.847","2025-05-20T22:37:17.241Z","مزيج رفض غداً شجيرة الشاعر تجريبي أفضل السترة ضجة."
"1283","6","dfe59ac2-9d52-4815-902f-43c4426470a2","17","withdraw","190516.58","19051.658","2025-05-21T05:17:25.488Z","أي ثلاث باستمرار عاصف حساب الغزل إلتواء."
"1284","5","da3156cf-60e4-4978-beaf-a3fed77cd6a7","10","discount","938259.02","93825.902","2025-05-20T14:32:16.099Z","يحشد أبدًا فن متطابقة سمحت شرط كارثة الموقف أرض."
"1285","3","c5ea39ac-aea0-4ec7-96dd-5ac8578de5c1","8","discount","413978.23","41397.823","2025-05-20T13:10:12.139Z","بالرغم جمع السرج جميل."
"1286","5","00c6a871-dcc5-458a-b59c-6f14fc89e385","6","deposit","116792.93","11679.293","2025-05-20T23:49:56.496Z","مريح طويل صداقة مقاطعة يمسح إنه مائة."
"1287","4","1ed59d90-52f8-40b0-85a3-0fd936236ca9","24","discount","609449.28","60944.928","2025-05-20T22:00:53.161Z","انهم صنعت حال امراء ويل."
"1288","6","b5be6eaa-7747-4707-934b-a9ac9671a1d3","25","discount","147671.49","14767.149","2025-05-21T00:48:02.048Z","شعر أطفئ تجريبي الخدع."
"1289","1","06a97fb2-838b-4060-8fff-799663e53f31","21","deposit","831399.96","83139.996","2025-05-20T19:37:48.714Z","كلاهما عصا عجز مبنى نجح أقوي احب."
"1290","1","cd95745d-43ff-4815-a47e-d7a7662863ff","12","withdraw","827379.67","82737.967","2025-05-21T02:39:51.311Z","رمي كان مدهش مرآة."
"1291","3","eedddfb1-7bfc-4de8-93f9-a2b08d928eca","7","deposit","293130.88","29313.088","2025-05-20T15:26:55.279Z","يفعل يهمني اجد مواطنون ابن كوب."
"1292","3","7cb68b97-a7ae-4acf-b669-7e20b6e501ad","19","discount","757380.67","75738.06700000001","2025-05-20T11:56:37.370Z","قطة أقل يحشد ملائم منهم."
"1293","5","da3156cf-60e4-4978-beaf-a3fed77cd6a7","10","discount","768083.91","76808.391","2025-05-20T23:35:44.369Z","لأن الغزل انتهاء آلام المدينة تذوق يسير آدم."
"1294","1","ba63ad31-b90a-4291-a438-c0e53fb46692","15","deposit","48239.2","4823.92","2025-05-21T06:57:16.582Z","يتذكر بقدر نفسه بطريقة أخضر كما واع."
"1295","5","1ba1157f-48f2-46c3-b4d3-bcc47c1af231","20","discount","791330.82","79133.082","2025-05-20T13:14:15.985Z","ويفر حساس ينظر إدارة."
"1296","1","cd95745d-43ff-4815-a47e-d7a7662863ff","12","deposit","771454.91","77145.49100000001","2025-05-20T17:08:24.705Z","سبورة يمثل بالتأكيد في أنت أعيش لكم مقنع."
"1297","2","b1bccddd-8c55-496a-8ecf-f6b02b78e576","16","deposit","175426.74","17542.674","2025-05-21T06:40:11.022Z","لذا إدارة المرسول يفتح حتى."
"1298","1","cd95745d-43ff-4815-a47e-d7a7662863ff","12","withdraw","108457.88","10845.788","2025-05-21T06:55:02.449Z","ليتم معظم الموعد أميل."
"1299","5","1ba1157f-48f2-46c3-b4d3-bcc47c1af231","20","discount","564982.29","56498.22900000001","2025-05-21T02:42:57.793Z","وظائف يحشد ابرم شهرة الأمل وحشي حذر."
"1300","6","c5ca28a6-daca-4ca6-b69c-ea651ec6fce7","13","deposit","331905.11","33190.511","2025-05-20T18:41:40.694Z","يلائم آلام الكبرى."
"1301","3","eedddfb1-7bfc-4de8-93f9-a2b08d928eca","7","withdraw","551245.69","55124.568999999996","2025-05-20T13:17:38.033Z","صداقة حقًا السرج رجولي."
"1302","6","c5ca28a6-daca-4ca6-b69c-ea651ec6fce7","13","deposit","188657.13","18865.713","2025-05-21T09:15:48.387Z","يحفظ بشكل أسلم كيف أعلق القليل فضول أنهض."
"1303","2","b1bccddd-8c55-496a-8ecf-f6b02b78e576","16","discount","787175.56","78717.55600000001","2025-05-21T03:35:47.638Z","ضد عمر فقير عتيق مقبول الموجة اجد متطوع لأن مثاب."
"1304","1","cd95745d-43ff-4815-a47e-d7a7662863ff","12","withdraw","240590.28","24059.028","2025-05-20T20:45:20.413Z","جهاز دور تدوس لطيف يتعقب فقير العزلة بكمل شمس."
"1305","6","9361d272-2f4a-4d82-9103-83ff91fdbcff","3","deposit","149149.66","14914.966","2025-05-21T01:30:56.414Z","خزان جمع يقلق حاضر أعلق يتبنى."
"1306","5","1055a1e9-b52f-4209-8a66-5f489f73bebb","22","discount","521598.54","52159.854","2025-05-21T00:07:44.708Z","لذا نحن يمين يعبر اقتراح الإحسان نكون جمع تذوق."
"1307","6","dfe59ac2-9d52-4815-902f-43c4426470a2","17","discount","704054.61","70405.461","2025-05-21T06:10:26.983Z","اجل نحن خزان."
"1308","2","47d1ef8e-6265-444f-9e10-c5f690f2d146","1","deposit","984191.18","98419.118","2025-05-20T11:14:42.070Z","المدينة أفتقد ولا."
"1309","3","8acd48d7-90d7-4dc9-922e-cc30744dbc4e","23","deposit","928206.81","92820.68100000001","2025-05-20T19:29:15.639Z","المدينة عشاء علي ألفت العنكبوت أخضر المعجل زجاجة وقت هواء."
"1310","3","f9b98118-c29d-416b-8042-2f7441c1be61","2","discount","749651.91","74965.191","2025-05-20T10:52:55.568Z","أو اضفت صديق."
"1311","4","1ed59d90-52f8-40b0-85a3-0fd936236ca9","24","deposit","336765.12","33676.512","2025-05-20T18:57:25.193Z","جهاز أخسر لك العنكبوت."
"1312","1","186d743e-3e9c-43b7-85aa-f089298a0aa9","4","discount","977901.1","97790.11","2025-05-20T19:16:20.123Z","سنة بدانة امراء مدح."
"1313","1","ba63ad31-b90a-4291-a438-c0e53fb46692","15","discount","722213.03","72221.303","2025-05-21T04:51:21.110Z","وَسَط العمل غرفة ملل أطلق النهر بداهة النهر الجنون."
"1314","1","ba63ad31-b90a-4291-a438-c0e53fb46692","15","deposit","130165.05","13016.505000000001","2025-05-21T06:43:31.508Z","حقيقي سهل يتمتع كتف برونز حياة ثالث مستمر متأخر."
"1315","4","1ed59d90-52f8-40b0-85a3-0fd936236ca9","24","deposit","922902.58","92290.258","2025-05-21T04:48:46.480Z","سيل أسقط ازعم يتعقب التفاضل مال ذاهب."
"1316","5","1ba1157f-48f2-46c3-b4d3-bcc47c1af231","20","discount","163672.05","16367.204999999998","2025-05-20T13:14:20.900Z","سأفتح أدير مرحبا المعجل هم."
"1317","3","5e962467-ee7d-4204-840e-cbc4a1239861","18","deposit","183181.45","18318.145","2025-05-21T08:52:44.625Z","عصا يضحك مبتذلة أخسر ربط."
"1318","1","06a97fb2-838b-4060-8fff-799663e53f31","21","discount","74279.14","7427.914","2025-05-20T20:18:16.273Z","منتج رهيب الحمدون تدليك مدينة رياح."
"1319","1","40f869cb-350c-4f36-940c-1735da09e52c","11","deposit","233977.89","23397.789","2025-05-20T16:55:01.772Z","مواطنون القليل دورة."
"1320","5","da3156cf-60e4-4978-beaf-a3fed77cd6a7","10","deposit","738601.81","73860.18100000001","2025-05-21T05:08:18.195Z","مشهور مقنع أظن يعيق."
"1321","1","06a97fb2-838b-4060-8fff-799663e53f31","21","withdraw","495119.2","49511.92","2025-05-21T04:54:47.682Z","الجسم روح مدهش صحيح يشمل لجأ متزوجة لكن أغطي."
"1322","1","40f869cb-350c-4f36-940c-1735da09e52c","11","discount","603174.54","60317.454000000005","2025-05-21T01:42:27.331Z","سنشتاق تعتاد فضة أرتب اجل يليق حجاب ساحقة اقول."
"1323","2","b1bccddd-8c55-496a-8ecf-f6b02b78e576","16","withdraw","791655.78","79165.57800000001","2025-05-21T05:05:04.017Z","نجح بكثرة عن حبيب."
"1324","2","47d1ef8e-6265-444f-9e10-c5f690f2d146","1","deposit","664248.25","66424.825","2025-05-20T19:17:14.641Z","ايقاد أخشى كارثة."
"1325","3","c5ea39ac-aea0-4ec7-96dd-5ac8578de5c1","8","deposit","166741.46","16674.146","2025-05-20T14:55:30.846Z","الرافض تجمع مواطنون متنوع الوصاية فضائي النهر ثالاسانوس."
"1326","1","cd95745d-43ff-4815-a47e-d7a7662863ff","12","discount","209706.45","20970.645","2025-05-20T20:56:58.645Z","حلها أكون لإختيار باقية وَسَط استطيع زعتر الحضارة."
"1327","6","b5be6eaa-7747-4707-934b-a9ac9671a1d3","25","discount","599807.96","59980.795999999995","2025-05-20T15:39:56.396Z","تحية إلا اعتدال أركل مساء في يليق نفسه."
"1328","6","dfe59ac2-9d52-4815-902f-43c4426470a2","17","deposit","599136.96","59913.695999999996","2025-05-20T11:12:42.397Z","الجرأة خزانة وحشي جسم تجريبي العنوان مخزون وسوف يقام."
"1329","1","186d743e-3e9c-43b7-85aa-f089298a0aa9","4","discount","700749.05","70074.905","2025-05-20T18:41:50.379Z","ضد عير ويل."
"1330","1","b8817740-801d-447d-b06e-ffa40fc47cd6","5","deposit","678811.65","67881.16500000001","2025-05-20T11:27:26.422Z","يلمس سيصيبني أقوي الفراء نستنتج."
"1331","4","1ed59d90-52f8-40b0-85a3-0fd936236ca9","24","withdraw","138482.46","13848.246","2025-05-21T01:19:48.957Z","مرآة ألم اجد كرامة ملكنا مجموع اسمنت قصير الأكثر ملاك."
"1332","1","ba63ad31-b90a-4291-a438-c0e53fb46692","15","deposit","152001.65","15200.164999999999","2025-05-21T00:12:36.347Z","إدارة بِكر السترة يسير أحمل."
"1333","3","8acd48d7-90d7-4dc9-922e-cc30744dbc4e","23","withdraw","446037.88","44603.788","2025-05-20T11:41:14.831Z","سلب سلب أحمل الجسم اناقش عاقل عجز حل يعبر عضوية."
"1334","5","00c6a871-dcc5-458a-b59c-6f14fc89e385","6","withdraw","410124.43","41012.443","2025-05-20T18:32:42.293Z","الوادي استطيع كاحل شمس أتذكر الاقتراع."
"1335","3","8acd48d7-90d7-4dc9-922e-cc30744dbc4e","23","deposit","739053.51","73905.351","2025-05-20T19:35:15.405Z","سير بقرة سبب أخضر صلب متقلب مهد مثاب وحشي فقط."
"1336","1","186d743e-3e9c-43b7-85aa-f089298a0aa9","4","deposit","547044.58","54704.458","2025-05-20T13:39:41.947Z","الحقيقة يجب أخرى الموعد."
"1337","3","5e962467-ee7d-4204-840e-cbc4a1239861","18","withdraw","960196.2","96019.62","2025-05-21T06:38:50.470Z","إليك عنوان تهور بلطف الفصل."
"1338","6","dfe59ac2-9d52-4815-902f-43c4426470a2","17","discount","920475.12","92047.512","2025-05-20T20:33:41.137Z","نجمة سنة الإحسان سماء بدانة باتجاه اقود."
"1339","3","c5ea39ac-aea0-4ec7-96dd-5ac8578de5c1","8","discount","770442.55","77044.255","2025-05-21T07:25:08.945Z","متماسك اخترت غالباً المحسنات عم اضع مهدئ ما."
"1340","3","8acd48d7-90d7-4dc9-922e-cc30744dbc4e","23","deposit","474852.97","47485.297","2025-05-21T00:37:06.833Z","أخسر سنشتاق حق جسم حزن متطوع المسرح والنسيج بعنف."
"1341","5","1ba1157f-48f2-46c3-b4d3-bcc47c1af231","20","withdraw","523378.17","52337.816999999995","2025-05-20T16:20:02.965Z","على جرس متى قبول رفيع."
"1342","6","c5ca28a6-daca-4ca6-b69c-ea651ec6fce7","13","withdraw","815804.32","81580.432","2025-05-21T04:06:55.241Z","تبني أغطي رفيع كرس ينضم جسم."
"1343","5","00c6a871-dcc5-458a-b59c-6f14fc89e385","6","discount","618650.43","61865.043000000005","2025-05-21T05:45:50.243Z","حلاق رقابة خشن نظيف."
"1344","3","5e962467-ee7d-4204-840e-cbc4a1239861","18","discount","161845.6","16184.560000000001","2025-05-20T15:31:20.002Z","تواصل قبول دعه نفع."
"1345","3","eedddfb1-7bfc-4de8-93f9-a2b08d928eca","7","withdraw","446614.65","44661.465000000004","2025-05-21T07:11:51.969Z","صدر ثلاثون الفائز قطة عاصف أدير."
"1346","3","c5ea39ac-aea0-4ec7-96dd-5ac8578de5c1","8","withdraw","909053.92","90905.392","2025-05-20T13:11:59.096Z","يرتقع برودة يتذكر السعة أتصل رقبة مسرح فوق ثابت."
"1347","1","cd95745d-43ff-4815-a47e-d7a7662863ff","12","discount","929289.29","92928.929","2025-05-21T03:42:28.362Z","شراب كلمة مصلح لحية أثاث مثل فضائي."
"1348","5","1ef452d3-ba25-4ed6-908b-0a7b523a1350","14","withdraw","575928.29","57592.829000000005","2025-05-21T09:16:59.484Z","حال تنبيه يحشد."
"1349","3","2cb56510-2ea7-40fe-be56-2f07b3267606","26","withdraw","542724.88","54272.488","2025-05-20T12:11:29.217Z","جميل مراعاة إلتواء حسنة إعجاب ثالث وظائف المحدد أدعم إبعاد."
"1350","2","47d1ef8e-6265-444f-9e10-c5f690f2d146","1","deposit","797997.39","79799.739","2025-05-21T00:25:23.070Z","تجريبي فضة إذا إلا نسج ثابت."
"1351","6","1394a8cb-e88e-48ce-9fc5-c6732abf2fdb","9","deposit","862994.03","86299.403","2025-05-21T00:28:05.535Z","التفاضل إعجاب شيء شاب صدوق."
"1352","1","ba63ad31-b90a-4291-a438-c0e53fb46692","15","deposit","694335.67","69433.56700000001","2025-05-20T11:59:08.715Z","نجمة كلمة يمسح آخر اشرب معماري ملعقة إليك عتيق."
"1353","5","1ef452d3-ba25-4ed6-908b-0a7b523a1350","14","discount","610229.19","61022.918999999994","2025-05-20T10:41:07.632Z","يشمل يغني أقترح رأس باقية كوب الرأفة."
"1354","6","1394a8cb-e88e-48ce-9fc5-c6732abf2fdb","9","withdraw","921205.33","92120.533","2025-05-21T07:13:25.664Z","أدوس تأكيد ولا تصل صورة يهرب."
"1355","5","1055a1e9-b52f-4209-8a66-5f489f73bebb","22","deposit","597750.76","59775.076","2025-05-20T20:40:02.141Z","عالميا ايقاد ويفر اشرب."
"1356","3","5e962467-ee7d-4204-840e-cbc4a1239861","18","deposit","985875.4","98587.54000000001","2025-05-20T13:28:30.884Z","محكمة ألم امراء أو مفيد."
"1357","3","7cb68b97-a7ae-4acf-b669-7e20b6e501ad","19","deposit","807069.46","80706.946","2025-05-20T11:22:56.448Z","أتصل بكمل عزيز يشمل الفائز تعتاد المجلد آخر وقت."
"1358","6","b5be6eaa-7747-4707-934b-a9ac9671a1d3","25","withdraw","688266.6","68826.66","2025-05-20T13:54:22.367Z","بوق قادم عن نعسان."
"1359","5","da3156cf-60e4-4978-beaf-a3fed77cd6a7","10","deposit","394916.84","39491.684","2025-05-20T16:29:21.541Z","مستقر دخول أقول يقفز ذاهب متساوي بهجة له."
"1360","3","2cb56510-2ea7-40fe-be56-2f07b3267606","26","discount","673265.28","67326.528","2025-05-21T07:33:06.121Z","تماثيل ناعم رجولي جهد محبوب الأليف حقيقي الأليف أشياء جداً."
"1361","2","47d1ef8e-6265-444f-9e10-c5f690f2d146","1","discount","840278.28","84027.82800000001","2025-05-21T07:23:08.844Z","اضفت دعه تواصل الموقف عباس لو."
"1362","3","f9b98118-c29d-416b-8042-2f7441c1be61","2","discount","827423.49","82742.349","2025-05-20T18:51:58.007Z","الجميع المرسول يأتي اضفت."
"1363","5","1ba1157f-48f2-46c3-b4d3-bcc47c1af231","20","withdraw","9831.17","983.117","2025-05-21T10:14:25.430Z","وذلك غداً بلدة مقنع خلوق."
"1364","5","1055a1e9-b52f-4209-8a66-5f489f73bebb","22","deposit","432865.12","43286.512","2025-05-20T13:36:43.273Z","نفع نجمة الرأفة أريد أدير المرسول كرس غداً إلى أمان."
"1365","2","47d1ef8e-6265-444f-9e10-c5f690f2d146","1","discount","116876.97","11687.697","2025-05-20T20:15:01.531Z","أفضل مواطنون سلسلة مدينة قطة."
"1366","1","cd95745d-43ff-4815-a47e-d7a7662863ff","12","discount","925171.83","92517.18299999999","2025-05-21T05:01:34.898Z","نعل أستسلم باقية أوزة حر."
"1367","5","da3156cf-60e4-4978-beaf-a3fed77cd6a7","10","withdraw","354851.21","35485.121","2025-05-20T19:23:30.221Z","يستثني زعتر قيمة ركن من يوم قوة لكم."
"1368","5","1ba1157f-48f2-46c3-b4d3-bcc47c1af231","20","deposit","161354.04","16135.404","2025-05-20T18:14:23.257Z","حصلت امتعة الحياة اصرخ لكن سمحت توربيني الموعد ماهر معركة."
"1369","3","2cb56510-2ea7-40fe-be56-2f07b3267606","26","withdraw","923797.27","92379.727","2025-05-20T15:11:38.192Z","خادمة يسامح أثاث أدير ألحق الأمل تحت أتصل ملل تدريبات."
"1370","3","5e962467-ee7d-4204-840e-cbc4a1239861","18","withdraw","694060.92","69406.092","2025-05-20T21:38:50.820Z","تصل زال مدينة يأمل الكبرى عمر."
"1371","6","b5be6eaa-7747-4707-934b-a9ac9671a1d3","25","withdraw","111117.82","11111.782000000001","2025-05-20T16:26:16.293Z","اعتدال مدح ضد."
"1372","6","b5be6eaa-7747-4707-934b-a9ac9671a1d3","25","deposit","752214.63","75221.463","2025-05-20T23:17:52.755Z","الكبرى ذهبي يبعد جَذّاب والنسيج هذا معتاد."
"1373","5","1055a1e9-b52f-4209-8a66-5f489f73bebb","22","deposit","255378.84","25537.884","2025-05-20T15:30:00.662Z","اضع سألتصق كيف قبول تواصل شائع السترة ليّن."
"1374","3","7cb68b97-a7ae-4acf-b669-7e20b6e501ad","19","deposit","614659.93","61465.993","2025-05-21T05:23:00.879Z","بلطف فائدة اخذت هذا يصلح."
"1375","1","186d743e-3e9c-43b7-85aa-f089298a0aa9","4","discount","38584.91","3858.4910000000004","2025-05-20T18:41:04.702Z","يتعلم بلطف تدريبات حضري الفائز."
"1376","5","1055a1e9-b52f-4209-8a66-5f489f73bebb","22","withdraw","656156.21","65615.621","2025-05-20T15:04:59.447Z","مقنع تعتاد قميص عريض."
"1377","3","8acd48d7-90d7-4dc9-922e-cc30744dbc4e","23","discount","22321.87","2232.187","2025-05-20T16:53:06.006Z","اصرخ خجول الأساسي طريق غائب لون."
"1378","3","2cb56510-2ea7-40fe-be56-2f07b3267606","26","deposit","700155.69","70015.56899999999","2025-05-20T16:29:10.268Z","في لون تذوق تم تاج."
"1379","2","47d1ef8e-6265-444f-9e10-c5f690f2d146","1","withdraw","148869.84","14886.984","2025-05-21T10:05:26.267Z","واسع الريح صالح ماهر أفتقد يفصل حلها صوت أقوي."
"1380","6","b5be6eaa-7747-4707-934b-a9ac9671a1d3","25","deposit","524346.39","52434.639","2025-05-21T03:15:17.643Z","يفتح التي رمي أقوي."
"1381","1","40f869cb-350c-4f36-940c-1735da09e52c","11","deposit","749887.82","74988.78199999999","2025-05-20T15:20:09.212Z","يتبنى عدد كما مثاب."
"1382","5","da3156cf-60e4-4978-beaf-a3fed77cd6a7","10","discount","877230.69","87723.06899999999","2025-05-20T15:41:46.711Z","الجانبين نعسان كرامة أمان."
"1383","6","9361d272-2f4a-4d82-9103-83ff91fdbcff","3","deposit","873970.43","87397.043","2025-05-20T19:12:11.469Z","أخرى يستوعب دواء مادة برعاية نجح السرج تدريبات لو تم."
"1384","3","8acd48d7-90d7-4dc9-922e-cc30744dbc4e","23","withdraw","473265.96","47326.596000000005","2025-05-20T17:06:55.762Z","سيارة وسيم سهم كرس المعجل."
"1385","5","da3156cf-60e4-4978-beaf-a3fed77cd6a7","10","withdraw","632882.44","63288.24399999999","2025-05-20T21:28:06.421Z","العنكبوت أطير جسم السرج تقطر حزن يعيق كل تحت أقوي."
"1386","6","9361d272-2f4a-4d82-9103-83ff91fdbcff","3","discount","250066.45","25006.645","2025-05-21T01:27:50.936Z","الحقيقة معماري بهجة فاجأ."
"1387","5","00c6a871-dcc5-458a-b59c-6f14fc89e385","6","withdraw","800174.55","80017.455","2025-05-21T04:22:39.734Z","جمال تاج الملابس الحمامات مظلمة يسامح متشوق بالاسفل."
"1388","3","c5ea39ac-aea0-4ec7-96dd-5ac8578de5c1","8","deposit","822438.84","82243.88399999999","2025-05-21T08:24:38.183Z","يضحك سليم جميع يقارن رماد مستمر ممتع."
"1389","3","7cb68b97-a7ae-4acf-b669-7e20b6e501ad","19","discount","700627.64","70062.764","2025-05-20T15:26:33.594Z","نستنتج اجل ضيق العليا قال الحضارة يصدق مواطنة آخر مشين."
"1390","1","40f869cb-350c-4f36-940c-1735da09e52c","11","withdraw","898480.18","89848.01800000001","2025-05-21T09:49:24.948Z","أعتبر كومة مرارًا مرهق يأسر."
"1391","1","cd95745d-43ff-4815-a47e-d7a7662863ff","12","deposit","555827.4","55582.740000000005","2025-05-21T10:16:51.771Z","اصرخ كلاهما ل إعجاب مع خفض يظهر."
"1392","5","1ef452d3-ba25-4ed6-908b-0a7b523a1350","14","withdraw","204318.81","20431.881","2025-05-20T16:33:37.000Z","ضيق جهد نعسان كرس أرض تحمل اعتدال إضافي."
"1393","2","47d1ef8e-6265-444f-9e10-c5f690f2d146","1","discount","527690.04","52769.004","2025-05-21T09:07:11.262Z","كلاهما بالفعل الكل خيره يرفع العزلة مواطنة."
"1394","1","06a97fb2-838b-4060-8fff-799663e53f31","21","deposit","408335.97","40833.596999999994","2025-05-20T22:08:58.094Z","طويل الجانبين إبعاد مشهور جار حجرة."
"1395","1","cd95745d-43ff-4815-a47e-d7a7662863ff","12","withdraw","248868.46","24886.845999999998","2025-05-20T23:09:42.150Z","صدقة السرج أعيش فضائي كيف مؤلف لإختيار بقدر."
"1396","1","b8817740-801d-447d-b06e-ffa40fc47cd6","5","discount","385567.33","38556.733","2025-05-21T00:13:52.003Z","يتردد قال يلاحظ أعمى معك ثلاثون الأمل كريم."
"1397","3","c5ea39ac-aea0-4ec7-96dd-5ac8578de5c1","8","withdraw","280638.14","28063.814000000002","2025-05-20T23:08:59.860Z","الخصم رهيب النفخ ويفر."
"1398","1","ba63ad31-b90a-4291-a438-c0e53fb46692","15","withdraw","493652.39","49365.239","2025-05-20T14:00:05.958Z","هم أطير المد على عزيزي مصلح مجموع أفترض صيف."
"1399","1","cd95745d-43ff-4815-a47e-d7a7662863ff","12","deposit","253543.2","25354.32","2025-05-20T18:30:34.585Z","عتيق الفصل ظل بالاسفل هنا معك أي أكون يمسح أسمع."
"1400","5","00c6a871-dcc5-458a-b59c-6f14fc89e385","6","deposit","135499.57","13549.957","2025-05-21T08:30:20.039Z","مشهد تحية حال أجبر ارباح رقابة الحقيقة ثلاثة بالغ برونز."
"1401","3","c5ea39ac-aea0-4ec7-96dd-5ac8578de5c1","8","withdraw","73405.07","7340.5070000000005","2025-05-20T23:43:54.472Z","قبل سأشرح أكون مجمع منجلي شاب."
"1402","6","c5ca28a6-daca-4ca6-b69c-ea651ec6fce7","13","deposit","536103.23","53610.323","2025-05-20T18:11:38.528Z","طباشير سهل شراب."
"1403","2","47d1ef8e-6265-444f-9e10-c5f690f2d146","1","deposit","347163.55","34716.354999999996","2025-05-20T19:34:21.513Z","حبيب هؤلاء بدانة يسير رجولي أدافع متزوجة الفائز."
"1404","3","eedddfb1-7bfc-4de8-93f9-a2b08d928eca","7","withdraw","649982.28","64998.228","2025-05-21T09:02:32.519Z","سألتصق نفع المعجل يعرفون يصدق مِرفَق قف متزوجة فاجأ تصويت."
"1405","2","47d1ef8e-6265-444f-9e10-c5f690f2d146","1","discount","170632.58","17063.257999999998","2025-05-21T03:07:37.982Z","بدانة راحة يرتجف."
