transaction_id,partner_id,store_id,internal_store_id,transaction_type,amount,amount_platform_commission,transaction_date,notes
"3786","1","ba63ad31-b90a-4291-a438-c0e53fb46692","15","withdraw","77390.9","7739.089999999999","2025-05-20T22:59:47.307Z","الحقيقة تستوعب المرونة مصطنع ديكور متطور دور قليل يظهر."
"3787","3","eedddfb1-7bfc-4de8-93f9-a2b08d928eca","7","deposit","410582.32","41058.232","2025-05-21T05:55:22.579Z","كلمة سنة العاشر أطلق."
"3788","3","7cb68b97-a7ae-4acf-b669-7e20b6e501ad","19","withdraw","693284.6","69328.45999999999","2025-05-20T17:06:57.848Z","أركل و الشاعر حساب ثلاث فشيأ."
"3789","3","f9b98118-c29d-416b-8042-2f7441c1be61","2","deposit","117488.75","11748.875","2025-05-20T14:41:45.104Z","وظائف محبوب برودة عاصف خيره أطير عزيز منتج."
"3790","5","1ba1157f-48f2-46c3-b4d3-bcc47c1af231","20","deposit","664019.18","66401.918","2025-05-21T00:00:37.244Z","يساهم هنا مزايا قوي."
"3791","3","f9b98118-c29d-416b-8042-2f7441c1be61","2","withdraw","552661.24","55266.123999999996","2025-05-21T08:41:53.973Z","انزعها أَخَّاذ تحية حبيب شجيرة."
"3792","5","1ba1157f-48f2-46c3-b4d3-bcc47c1af231","20","deposit","985336.46","98533.646","2025-05-21T00:01:51.828Z","الناس ألحق سلم الحمدون."
"3793","3","7cb68b97-a7ae-4acf-b669-7e20b6e501ad","19","deposit","233370.27","23337.027","2025-05-20T21:33:32.829Z","حجرة عاصف مدينة."
"3794","1","ba63ad31-b90a-4291-a438-c0e53fb46692","15","deposit","265266.1","26526.609999999997","2025-05-20T14:26:39.512Z","يحل إدارة استراحة إنها مجموعة حزينين مكاتب فشيأ و ابن."
"3795","1","06a97fb2-838b-4060-8fff-799663e53f31","21","discount","755436.43","75543.64300000001","2025-05-20T12:40:12.117Z","متوسط سويا كما فاجأ قف اخترت كنيس اهداء."
"3796","2","47d1ef8e-6265-444f-9e10-c5f690f2d146","1","withdraw","333112.63","33311.263","2025-05-21T05:18:40.096Z","السرج عدد السرج صوت."
"3797","1","186d743e-3e9c-43b7-85aa-f089298a0aa9","4","withdraw","709630.77","70963.077","2025-05-21T09:41:14.527Z","يسامح رابطة احترام أبدًا أحد بقدر."
"3798","1","cd95745d-43ff-4815-a47e-d7a7662863ff","12","deposit","424357.37","42435.737","2025-05-21T06:03:16.163Z","قوة نكون كاحل وقت."
"3799","5","1ef452d3-ba25-4ed6-908b-0a7b523a1350","14","withdraw","52719.05","5271.905000000001","2025-05-21T06:05:54.187Z","ضعيف مرارًا بقدر يقدموا انتهاء مشرق إيداع."
"3800","3","c5ea39ac-aea0-4ec7-96dd-5ac8578de5c1","8","withdraw","137177.94","13717.794","2025-05-20T18:20:51.758Z","تحدث مضيف ل."
"3801","6","9361d272-2f4a-4d82-9103-83ff91fdbcff","3","withdraw","490934.5","49093.45","2025-05-21T02:51:43.728Z","الموت ثلاثون انزعها فاجأ ماذا يتدحرج اقود صحيح آتي."
"3802","3","f9b98118-c29d-416b-8042-2f7441c1be61","2","deposit","732139.74","73213.974","2025-05-20T23:08:02.922Z","مهندس طالب صديق تتدفق عنوان شريك أميل تصل تريد."
"3803","6","c5ca28a6-daca-4ca6-b69c-ea651ec6fce7","13","deposit","233668.45","23366.845","2025-05-20T12:40:11.917Z","الجسم وفير الحياة."
"3804","3","eedddfb1-7bfc-4de8-93f9-a2b08d928eca","7","withdraw","681502.99","68150.299","2025-05-21T04:40:17.938Z","أخيرا أسلم اخماد ثلاثون مصلح حل نجح للرفض حقيقي."
"3805","3","f9b98118-c29d-416b-8042-2f7441c1be61","2","withdraw","669492.66","66949.266","2025-05-20T17:03:27.307Z","عزيزي عدد السجلات."
"3806","3","eedddfb1-7bfc-4de8-93f9-a2b08d928eca","7","discount","516034.31","51603.431","2025-05-21T06:40:03.907Z","بالرغم بالكاد الجسم كيك."
"3807","6","dfe59ac2-9d52-4815-902f-43c4426470a2","17","discount","50975.94","5097.594","2025-05-21T10:05:27.969Z","صحة أجبر يضحك أفتقد قديم صالح."
"3808","5","1055a1e9-b52f-4209-8a66-5f489f73bebb","22","withdraw","834653.03","83465.303","2025-05-21T09:15:06.339Z","فريق حق العاشر صدوق تصويت رجل حر صحة مادة."
"3809","1","b8817740-801d-447d-b06e-ffa40fc47cd6","5","deposit","496311.13","49631.113","2025-05-21T01:09:08.759Z","الغرفة خاشع هو أسود سأفتح بالطبع أُطرُوحَة."
"3810","5","1055a1e9-b52f-4209-8a66-5f489f73bebb","22","deposit","904111.96","90411.196","2025-05-21T07:15:59.360Z","ليّن أخضر صدوق إعجاب الوادي أين سهل يستوعب سيل أنمو."
"3811","1","ba63ad31-b90a-4291-a438-c0e53fb46692","15","deposit","874943.45","87494.345","2025-05-20T22:51:06.285Z","مراعاة احب أقدر أفترض علي أدير المحيط فارغ."
"3812","3","c5ea39ac-aea0-4ec7-96dd-5ac8578de5c1","8","withdraw","203565.68","20356.568","2025-05-20T23:01:36.130Z","عتيق منتصف يحفظ اقرر أَخَّاذ شاهد يدفع والنسيج كل."
"3813","6","dfe59ac2-9d52-4815-902f-43c4426470a2","17","deposit","585910.22","58591.022","2025-05-21T00:04:55.721Z","المقصود غداً ألحق لوم اصرخ."
"3814","5","00c6a871-dcc5-458a-b59c-6f14fc89e385","6","withdraw","716374.25","71637.425","2025-05-21T06:06:01.956Z","تحية مبتذلة حسنة."
"3815","1","186d743e-3e9c-43b7-85aa-f089298a0aa9","4","discount","365306.63","36530.663","2025-05-21T04:58:11.249Z","آمن إيداع ما الوادي مال متطوع واسع ثلاثون سرور."
"3816","5","00c6a871-dcc5-458a-b59c-6f14fc89e385","6","deposit","528216.86","52821.686","2025-05-20T11:09:48.668Z","قميص كارثة سأفتح روح اللطف أقدر كان قميص يغني أبدي."
"3817","2","47d1ef8e-6265-444f-9e10-c5f690f2d146","1","discount","983090.23","98309.023","2025-05-20T20:30:33.380Z","ثالث فقط قميص سيصيبني حبيب أدوس أشياء كشط يمين."
"3818","2","b1bccddd-8c55-496a-8ecf-f6b02b78e576","16","deposit","914717.44","91471.74399999999","2025-05-20T13:02:17.437Z","يقي الغزل يغني يتردد معك مساء منهم طباشير عمل سألتصق."
"3819","2","b1bccddd-8c55-496a-8ecf-f6b02b78e576","16","withdraw","726869.13","72686.913","2025-05-20T20:44:42.418Z","صدر غير مهجور مبتذلة مبنى."
"3820","2","47d1ef8e-6265-444f-9e10-c5f690f2d146","1","deposit","515753.12","51575.312","2025-05-20T12:45:16.325Z","أستسلم عصفور سهل متقلب موافق متساوي يكنس أسقط."
"3821","1","ba63ad31-b90a-4291-a438-c0e53fb46692","15","withdraw","558555.48","55855.547999999995","2025-05-20T18:26:42.877Z","أحاول أساعد عمل حتى سويا أرض متنوع تتدفق."
"3822","5","1ef452d3-ba25-4ed6-908b-0a7b523a1350","14","discount","325873.57","32587.357","2025-05-20T22:37:07.838Z","بسرعة على حزن قبل أنت واحد اقود عجز."
"3823","3","7cb68b97-a7ae-4acf-b669-7e20b6e501ad","19","deposit","937829.13","93782.913","2025-05-20T12:36:45.756Z","قصير ثلاثة نشأ السماع الجرأة حقيقي سيارة سألتصق صنعت."
"3824","6","1394a8cb-e88e-48ce-9fc5-c6732abf2fdb","9","deposit","239017.33","23901.733","2025-05-20T19:57:21.435Z","وفير مدح سن بالكاد أنهض لوت قيد."
"3825","6","dfe59ac2-9d52-4815-902f-43c4426470a2","17","withdraw","416203.22","41620.322","2025-05-20T15:55:49.317Z","كافٍ ملل لذا يصلح جهاز."
"3826","6","c5ca28a6-daca-4ca6-b69c-ea651ec6fce7","13","discount","770994.71","77099.47099999999","2025-05-21T02:46:27.663Z","امراء ثالاسانوس فليكن طباشير حب تدليك مضت يترتب الوصول."
"3827","1","40f869cb-350c-4f36-940c-1735da09e52c","11","discount","409702.01","40970.201","2025-05-21T03:51:33.269Z","بحكمة يضحك خلف لحية نحن محكمة مدح عالميا."
"3828","3","7cb68b97-a7ae-4acf-b669-7e20b6e501ad","19","withdraw","693741.21","69374.121","2025-05-21T01:59:04.931Z","في ينظف تكون مريح أفضل شيء الثعالب حاضر يقارن."
"3829","5","da3156cf-60e4-4978-beaf-a3fed77cd6a7","10","withdraw","15752.29","1575.229","2025-05-20T17:21:23.799Z","يهمني عالي ثالث."
"3830","2","47d1ef8e-6265-444f-9e10-c5f690f2d146","1","withdraw","490648.84","49064.884000000005","2025-05-20T18:30:44.057Z","محكمة يحب أبداً الرأفة منحنى أجبر العنكبوت عاصف."
"3831","5","da3156cf-60e4-4978-beaf-a3fed77cd6a7","10","deposit","239736.46","23973.646","2025-05-20T21:20:56.025Z","الطريق أدير سويا متزوجة يأخذ صدقة جمال كافٍ كشط كما."
"3832","6","b5be6eaa-7747-4707-934b-a9ac9671a1d3","25","withdraw","644246.37","64424.637","2025-05-20T17:53:47.297Z","برعاية ماهر بالغ يأسر أرتب يتبنى أدعم أَخَّاذ أسود الترحيل."
"3833","3","7cb68b97-a7ae-4acf-b669-7e20b6e501ad","19","deposit","586771","58677.1","2025-05-21T05:17:26.142Z","ضد انتهاء ينظف بشكل مسرح الجسم اغادر أطفئ المعجل شيأ."
"3834","1","ba63ad31-b90a-4291-a438-c0e53fb46692","15","withdraw","156516.14","15651.614000000001","2025-05-21T04:24:31.250Z","ملل العائلة الجناح مخزون عادة خجول."
"3835","1","40f869cb-350c-4f36-940c-1735da09e52c","11","deposit","168964.53","16896.453","2025-05-20T18:56:57.194Z","القوي مستقر حقا هذا قبول معبد."
"3836","6","9361d272-2f4a-4d82-9103-83ff91fdbcff","3","discount","716893.37","71689.337","2025-05-21T03:37:20.958Z","المقصود نسج هواء."
"3837","5","da3156cf-60e4-4978-beaf-a3fed77cd6a7","10","withdraw","591051.92","59105.192","2025-05-21T09:22:52.630Z","الموت الكل تتدفق ذاهب."
"3838","1","cd95745d-43ff-4815-a47e-d7a7662863ff","12","deposit","521184.51","52118.451","2025-05-20T13:40:11.525Z","خاشع سبب إلى تحمل شراب."
"3839","4","1ed59d90-52f8-40b0-85a3-0fd936236ca9","24","discount","126868.69","12686.869","2025-05-21T10:07:36.168Z","سألتصق بطريقة أخيرا السماوي يقارن فضائي نتهم يحذب أقسى."
"3840","4","1ed59d90-52f8-40b0-85a3-0fd936236ca9","24","withdraw","704394.92","70439.492","2025-05-21T00:14:06.090Z","حر لجأ حسنة أذن."
"3841","3","2cb56510-2ea7-40fe-be56-2f07b3267606","26","discount","908038.55","90803.85500000001","2025-05-21T10:21:00.092Z","بوق المحيط ليّن مرسوم حجاب الخصم ضعيف سيصيبني شروط طباشير."
"3842","3","8acd48d7-90d7-4dc9-922e-cc30744dbc4e","23","withdraw","848140.9","84814.09","2025-05-21T06:22:03.863Z","علي حسنًا يصلح بعيد الاقتراع صدقة دعه عادة العليا."
"3843","1","40f869cb-350c-4f36-940c-1735da09e52c","11","deposit","581083.32","58108.331999999995","2025-05-21T05:47:37.682Z","لذلك بدانة ممتع."
"3844","3","eedddfb1-7bfc-4de8-93f9-a2b08d928eca","7","deposit","776713.19","77671.31899999999","2025-05-21T07:31:47.382Z","ايام يهمني إضافي باتجاه حال."
"3845","3","eedddfb1-7bfc-4de8-93f9-a2b08d928eca","7","discount","830080.2","83008.01999999999","2025-05-20T19:24:06.904Z","لذا أبدي قيمة ينظف الذات يحشد بيئة."
"3846","2","47d1ef8e-6265-444f-9e10-c5f690f2d146","1","withdraw","43353.98","4335.398","2025-05-20T16:45:04.861Z","مبروك انعش الفصل صدر يصلح."
"3847","5","1ef452d3-ba25-4ed6-908b-0a7b523a1350","14","deposit","516358.63","51635.863","2025-05-20T21:35:40.387Z","باهظ يسير ممتع الماء اجلس يزيل الاقتراع مواطن."
"3848","6","dfe59ac2-9d52-4815-902f-43c4426470a2","17","discount","770258.36","77025.836","2025-05-21T06:11:11.441Z","اخترت متع بعيد يعيق سريع آتي ملموس ضجة مرات توربيني."
"3849","5","1ef452d3-ba25-4ed6-908b-0a7b523a1350","14","discount","721197.97","72119.79699999999","2025-05-21T03:45:17.843Z","رحلة مصطنع جَذّاب زال."
"3850","3","7cb68b97-a7ae-4acf-b669-7e20b6e501ad","19","discount","452360.86","45236.085999999996","2025-05-20T18:36:39.381Z","عالي المحدد يتردد فاجأ مختفي اخماد طويل."
"3851","5","1ba1157f-48f2-46c3-b4d3-bcc47c1af231","20","deposit","473547.08","47354.708","2025-05-20T11:17:14.495Z","رأى حلها معبد المنشئ أقول الوادي حياة يفضل."
"3852","4","1ed59d90-52f8-40b0-85a3-0fd936236ca9","24","discount","493423.53","49342.353","2025-05-21T02:02:19.090Z","الحضارة سليم معركة."
"3853","2","47d1ef8e-6265-444f-9e10-c5f690f2d146","1","withdraw","370299.45","37029.945","2025-05-20T14:17:49.959Z","حامض نستنتج وسوف زال."
"3854","5","1ba1157f-48f2-46c3-b4d3-bcc47c1af231","20","discount","191969.98","19196.998","2025-05-20T23:44:38.035Z","رحلة مهجور الثعالب تبني."
"3855","6","9361d272-2f4a-4d82-9103-83ff91fdbcff","3","deposit","653759.17","65375.917","2025-05-21T01:33:41.585Z","مضت منطقة كرس مرارًا."
"3856","3","eedddfb1-7bfc-4de8-93f9-a2b08d928eca","7","deposit","450356.15","45035.615000000005","2025-05-21T07:16:31.172Z","يتبنى أركل قف باستمرار."
"3857","6","9361d272-2f4a-4d82-9103-83ff91fdbcff","3","withdraw","323404.38","32340.438000000002","2025-05-20T22:05:14.868Z","مجموعة يكتسب مرحبا طويل يمسح تصويت."
"3858","4","1ed59d90-52f8-40b0-85a3-0fd936236ca9","24","deposit","956972.7","95697.26999999999","2025-05-20T19:37:40.123Z","يجب الترحيل أرتب يكلف امن من."
"3859","3","5e962467-ee7d-4204-840e-cbc4a1239861","18","withdraw","768079.04","76807.90400000001","2025-05-21T04:41:52.349Z","سيصيبني مائة يوم سويا."
"3860","4","1ed59d90-52f8-40b0-85a3-0fd936236ca9","24","withdraw","240972.24","24097.224","2025-05-21T09:04:49.798Z","عادة كثيرة مرحبا أمان أَخَّاذ وُلِدّ."
"3861","6","b5be6eaa-7747-4707-934b-a9ac9671a1d3","25","deposit","992332.52","99233.25200000001","2025-05-21T03:57:52.294Z","مواطنون الجناح حتى آخرون."
"3862","6","1394a8cb-e88e-48ce-9fc5-c6732abf2fdb","9","deposit","886858.09","88685.809","2025-05-21T02:58:33.035Z","دورة نَسِيج أخرى مخترع يتعلم رعاية مخترع سوف أو."
"3863","4","1ed59d90-52f8-40b0-85a3-0fd936236ca9","24","discount","103843.83","10384.383","2025-05-20T18:09:31.995Z","طبقة فقير يكتسب يقرر."
"3864","6","c5ca28a6-daca-4ca6-b69c-ea651ec6fce7","13","withdraw","210002.46","21000.246","2025-05-20T20:09:23.315Z","أخرى كلاهما رابطة حياة كنز أنت مشرق."
"3865","1","b8817740-801d-447d-b06e-ffa40fc47cd6","5","withdraw","506050.93","50605.093","2025-05-20T23:39:54.522Z","بكمل يزيل يقلق خجول أجوف دخول زيادة."
"3866","1","cd95745d-43ff-4815-a47e-d7a7662863ff","12","withdraw","197894.64","19789.464","2025-05-20T11:56:41.587Z","بالفعل التفاضل أخيرا امتعة يمارس فليكن."
"3867","3","c5ea39ac-aea0-4ec7-96dd-5ac8578de5c1","8","withdraw","439490.3","43949.03","2025-05-21T01:10:22.670Z","على ثلاث تصويت محبوب امراء البقية آخر ماهر كلب تدريبات."
"3868","3","f9b98118-c29d-416b-8042-2f7441c1be61","2","discount","286807.91","28680.790999999997","2025-05-20T11:10:03.253Z","ل عضوية جهاز دور ضجة انهم أين كثيرة شخص."
"3869","1","40f869cb-350c-4f36-940c-1735da09e52c","11","withdraw","591834.21","59183.420999999995","2025-05-21T10:35:46.279Z","نشط عزيزتي عدالة خيار لأن."
"3870","2","47d1ef8e-6265-444f-9e10-c5f690f2d146","1","withdraw","650541.95","65054.19499999999","2025-05-20T10:46:20.249Z","عليه الحياة متى مستمر شعر نفع متطابقة يهرب أخضر."
"3871","5","1055a1e9-b52f-4209-8a66-5f489f73bebb","22","withdraw","187361.38","18736.138","2025-05-20T23:57:14.162Z","خزان أفتح بدأت يفضل سلام الرأفة يلاحظ."
"3872","3","5e962467-ee7d-4204-840e-cbc4a1239861","18","withdraw","833010.19","83301.019","2025-05-20T12:02:53.591Z","المقصود مدهش رمي غالباً كبير عجز الجانبين."
"3873","1","ba63ad31-b90a-4291-a438-c0e53fb46692","15","deposit","688235.86","68823.586","2025-05-20T15:05:29.764Z","ويفر والتكامل الحياة التشقلب تصويت."
"3874","2","47d1ef8e-6265-444f-9e10-c5f690f2d146","1","discount","209481.83","20948.182999999997","2025-05-20T17:19:48.114Z","اسم تأكيد نائب."
"3875","5","1ba1157f-48f2-46c3-b4d3-bcc47c1af231","20","discount","544539.48","54453.948","2025-05-20T22:55:48.410Z","معماري واع اقف بشكل جهاز عم مجال مخزون الترحيل شائع."
"3876","3","c5ea39ac-aea0-4ec7-96dd-5ac8578de5c1","8","withdraw","743794.21","74379.421","2025-05-21T09:48:13.142Z","بكثرة نعل المسالك متألق أخشى حر تجريبي الذي أرض."
"3877","3","2cb56510-2ea7-40fe-be56-2f07b3267606","26","deposit","519721.91","51972.191","2025-05-20T17:57:20.586Z","خطأ تتدفق مجمع يصدق زوجة."
"3878","5","1ef452d3-ba25-4ed6-908b-0a7b523a1350","14","withdraw","627168.79","62716.879","2025-05-20T13:05:15.546Z","حامض مظلمة فوق إمضاء."
"3879","5","1ef452d3-ba25-4ed6-908b-0a7b523a1350","14","discount","408801.81","40880.181","2025-05-21T08:46:59.521Z","روح فقط إعجاب الثعالب عنوان أنمو مجال يشمل أعيش زجاجة."
"3880","5","1ef452d3-ba25-4ed6-908b-0a7b523a1350","14","deposit","508917.53","50891.753000000004","2025-05-20T21:47:01.577Z","عالميا قف النزاع بالاسفل محكمة لوم هذا تبني الجنون الحال."
"3881","1","40f869cb-350c-4f36-940c-1735da09e52c","11","withdraw","622606.18","62260.618","2025-05-21T08:02:20.477Z","السعة هي اقود عم لذا زوجة نشط."
"3882","3","eedddfb1-7bfc-4de8-93f9-a2b08d928eca","7","deposit","772534.44","77253.44399999999","2025-05-21T01:39:43.830Z","انتصار مخترع نهاية فن ينمو بالكاد مقنع."
"3883","1","06a97fb2-838b-4060-8fff-799663e53f31","21","deposit","168091.48","16809.148","2025-05-20T15:38:40.958Z","عباس أحد ثلاثة ممتع اخر حجاب فحم."
"3884","4","1ed59d90-52f8-40b0-85a3-0fd936236ca9","24","discount","169942.17","16994.217","2025-05-21T05:29:17.267Z","الغزل أشياء علاج مهدئ التي بالاسفل التفاضل الغزل بطريقة."
"3885","4","1ed59d90-52f8-40b0-85a3-0fd936236ca9","24","withdraw","921279.97","92127.997","2025-05-20T19:51:26.028Z","المنشئ لجأ مرحبا صبرا تدوس الأمل رأى رقبة لكن فن."
"3886","5","1ba1157f-48f2-46c3-b4d3-bcc47c1af231","20","discount","478756.86","47875.686","2025-05-21T08:54:22.367Z","اقتراح ابرم دخول راحة حامض صبرا اخذت أعيش أخرى."
"3887","5","00c6a871-dcc5-458a-b59c-6f14fc89e385","6","deposit","245733.37","24573.337","2025-05-20T22:47:54.763Z","يصدق بهجة يليق المحسنات وسيم الطريق خشن ثالاسانوس اختراعات سن."
"3888","3","f9b98118-c29d-416b-8042-2f7441c1be61","2","withdraw","400502.38","40050.238","2025-05-21T04:56:32.057Z","زيادة آدم رجل ديون ذلك كل."
"3889","2","47d1ef8e-6265-444f-9e10-c5f690f2d146","1","withdraw","765657.04","76565.704","2025-05-20T14:01:17.758Z","أرتب عزيزي يهرب القيء."
"3890","1","cd95745d-43ff-4815-a47e-d7a7662863ff","12","discount","753158.72","75315.872","2025-05-20T18:16:56.571Z","حب ثلاثون فضيلة ينظف متشوق يسامح إلتواء رهيب أميل سنة."
"3891","3","7cb68b97-a7ae-4acf-b669-7e20b6e501ad","19","deposit","496692.45","49669.245","2025-05-21T00:43:22.876Z","بلطف سهل طريق يكون مضيف يتمتع اقرر."
"3892","6","dfe59ac2-9d52-4815-902f-43c4426470a2","17","deposit","708874.64","70887.464","2025-05-20T12:15:11.754Z","نهاية أحد أسلم مساء."
"3893","1","b8817740-801d-447d-b06e-ffa40fc47cd6","5","deposit","991914.64","99191.464","2025-05-20T11:55:06.826Z","و قوي بحكمة كرمة يقدموا أنت."
"3894","3","f9b98118-c29d-416b-8042-2f7441c1be61","2","discount","513171.06","51317.106","2025-05-21T10:28:44.247Z","تبعًا حضري شجيرة مجموع عفوية يأسر بالرغم العليا أفترض سويا."
"3895","3","2cb56510-2ea7-40fe-be56-2f07b3267606","26","deposit","132322.77","13232.276999999998","2025-05-20T19:15:32.355Z","رحلة رياح وحشي جيد شعر وذلك عدد أحمل."
"3896","5","da3156cf-60e4-4978-beaf-a3fed77cd6a7","10","discount","280077.65","28007.765000000003","2025-05-21T06:37:45.296Z","شئ سماء لجأ خلوق سير تعرُّف متشوق مقاطعة واسع يحذب."
"3897","3","eedddfb1-7bfc-4de8-93f9-a2b08d928eca","7","discount","497812.73","49781.273","2025-05-21T04:40:25.343Z","ألفت يأمل بطريقة سير نتيجة ليونة شيأ."
"3898","6","c5ca28a6-daca-4ca6-b69c-ea651ec6fce7","13","deposit","356633.38","35663.338","2025-05-21T08:59:36.119Z","سماء قال أوافق."
"3899","1","ba63ad31-b90a-4291-a438-c0e53fb46692","15","discount","472171.26","47217.126000000004","2025-05-21T02:17:04.536Z","أبداً سهم معماري ولا ألحق اناقش أعيش مدهش."
"3900","2","47d1ef8e-6265-444f-9e10-c5f690f2d146","1","discount","127782.52","12778.252","2025-05-21T08:56:21.178Z","أغنية فحم متنوع الغزل."
"3901","3","c5ea39ac-aea0-4ec7-96dd-5ac8578de5c1","8","withdraw","545621.32","54562.132","2025-05-21T00:32:29.277Z","أجوف لأن روح متنوع."
"3902","6","9361d272-2f4a-4d82-9103-83ff91fdbcff","3","deposit","636442.61","63644.261","2025-05-21T01:53:12.727Z","هنا سير ضعيف نسج أشياء قَوس طاولة قصير العاشر."
"3903","6","1394a8cb-e88e-48ce-9fc5-c6732abf2fdb","9","deposit","547380.81","54738.081000000006","2025-05-21T10:11:08.190Z","ذاهب بأغلبية روح بقرة واسع سن جسم أدافع ملكنا."
"3904","6","b5be6eaa-7747-4707-934b-a9ac9671a1d3","25","discount","976697.88","97669.788","2025-05-21T03:20:26.485Z","منهم أظن كلمة حضري يزيل ملل أميل يأمل مكان لإختيار."
"3905","2","b1bccddd-8c55-496a-8ecf-f6b02b78e576","16","deposit","384275.6","38427.56","2025-05-20T13:36:25.855Z","المدينة تعال يجب نتيجة مكاتب تحت."
"3906","5","1055a1e9-b52f-4209-8a66-5f489f73bebb","22","deposit","11775.45","1177.545","2025-05-20T22:28:15.083Z","يرتقع أبدًا وأود."
"3907","5","1ef452d3-ba25-4ed6-908b-0a7b523a1350","14","discount","90256.2","9025.619999999999","2025-05-20T21:14:42.366Z","تستوعب بقدر متأخر إنه السماع المدفأة رعاية."
"3908","5","1ef452d3-ba25-4ed6-908b-0a7b523a1350","14","withdraw","495211.38","49521.138","2025-05-20T19:36:08.793Z","اليقظة العاشر ادافع نتيجة المدينة أحضر وَرَاءَ معماري."
"3909","1","186d743e-3e9c-43b7-85aa-f089298a0aa9","4","deposit","477692.19","47769.219","2025-05-21T10:01:03.023Z","إلا رأى المشي تقطر وأود اقول قَوس محفوظ عزيزي مهدئ."
"3910","5","1055a1e9-b52f-4209-8a66-5f489f73bebb","22","withdraw","692842.5","69284.25","2025-05-21T10:03:01.111Z","وظائف نسج الفراء أقسم ضعيف باتجاه أخشى ملعقة أحد."
"3911","5","1055a1e9-b52f-4209-8a66-5f489f73bebb","22","deposit","285327.75","28532.775","2025-05-20T17:27:06.924Z","الجسم مكان الجسم مرارًا الشفق."
"3912","5","00c6a871-dcc5-458a-b59c-6f14fc89e385","6","withdraw","328291.8","32829.18","2025-05-20T17:54:48.930Z","بهجة الجناح مختفي هؤلاء الكبرى يرتقع أغطي يمسح ادافع."
"3913","6","dfe59ac2-9d52-4815-902f-43c4426470a2","17","withdraw","131483.2","13148.320000000002","2025-05-21T05:25:19.898Z","سمة تحمل عصا."
"3914","2","47d1ef8e-6265-444f-9e10-c5f690f2d146","1","discount","870311.57","87031.15699999999","2025-05-20T12:59:37.860Z","اجد مكعب بحكمة ليونة ينظف منجلي ابن."
"3915","3","c5ea39ac-aea0-4ec7-96dd-5ac8578de5c1","8","deposit","814599.08","81459.908","2025-05-21T05:27:10.503Z","ركن بالباص الطريق تحية الرقص دور المقصود شريك صدر متماسك."
"3916","3","8acd48d7-90d7-4dc9-922e-cc30744dbc4e","23","discount","929706.15","92970.615","2025-05-21T08:17:03.511Z","مفيد غير خفض اخترت ضيق شيأ."
"3917","1","40f869cb-350c-4f36-940c-1735da09e52c","11","discount","317383.96","31738.396","2025-05-21T02:58:18.549Z","بوق عقل دعوى أقسم سلب أثاث إليك يصدق كنيس."
"3918","3","c5ea39ac-aea0-4ec7-96dd-5ac8578de5c1","8","discount","567863.23","56786.323","2025-05-20T14:22:25.373Z","المشي دعوى صداقة اقول أقسم إنني الاقتراع تذوق يمسح."
"3919","5","1ba1157f-48f2-46c3-b4d3-bcc47c1af231","20","discount","628243.21","62824.320999999996","2025-05-20T21:43:47.554Z","مستمر قيد ارباح الترحيل المعجل فقط مِرفَق."
"3920","5","1ef452d3-ba25-4ed6-908b-0a7b523a1350","14","discount","788520.36","78852.036","2025-05-20T13:39:39.262Z","تعتاد ملعقة يمين."
"3921","5","1055a1e9-b52f-4209-8a66-5f489f73bebb","22","discount","654215.55","65421.55500000001","2025-05-21T05:42:16.233Z","كل يقام احصل يلائم."
"3922","3","eedddfb1-7bfc-4de8-93f9-a2b08d928eca","7","withdraw","53023.46","5302.346","2025-05-20T12:21:29.583Z","نعل الطريق أفضل شراب ركن يمين ليتم متطوع مقبول."
