transaction_id,partner_id,store_id,internal_store_id,transaction_type,amount,transaction_date,notes
"1223","3","43fdbc4f-9368-4f49-addb-f1ca5385b275","24","deposit","615869.9","2025-05-13T10:05:31.411Z","حزينين رقبة مقرر يتعقب سن أرض صامت عزيزتي مخترع."
"1224","6","883ea3c2-8134-4a57-a356-7e437f2f5105","13","withdraw","969599.77","2025-05-13T08:02:30.992Z","لذلك مِرفَق لذلك آمن المرونة استطيع أعيش."
"1225","2","77f0aeb1-e784-4233-b5ed-725aa5ff841c","10","discount","900645.62","2025-05-13T03:30:57.471Z","مرات خلف إلا كلاهما."
"1226","6","ba9d73ff-19f3-4898-9589-a2a9e66c44a1","12","withdraw","455130.55","2025-05-12T23:50:37.809Z","المحسن بأغلبية الفائز بسرعة الحمامات."
"1227","1","f79e0d2a-6bb6-4634-be8c-f25330f9ff88","15","discount","816357.96","2025-05-13T04:22:20.901Z","إمضاء متوسط سيصيبني مقبول الناس."
"1228","3","6df2e177-2920-4477-8841-7db21d003020","5","discount","374592.12","2025-05-13T06:25:43.636Z","إدارة أحمل المحسن طباشير العزلة يأخذ الحمدون يتحقق أطير."
"1229","2","1c2063fe-e9a9-49aa-8e07-1d2d3d3135d9","22","withdraw","104634.17","2025-05-13T10:24:53.703Z","الثعالب ولا إضافي أساعد جسم رمي."
"1230","2","778512a9-1763-407b-8f16-1868d3d5738b","16","discount","837076.36","2025-05-13T14:15:39.497Z","أخسر بالرغم كريم مستقر مرتين ساحقة."
"1231","2","1c2063fe-e9a9-49aa-8e07-1d2d3d3135d9","22","withdraw","632245.17","2025-05-13T19:07:10.394Z","بداهة حب لأن حجاب."
"1232","1","f332130d-1973-437e-989c-ee33d384be15","18","discount","979975.5","2025-05-13T06:36:24.242Z","يتعقب الة يحل جيد نفسها يقفز."
"1233","3","2c9da0e7-c032-444c-b643-121c4c395f60","2","withdraw","958317.85","2025-05-13T16:04:00.174Z","أخشى إدارة النهر رفيع صالح أسلم ارباح أتذكر خيار."
"1234","6","ba9d73ff-19f3-4898-9589-a2a9e66c44a1","12","discount","469965.65","2025-05-13T09:26:43.058Z","التي صوت مفيد يناسب يتبنى."
"1235","5","9dea6436-b5cd-4cd6-b546-b9058bde0d0d","20","deposit","379436.78","2025-05-13T14:51:41.549Z","مرسوم أطلق ربيع أحمل أساس محكمة ثلاثة المعجل ذيل عزيز."
"1236","1","1a120ada-8dd5-4b93-a6b0-90a1a0d0022e","17","deposit","837653.8","2025-05-13T07:32:48.763Z","آمن الحقيقة شيأ يناسب مُطبَّق."
"1237","1","f79e0d2a-6bb6-4634-be8c-f25330f9ff88","15","deposit","367910.38","2025-05-13T06:44:08.920Z","يستوعب رأس تصويت امتياز."
"1238","2","96b80634-dfb5-4769-b131-ff259593df47","8","discount","884389.66","2025-05-13T00:12:06.453Z","أَخَّاذ عادة آلام يدق قادم يقام ارباح اقول رأى."
"1239","2","e64412f3-bbd7-42d3-b534-e32fd6a12344","7","withdraw","788119.62","2025-05-12T22:12:44.744Z","حضن مختفي أبدي حاضر."
"1240","2","962bf6f6-2579-4e29-a560-cffb0ab5636b","25","withdraw","970919.8","2025-05-13T16:43:15.175Z","نسج نفع يفصل."
"1241","1","4742e4af-77fe-4e0d-818e-20c52c134eae","23","withdraw","798634.46","2025-05-13T10:13:07.101Z","معظم آكل مقرر منحنى أقسى يلاحظ يقدموا أعترف بعنف خاشع."
"1242","1","1a120ada-8dd5-4b93-a6b0-90a1a0d0022e","17","deposit","994464.19","2025-05-13T04:11:30.943Z","واع الحقيقة لطيف شجيرة في."
"1243","1","255236cf-98e5-4bf5-b282-cc3ef02ae9f1","6","withdraw","580484.24","2025-05-13T08:03:50.000Z","روح مدح يحشد عباس يهرب معركة سيصيبني سبب أتفق يلمس."
"1244","1","1a120ada-8dd5-4b93-a6b0-90a1a0d0022e","17","discount","309879.65","2025-05-13T17:38:24.539Z","فائدة التفاضل بداهة مهندس يتبنى دعه يقي إخلاء."
"1245","6","3f59d9ac-e7c7-4ce9-b2a8-88bb8c1b3fa1","4","deposit","936874.07","2025-05-13T13:58:39.568Z","تحية حذاء في تصل يقام طبقة يبعد ماشية."
"1246","1","f79e0d2a-6bb6-4634-be8c-f25330f9ff88","15","deposit","83542.88","2025-05-13T03:10:36.226Z","لو يحضر إمضاء الجسم مخترع وُلِدّ."
"1247","6","3f59d9ac-e7c7-4ce9-b2a8-88bb8c1b3fa1","4","withdraw","210197.06","2025-05-13T18:10:29.317Z","وذلك مواطن أجبر متأخر سمة احصل ربط علي يأسر ثلاثون."
"1248","2","778512a9-1763-407b-8f16-1868d3d5738b","16","discount","90386.19","2025-05-12T22:04:53.302Z","يستوعب آخرون أخسر يصدق العائلة تدريبات جاذبية."
"1249","3","cc27c8a9-a99f-4cae-9c32-7cfe4f93b9ea","9","withdraw","663271.65","2025-05-13T18:28:22.020Z","الفراء يتمتع يحذب كائن بالتأكيد ظل أغطي."
"1250","2","1c2063fe-e9a9-49aa-8e07-1d2d3d3135d9","22","discount","171956.37","2025-05-13T04:05:41.678Z","دخول فيما خشن جاذبية السماوي سنة اللطف وسوف."
"1251","5","8a1f0c2c-36fb-47c7-918c-1b6386b82b54","1","withdraw","164788.64","2025-05-13T11:49:24.458Z","يضحك تبني نائب الذي شاهد ربيع زال الحياة مع."
"1252","6","b715432a-113d-45f7-8330-a7a02bafcd79","26","withdraw","226637.27","2025-05-13T16:30:05.725Z","بيئة ذلك رقابة سيارة آخر حزينين."
"1253","2","962bf6f6-2579-4e29-a560-cffb0ab5636b","25","withdraw","704987.27","2025-05-13T11:14:52.997Z","تصدع حر أدير السترة أو."
"1254","2","77f0aeb1-e784-4233-b5ed-725aa5ff841c","10","discount","323056.1","2025-05-13T12:59:44.365Z","سأشرح شخص مجال ناعم أرى متع يقلق جَذّاب تذوق فوق."
"1255","1","255236cf-98e5-4bf5-b282-cc3ef02ae9f1","6","withdraw","281519.04","2025-05-13T03:54:37.749Z","حلاق أقسى مرتين حل."
"1256","3","01e32a4b-7a37-479f-8118-fc77e2522bdc","19","deposit","674185.43","2025-05-13T16:43:11.059Z","روح آكل يمسح انهم سأخبرك."
"1257","1","f332130d-1973-437e-989c-ee33d384be15","18","deposit","97138.57","2025-05-13T00:08:28.040Z","كوب السماوي هذا مفيد تكون والنسيج مشط."
"1258","3","01e32a4b-7a37-479f-8118-fc77e2522bdc","19","withdraw","216320.72","2025-05-12T20:47:38.648Z","أتذكر النفخ مريح امتياز البقية بدانة سوف."
"1259","1","1a120ada-8dd5-4b93-a6b0-90a1a0d0022e","17","withdraw","450588.61","2025-05-12T19:56:23.190Z","اجلس محفوظ مربع."
"1260","6","b715432a-113d-45f7-8330-a7a02bafcd79","26","withdraw","125431.23","2025-05-13T18:16:40.610Z","يوم وظائف أدعم رأس يغني لوت يظهر رأس كيك انتهاء."
"1261","2","962bf6f6-2579-4e29-a560-cffb0ab5636b","25","withdraw","320049.61","2025-05-13T12:37:23.013Z","حال مشهور قصير كافٍ أقوي أحاول."
"1262","1","255236cf-98e5-4bf5-b282-cc3ef02ae9f1","6","discount","848627.39","2025-05-13T03:40:29.095Z","إمضاء نجح ذلك نقود غير أي يصلح ينمو عنوان اهداء."
"1263","2","96b80634-dfb5-4769-b131-ff259593df47","8","discount","213821.69","2025-05-13T01:36:25.310Z","رقابة أخسر مختفي صالح يليق حقا عصفور سريع اللطف."
"1264","6","3f59d9ac-e7c7-4ce9-b2a8-88bb8c1b3fa1","4","discount","731625.6","2025-05-12T19:33:07.883Z","أقول أين جري."
"1265","3","6df2e177-2920-4477-8841-7db21d003020","5","deposit","781841.33","2025-05-13T14:46:59.027Z","الفصل الشاعر الة متشوق عم."
"1266","2","778512a9-1763-407b-8f16-1868d3d5738b","16","discount","278047.18","2025-05-13T16:05:03.738Z","يمسح مشط بطريقة ملموس متزوجة."
"1267","6","ba9d73ff-19f3-4898-9589-a2a9e66c44a1","12","discount","350519.7","2025-05-13T13:56:19.121Z","صحيح أحضر هواء اغادر يوضح يهمني اغادر تحدث بالتأكيد ليونة."
"1268","6","3f59d9ac-e7c7-4ce9-b2a8-88bb8c1b3fa1","4","deposit","934757.64","2025-05-13T11:28:54.070Z","ثقافة هذا الكل."
"1269","6","3f59d9ac-e7c7-4ce9-b2a8-88bb8c1b3fa1","4","withdraw","21313.98","2025-05-12T23:17:47.821Z","تخمين ظل جوية أعيش مهندس تتدفق سويا إلى متأخر تتدفق."
"1270","1","f79e0d2a-6bb6-4634-be8c-f25330f9ff88","15","deposit","531371.93","2025-05-13T19:05:42.664Z","نفع يقام يناسب ينضم عنوان أطفئ تهور مفيد بهجة العزلة."
"1271","1","1a120ada-8dd5-4b93-a6b0-90a1a0d0022e","17","withdraw","700664.41","2025-05-12T20:46:40.868Z","سبب يستثني سمة دخول."
"1272","3","ccf027ac-5288-4fe1-84c4-82130ed52df8","3","withdraw","82398.26","2025-05-13T04:30:37.886Z","العزلة طويل متوسط مريح أساس يسير الاستخدام."
"1273","5","cc83be41-c904-42e1-880f-969edd5c59ed","21","deposit","931978.86","2025-05-13T09:16:12.343Z","رابطة الخصم نتهم ديكور استطيع إبعاد مشرق مدهش."
"1274","3","ccf027ac-5288-4fe1-84c4-82130ed52df8","3","deposit","96355.93","2025-05-13T04:07:18.304Z","بقدر بهجة خطة يكنس ماء روح راحة ثالث الاستخدام نكون."
"1275","6","ba9d73ff-19f3-4898-9589-a2a9e66c44a1","12","withdraw","19561.89","2025-05-13T11:55:26.337Z","اجل شهرة ليتم خطة عجز."
"1276","2","778512a9-1763-407b-8f16-1868d3d5738b","16","withdraw","947272.89","2025-05-13T03:45:12.906Z","الأمل سيصيبني بعنف أقول أطير الموت اناقش سلام أفعل مضيف."
"1277","4","2b3220b2-294e-4f52-9687-c3c75ddef9c7","11","withdraw","861329.84","2025-05-13T11:06:52.872Z","سيصيبني اسم أخضر."
"1278","5","9dea6436-b5cd-4cd6-b546-b9058bde0d0d","20","withdraw","102515.16","2025-05-13T08:44:20.604Z","ماء اخذت ملاك يرفع كافٍ برودة لوت العنكبوت."
"1279","1","4742e4af-77fe-4e0d-818e-20c52c134eae","23","deposit","845683.27","2025-05-13T03:49:15.179Z","يبحث الخصم سبورة متشوق بهجة."
"1280","5","9dea6436-b5cd-4cd6-b546-b9058bde0d0d","20","deposit","39622.32","2025-05-12T19:42:25.029Z","مرآة الاستخدام يرتقع أرى رجولي منهم وقت أفتح ألم أدعم."
"1281","2","e64412f3-bbd7-42d3-b534-e32fd6a12344","7","withdraw","396234.28","2025-05-12T21:22:33.091Z","بسرعة دخول عصا قبل ثلاثة يساعد بطريقة شاب جمع."
"1282","5","8a1f0c2c-36fb-47c7-918c-1b6386b82b54","1","deposit","119604.95","2025-05-13T01:09:01.136Z","يرتفع يضحك صحة."
"1283","1","f332130d-1973-437e-989c-ee33d384be15","18","withdraw","241258.48","2025-05-13T04:44:13.116Z","استراحة أفعل سماء عليه امن قيد اكثر جهد."
"1284","6","3f59d9ac-e7c7-4ce9-b2a8-88bb8c1b3fa1","4","withdraw","113336.59","2025-05-12T23:24:14.909Z","حسنة الترحيل محل جاذبية فرن ليّن."
"1285","2","962bf6f6-2579-4e29-a560-cffb0ab5636b","25","withdraw","574521.87","2025-05-13T06:33:49.434Z","أساعد كلمة رجولي أُطرُوحَة زوجة نفسها اقتراح يكون."
"1286","3","01e32a4b-7a37-479f-8118-fc77e2522bdc","19","discount","743643.05","2025-05-12T23:30:11.699Z","أحمل قميص شيأ بكثرة."
"1287","2","e64412f3-bbd7-42d3-b534-e32fd6a12344","7","deposit","492353.74","2025-05-13T02:12:36.918Z","مهندس وُلِدّ طريق نفسه السماوي فن."
"1288","5","9dea6436-b5cd-4cd6-b546-b9058bde0d0d","20","deposit","694703.73","2025-05-13T01:03:35.390Z","خزانة رمي أخرى يتعلم مكعب عم."
"1289","1","4742e4af-77fe-4e0d-818e-20c52c134eae","23","discount","548045.43","2025-05-13T18:07:35.148Z","ملل بلطف يفتح أغنية خلوق دعه رحلة."
"1290","3","2c9da0e7-c032-444c-b643-121c4c395f60","2","deposit","307040.96","2025-05-13T13:25:40.797Z","نشأ نجحت بالتأكيد نشط سلم ينضم بداهة الريح المسرح العائلة."
"1291","1","f79e0d2a-6bb6-4634-be8c-f25330f9ff88","15","deposit","87002.93","2025-05-12T19:35:21.286Z","الضرورات صداقة قف صغير سألتصق ينتقد غالباً لطيف فيما."
"1292","2","962bf6f6-2579-4e29-a560-cffb0ab5636b","25","deposit","848347.83","2025-05-13T01:02:06.415Z","ينام المسرح حلها أحمل المجلد قبول ينضم."
"1293","3","ccf027ac-5288-4fe1-84c4-82130ed52df8","3","discount","783057.3","2025-05-13T12:47:40.870Z","مربع غالباً يفعل."
"1294","1","1a120ada-8dd5-4b93-a6b0-90a1a0d0022e","17","discount","494334.34","2025-05-13T17:52:02.794Z","إنه كاحل غير يلائم خيره لماذا عير تصدع ينظف كتف."
"1295","2","96b80634-dfb5-4769-b131-ff259593df47","8","withdraw","155218.75","2025-05-13T12:29:19.520Z","عشر الأكثر العاشر لإختيار مرات ربط."
"1296","5","8a1f0c2c-36fb-47c7-918c-1b6386b82b54","1","discount","527751.95","2025-05-12T20:31:51.985Z","يتردد كومة سرور كلا بكثرة إعجاب أعلن الاقتراع صبرا."
"1297","2","e64412f3-bbd7-42d3-b534-e32fd6a12344","7","deposit","563274.45","2025-05-13T16:37:58.843Z","قف عضوية شرط لو مرحبا النزاع مصلح جار زوجة."
"1298","3","cc27c8a9-a99f-4cae-9c32-7cfe4f93b9ea","9","deposit","259449.22","2025-05-13T05:30:20.261Z","حذاء العمل مؤلف مرة باستمرار حضن عمل أحاول يتذكر أحمل."
"1299","2","1c2063fe-e9a9-49aa-8e07-1d2d3d3135d9","22","discount","302547.47","2025-05-13T16:24:42.016Z","تدليك يبحث تاج."
"1300","2","96b80634-dfb5-4769-b131-ff259593df47","8","discount","151775.46","2025-05-13T18:58:42.323Z","آكل كلا رسمي مرحبًا رقابة قادم."
"1301","6","883ea3c2-8134-4a57-a356-7e437f2f5105","13","withdraw","510107.39","2025-05-13T01:11:53.628Z","أدوس مقرر مراعاة باتجاه انتصار ربيع طبقة أعمى زعتر قبول."
"1302","2","778512a9-1763-407b-8f16-1868d3d5738b","16","discount","660889.46","2025-05-13T05:27:24.365Z","مظلمة اكل منجلي مختفي."
"1303","2","e64412f3-bbd7-42d3-b534-e32fd6a12344","7","withdraw","699347.47","2025-05-13T12:01:28.444Z","متزوجة يمارس العائلة الأمل."
"1304","1","4742e4af-77fe-4e0d-818e-20c52c134eae","23","withdraw","386122.03","2025-05-13T16:05:37.849Z","نظيف تعتاد حلاق مأخوذ الوصاية عقل اعتدال."
"1305","5","8a1f0c2c-36fb-47c7-918c-1b6386b82b54","1","deposit","360822.48","2025-05-13T05:07:32.923Z","للمتابعة تستوعب حال أغنية."
"1306","2","77f0aeb1-e784-4233-b5ed-725aa5ff841c","10","withdraw","139531.83","2025-05-12T23:45:28.908Z","يغني سن كما تحدث أرض أبدًا المدينة المعجل."
"1307","3","01e32a4b-7a37-479f-8118-fc77e2522bdc","19","discount","127365.88","2025-05-13T01:59:12.652Z","مزيج لون جميل كريم فجأة."
"1308","2","96b80634-dfb5-4769-b131-ff259593df47","8","discount","600468","2025-05-13T07:57:06.047Z","ثلاث سمة اقود بطريقة المنشئ عصا حزينين الريح."
"1309","3","2c9da0e7-c032-444c-b643-121c4c395f60","2","deposit","336692.91","2025-05-12T22:13:39.489Z","جَذّاب حضري يقام الكل مثل اخر غير يفصل."
"1310","6","3f59d9ac-e7c7-4ce9-b2a8-88bb8c1b3fa1","4","deposit","376045.65","2025-05-13T16:35:00.562Z","يتعلم حضري ليتم يلمس يتحقق باتجاه صوت معبد."
"1311","2","77f0aeb1-e784-4233-b5ed-725aa5ff841c","10","deposit","461536.02","2025-05-13T07:57:02.778Z","تحية مرتين نجحت متأثر."
"1312","5","cc83be41-c904-42e1-880f-969edd5c59ed","21","discount","431461.84","2025-05-13T12:30:53.480Z","سنشتاق يكلف يحل."
"1313","3","6df2e177-2920-4477-8841-7db21d003020","5","discount","599378.19","2025-05-13T09:09:46.746Z","دولة تحت وسيم إضافي ملاك قيمة حسنة."
"1314","2","778512a9-1763-407b-8f16-1868d3d5738b","16","deposit","66516.92","2025-05-13T08:47:05.501Z","تخمين أسقط إيداع عدد نعل ظل جهاز متألق ذلك كان."
"1315","4","2b3220b2-294e-4f52-9687-c3c75ddef9c7","11","deposit","1482.35","2025-05-12T20:29:18.706Z","تحمل أي خط ويفر خفض."
"1316","1","4742e4af-77fe-4e0d-818e-20c52c134eae","23","discount","531064.04","2025-05-13T12:59:59.663Z","جمال الاستخدام مبنى اقف وَسَط ملعقة قبلت."
"1317","1","f332130d-1973-437e-989c-ee33d384be15","18","deposit","103202.38","2025-05-13T18:52:27.183Z","مصلح شهرة اصرخ الحمامات أمان."
"1318","3","cc27c8a9-a99f-4cae-9c32-7cfe4f93b9ea","9","deposit","541539.38","2025-05-13T12:36:39.275Z","لحية احصل أبداً طبقة يسامح محكمة يوضح مهجور قَوس ل."
"1319","1","f332130d-1973-437e-989c-ee33d384be15","18","deposit","709078.65","2025-05-13T06:04:14.117Z","دعوى رماد خطأ مقرر يرتجف مبتذلة ملعقة أساس نهاية."
"1320","6","ba9d73ff-19f3-4898-9589-a2a9e66c44a1","12","discount","212250.06","2025-05-13T17:24:28.672Z","أريد اناقش قبول ملموس شئ أعلى صبرا سلم للمتابعة القوي."
"1321","2","778512a9-1763-407b-8f16-1868d3d5738b","16","discount","981482.46","2025-05-12T21:02:31.357Z","العمل تصل الرقص مدح."
"1322","5","8a1f0c2c-36fb-47c7-918c-1b6386b82b54","1","withdraw","838293.74","2025-05-13T14:14:22.639Z","سماء ل كيك عشر شيء ملموس اغادر كشط."
"1323","6","883ea3c2-8134-4a57-a356-7e437f2f5105","13","discount","577338.19","2025-05-13T14:34:04.682Z","مقنع أشياء يزيل يكنس اجد يدق."
"1324","2","96b80634-dfb5-4769-b131-ff259593df47","8","deposit","704330.46","2025-05-13T08:26:09.345Z","تهور كرس تدريبات."
"1325","2","962bf6f6-2579-4e29-a560-cffb0ab5636b","25","deposit","43986.68","2025-05-13T10:13:28.457Z","لكن هي كنيس والنسيج مصطنع دواء عباس أثاث مقابلة."
"1326","1","f79e0d2a-6bb6-4634-be8c-f25330f9ff88","15","discount","733397.11","2025-05-13T13:03:43.276Z","اقتراح ينام العمل برعاية له نجحت يرتقع."
"1327","3","43fdbc4f-9368-4f49-addb-f1ca5385b275","24","deposit","598131.46","2025-05-13T17:40:04.653Z","يساهم أعلى ايقاد رهيب أمشط الرأفة بالكاد."
"1328","5","8a1f0c2c-36fb-47c7-918c-1b6386b82b54","1","discount","109193.76","2025-05-12T23:39:37.207Z","جمع مائة والنسيج قبلت رجولي أدعم معظم ملائم."
"1329","1","1a120ada-8dd5-4b93-a6b0-90a1a0d0022e","17","deposit","671746.97","2025-05-13T03:24:26.627Z","إلتواء دعه الخصم بالتأكيد صغير."
"1330","3","6df2e177-2920-4477-8841-7db21d003020","5","discount","970766.93","2025-05-12T21:44:43.324Z","متع رابطة دورة."
"1331","3","2c9da0e7-c032-444c-b643-121c4c395f60","2","withdraw","636557.65","2025-05-13T09:00:53.345Z","ضد السرج أخسر الأمل الذات."
"1332","2","96b80634-dfb5-4769-b131-ff259593df47","8","withdraw","529530.58","2025-05-13T04:47:55.538Z","ساحقة العنوان أب لأن لكن يلائم ذلك عزيز."
"1333","2","30a966ef-3aef-4c6c-b4a4-92aa218b318f","14","discount","374470.66","2025-05-13T10:20:28.767Z","امراء بالكاد ألحق يسامح يترتب."
"1334","6","b715432a-113d-45f7-8330-a7a02bafcd79","26","deposit","879022.79","2025-05-12T19:53:03.556Z","حلاق جار توربيني."
"1335","3","ccf027ac-5288-4fe1-84c4-82130ed52df8","3","withdraw","799562.08","2025-05-13T10:19:25.464Z","أشياء مهارات أقترح يترتب."
"1336","1","f332130d-1973-437e-989c-ee33d384be15","18","discount","26125.63","2025-05-13T09:51:56.821Z","اضحك أحمل اشرب ملكنا أعتبر وظائف الجبر."
"1337","3","cc27c8a9-a99f-4cae-9c32-7cfe4f93b9ea","9","discount","88245.28","2025-05-13T00:47:17.098Z","ذهب يكتسب موافق حزن."
"1338","3","6df2e177-2920-4477-8841-7db21d003020","5","deposit","467348.86","2025-05-13T05:48:57.597Z","وظائف مؤلف اتحداك يفعل."
"1339","6","b715432a-113d-45f7-8330-a7a02bafcd79","26","discount","391859.7","2025-05-13T11:04:49.603Z","محبوب مصطنع تتدفق منطقة المعجل شائع ألحق أخضر."
"1340","2","77f0aeb1-e784-4233-b5ed-725aa5ff841c","10","deposit","704997.47","2025-05-13T11:32:43.151Z","خاشع كما شاهد."
"1341","1","f332130d-1973-437e-989c-ee33d384be15","18","discount","412101.39","2025-05-13T05:34:10.136Z","وميض أبدًا المجلد ل قليل اقول جَذّاب."
"1342","2","962bf6f6-2579-4e29-a560-cffb0ab5636b","25","discount","923370.06","2025-05-13T14:40:22.692Z","رعاية لكن شريك ماء الغزل أفتح."
"1343","2","96b80634-dfb5-4769-b131-ff259593df47","8","discount","621179.06","2025-05-13T11:12:37.733Z","مربع عليه اقود ضعيف فن فوز مقابلة حساب غربال."
"1344","1","f79e0d2a-6bb6-4634-be8c-f25330f9ff88","15","discount","10073.37","2025-05-13T00:07:22.651Z","عفوية النفخ ينظر اعتدال عدد تذوق نستنتج بالكاد واسع."
"1345","2","77f0aeb1-e784-4233-b5ed-725aa5ff841c","10","withdraw","174820.41","2025-05-13T16:17:00.626Z","مقرر الناس فارغ."
"1346","4","2b3220b2-294e-4f52-9687-c3c75ddef9c7","11","discount","832201.76","2025-05-13T05:02:24.899Z","شريك يقي هواء القليل أغطي يستوعب أقدر خزانة إنها المشي."
"1347","2","e64412f3-bbd7-42d3-b534-e32fd6a12344","7","deposit","905645.47","2025-05-13T18:18:17.571Z","يناسب عدالة زجاجة أخسر صلب جميع بعنف يقفز حساب."
"1348","3","cc27c8a9-a99f-4cae-9c32-7cfe4f93b9ea","9","discount","524929.62","2025-05-13T06:08:22.778Z","بداهة نسج هم يأتي يليق المرسول صوت أقدر اجد عفوية."
"1349","6","3f59d9ac-e7c7-4ce9-b2a8-88bb8c1b3fa1","4","discount","760354.03","2025-05-13T09:42:13.873Z","صدوق أساس استطيع كتف."
"1350","2","30a966ef-3aef-4c6c-b4a4-92aa218b318f","14","withdraw","493305.35","2025-05-12T20:38:53.645Z","مستقر توربيني مربع أتذكر وظائف رقبة فضة ملاك أقترح اغادر."
"1351","6","3f59d9ac-e7c7-4ce9-b2a8-88bb8c1b3fa1","4","discount","705395.81","2025-05-13T09:35:33.228Z","يقام مريح حلها تملق الجاد ظل أسلم أوافق القوي بطريقة."
"1352","6","3f59d9ac-e7c7-4ce9-b2a8-88bb8c1b3fa1","4","withdraw","665676.63","2025-05-13T01:55:45.068Z","الجاد تعتاد قادم معك الريح زيادة أحضر بيئة نستنتج."
"1353","5","cc83be41-c904-42e1-880f-969edd5c59ed","21","discount","627272.44","2025-05-13T09:17:03.903Z","عفوية لا جميل عريض يأسر تصل قوي حتى يقام مبتذلة."
"1354","3","6df2e177-2920-4477-8841-7db21d003020","5","deposit","614764.07","2025-05-13T19:23:35.012Z","الحمامات يأتي الغرفة زجاجة."
"1355","2","96b80634-dfb5-4769-b131-ff259593df47","8","deposit","642973.65","2025-05-12T20:17:09.419Z","مفيد رحلة الحياة عمة ألفت حزن."
"1356","2","778512a9-1763-407b-8f16-1868d3d5738b","16","discount","261723.53","2025-05-13T16:08:51.210Z","صحة لوت أعتبر."
"1357","6","ba9d73ff-19f3-4898-9589-a2a9e66c44a1","12","deposit","833034.55","2025-05-13T09:54:55.467Z","التفاضل السماع كوب استوديو قوي مربع رسمي الوصول عشاء."
"1358","2","77f0aeb1-e784-4233-b5ed-725aa5ff841c","10","deposit","98626.42","2025-05-13T13:26:51.444Z","آخرون الة إلا نظيف حزينين حامض أمشط فقير عشر المعجل."
"1359","1","1a120ada-8dd5-4b93-a6b0-90a1a0d0022e","17","withdraw","627990.69","2025-05-13T09:46:58.439Z","أحسن خيره مريح."
"1360","6","ba9d73ff-19f3-4898-9589-a2a9e66c44a1","12","deposit","920960.39","2025-05-13T06:39:08.255Z","مبتذلة ثم سريع يتذكر يتبنى."
"1361","5","cc83be41-c904-42e1-880f-969edd5c59ed","21","withdraw","241192.18","2025-05-13T04:59:51.715Z","كومة رفض مكان."
"1362","3","43fdbc4f-9368-4f49-addb-f1ca5385b275","24","withdraw","775761.77","2025-05-13T00:37:58.331Z","الكل السرج فضول عاصف."
"1363","1","255236cf-98e5-4bf5-b282-cc3ef02ae9f1","6","withdraw","264006.67","2025-05-13T13:19:02.400Z","فجأة يقارن تدوس."
"1364","4","2b3220b2-294e-4f52-9687-c3c75ddef9c7","11","deposit","261057.87","2025-05-13T01:22:36.329Z","برونز الوادي بلطف متوسط مبروك زجاجة علاج."
"1365","2","962bf6f6-2579-4e29-a560-cffb0ab5636b","25","discount","603209.5","2025-05-13T14:48:03.683Z","محبوب فضة يرتجف لجأ شجرة ينضم رأس."
"1366","3","cc27c8a9-a99f-4cae-9c32-7cfe4f93b9ea","9","deposit","690781.61","2025-05-13T07:59:39.833Z","ينتقد اقول المقصود كلاهما وسيم اعتدال مجمع قميص رعاية أقسم."
"1367","1","255236cf-98e5-4bf5-b282-cc3ef02ae9f1","6","discount","122647.34","2025-05-13T15:49:30.565Z","سبب الإحسان أبدًا."
"1368","1","f79e0d2a-6bb6-4634-be8c-f25330f9ff88","15","withdraw","146274.86","2025-05-13T19:11:04.931Z","مرة سألتصق كافٍ رفض عاصف تذوق."
"1369","5","9dea6436-b5cd-4cd6-b546-b9058bde0d0d","20","withdraw","342394.31","2025-05-12T22:12:39.460Z","اختراعات يوم عزيزي أخيرا التي هم أمشط."
"1370","5","cc83be41-c904-42e1-880f-969edd5c59ed","21","withdraw","542752.87","2025-05-13T02:53:27.603Z","بالغ كلب حق."
"1371","1","255236cf-98e5-4bf5-b282-cc3ef02ae9f1","6","discount","60447","2025-05-13T10:02:09.674Z","متى صلب مقابلة وذلك قبل يأتي حل مواطن محفوظ."
"1372","2","e64412f3-bbd7-42d3-b534-e32fd6a12344","7","discount","567359.08","2025-05-13T15:40:16.974Z","الدير يأسر مقابلة منحن."
"1373","3","2c9da0e7-c032-444c-b643-121c4c395f60","2","deposit","892023.5","2025-05-13T04:10:38.927Z","ركن ويل خطأ أسود علاج مِرفَق عزيز."
