setting_key,setting_value,description,category,last_updated_at
"Agustina_Wiza17","YlV6tRIATWuuQyI","ملكنا غير صريح أدافع.","رضع","2025-05-24T00:06:24.866Z"
"Germaine.Kuvalis80","HaIj_dhoUk1POAj","أبدي يحل صدوق الملابس السماوي أخضر ملكنا كريم.","ألعاب","2025-05-24T01:08:48.650Z"
"Luther_Will","6UxcaK7Pva60nD9","أمان حقيقي ثلاثون مأخوذ طويل.","صحة","2025-05-24T09:14:37.002Z"
"Kory39","4LmtIWD8NXJc_G_","الغزل حجرة أعترف أقترح ويفر حزين.","حواسيب","2025-05-24T20:36:16.375Z"
"Jaunita_Bins41","mR1Ukv_TAj7Ooga","ثلاثون أسود شيء شريك الموعد جار تكون أخيرا.","ألعاب","2025-05-24T18:53:34.047Z"
"Jacynthe_Kirlin","wiVKvxlpifbejJ1","مكان المشي الحمامات الرقص برونز نهاية ينام معماري نعسان نستنتج.","صناعة","2025-05-24T18:10:31.579Z"
"Tobin_Ruecker","EePivjasM3MEb8v","معركة يتعلم التفاضل أمان أركل.","رضع","2025-05-24T06:32:18.315Z"
"Jason_Romaguera","Lj5mbmS_toBsUGM","كرامة يقولون قَوس.","بيت","2025-05-24T03:04:56.335Z"
"Amely67","aWLqGQ3xwRPXYwN","تعتاد كيف سأفتح غير عالي.","أحذية","2025-05-24T12:30:33.458Z"