log_id,driver_id,operation_type,points,reason,log_date
"77c7b12c-6297-4300-95d0-07665af57cd3","1","auto","3","أطلق حسنة شراب يقلق يسلم مرآة.","2025-05-13T05:46:24.456Z"
"fdef1c7c-c1a9-444a-81cb-7ce8918628cd","4","auto","21","يساعد شرط صامت كومة مدينة انعش تصويت يناسب يزيل عباس.","2025-05-13T02:43:36.601Z"
"e280b957-5f09-4404-9078-ee88bc266e9f","2","auto","5","الطريق انتصار نائب فيما جداً يأمل يلائم التفاضل.","2025-05-13T09:43:01.383Z"
"cc86b24b-4fdc-4638-acd8-263a4528b643","2","manual","55","كائن العمل تجريبي امراء مشين خاشع زال.","2025-05-13T15:02:09.039Z"
"cbf88b1c-e70a-4287-aa8c-e7483d815f52","7","manual","90","الحمدون جار فقط عمة متى يجب حتى.","2025-05-13T10:05:16.844Z"
"cb0291b4-feba-49b0-8af1-dd70e64534fb","6","manual","84","سأفتح التشقلب وحشي إنه مبنى.","2025-05-13T14:20:27.176Z"
"ba23285d-5e43-4529-9fbb-0b0a166b1ec0","9","manual","3","بداهة عنوان الرقص أدير خزان.","2025-05-13T01:27:30.324Z"
"7309099b-a4b6-41e3-a706-dd14dfc8421c","6","auto","4","شراب يزيل هو يساهم السرج.","2025-05-13T05:55:03.256Z"
"9e3a2805-e47b-4d2a-ae9c-e222004a1613","10","auto","54","الأساسي رسغ إبعاد شجيرة.","2025-05-13T02:02:55.949Z"
"bd99e6b1-5ad1-491a-a557-eb9c1b3683cd","5","auto","75","زجاجة بقرة أفضل يقدموا يوم جَذّاب ما متماسك.","2025-05-13T00:06:23.999Z"
"9d9b18c5-9816-491a-aa44-5eb59b1e639b","7","auto","81","إيداع يتبنى أطلق أقل أريد.","2025-05-12T23:29:14.950Z"
"07e8eb42-5a64-4174-acdf-1cec7b004e00","8","auto","34","سرور مفيد خفض.","2025-05-13T12:11:43.731Z"
"334702f7-95be-4992-803a-35b4116686c4","9","auto","17","القوي اكثر الإحسان.","2025-05-13T14:11:26.555Z"
"084ca59a-e2dd-495b-9c6e-3a3727ecfbc8","1","auto","99","خزان جميع حلها يوم محكمة عدالة تاج السماع الجميع.","2025-05-13T18:42:06.942Z"
"07d5ff2c-a38c-4158-a3e9-3e29eddb9afc","1","manual","89","آكل مشين إليك متطابقة فجأة.","2025-05-13T19:26:22.793Z"
"5a9707bb-1097-43fe-ad5c-daa446857f1e","5","manual","27","الأكثر مائة متألق حزينين أبدًا ذهبي الحضارة.","2025-05-13T16:01:18.395Z"
"c7654284-1cbe-4e16-8d79-eaaf5ca31843","4","auto","79","بلطف يقارن برعاية.","2025-05-13T12:02:03.928Z"
"d5a32eca-47e8-466c-93d5-01af2885edab","2","manual","98","أوزة اقول بهجة نتيجة فاجأ التشقلب.","2025-05-13T08:57:48.008Z"
"ece4040e-9469-426d-9557-67d5ca0904ee","8","manual","44","أنمو يبحث بجوار المسرح سوف سلب ظل.","2025-05-13T07:07:45.500Z"
"d1b5b445-45eb-4b18-9907-d7427989643b","9","auto","19","اضع لك يهرب.","2025-05-13T07:20:45.711Z"
"36875a63-f515-40d1-9a95-62165f4ac725","6","auto","17","حقًا مؤلف تصويت المنشئ جَذّاب مهندس أساعد والتكامل أدافع.","2025-05-13T10:20:40.527Z"
"54e1dbd7-0b74-4be6-a015-21fcfb1d7c1e","3","manual","54","برودة زجاجة الناس استطيع قميص ثابت.","2025-05-13T02:12:53.694Z"
"62ad67f6-30d6-4db1-b02f-706c0bde0a11","1","auto","70","سبورة صدر استوديو كومة تعال اختراعات بلطف تحمل التي.","2025-05-13T16:10:34.726Z"
"2e881d3f-179e-43c6-a625-fd43f97ec487","5","manual","2","ماهر شيء بالباص.","2025-05-13T02:52:07.796Z"
"4b80f04d-d8ea-4a1e-b9bc-ebe95cecd2ae","2","manual","56","حاضر التشقلب ملعقة أريد فقط أعتقد أقسى صبرا.","2025-05-13T11:33:21.624Z"
"0311188f-099d-4183-a844-d5a229e951c2","3","auto","95","تقطر اقود اقتراح إنني يحذب اناقش عريض أفتقد امتعة.","2025-05-13T14:44:17.228Z"
"3c6b6a2e-92a3-4949-ade7-4fd4a56b5072","5","auto","95","ضجة قيمة تصدع بدانة هواء متوسط ضجة السعة برعاية حلاق.","2025-05-12T21:41:52.199Z"
"f937d85c-3507-40d0-bba0-7809543254a5","5","auto","42","يفحص مزيج مبنى مثل معماري صيف اخذت مهارات جار.","2025-05-13T12:37:04.908Z"
"56a64cfd-8947-4aa1-86b8-cf1546b17203","2","auto","31","وسعنا منطقة ابرم ادافع ألفت أخشى.","2025-05-13T17:51:45.383Z"
"4341950c-109c-452c-9982-c38e8b836047","7","manual","17","أكون لحية مؤلف.","2025-05-13T00:48:35.984Z"
"31b0e579-c7fe-4677-9b02-9bfe8844a161","3","auto","62","صداقة بداهة امراء.","2025-05-13T13:10:11.350Z"
"7b8b0c06-c6b8-41f6-b43e-dac72d5e30d3","6","auto","61","اقف متوسط طبقة.","2025-05-13T01:24:54.853Z"
"466c2251-f8df-4fce-8dfb-a2b5df1029e8","8","manual","69","ينظف عمة أساعد سبب تصويت حال على قبل.","2025-05-13T07:55:02.366Z"
"9341e2b5-0c43-4459-8b20-9f408bb19e6c","8","manual","76","يفترض بوق أظن ذلك سأشرح فيما سماء مأخوذ الرافض.","2025-05-12T20:42:14.837Z"
"ef067401-20cf-4115-b010-e18ade9a251e","1","auto","58","الأكثر لكن صوت ذراع باتجاه قديم.","2025-05-12T19:27:16.217Z"
"85d5fd6a-43b4-43c0-8c6b-6c27fedda79e","2","auto","63","يحفظ يدق ايقاد.","2025-05-13T16:24:42.555Z"
"010e2391-cb49-43dd-ac2c-dc672687138f","10","manual","97","بيئة انتصار زال آكل أوزة اضع رعاية راحة أدوس حق.","2025-05-13T07:08:45.780Z"
"94ea9ec3-d5dc-4a7a-9eac-39450cb7cb90","5","manual","75","أب رفيع صنعت حجاب نسج أسود باتجاه.","2025-05-13T08:05:47.379Z"
"c5730269-e1c0-4ab5-bc4a-fe04cf71a053","4","auto","3","كبير ملعقة يضحك وَرَاءَ الجناح مواطنة حضري اغادر يحل.","2025-05-13T16:12:38.494Z"
"0e445056-1566-4104-8c0d-d72b70dbd000","6","auto","88","باتجاه اقود يوم يتعقب عنوان خط.","2025-05-13T04:09:42.204Z"
"fd300aa5-d164-4e42-b243-04c25072592b","6","manual","73","مبروك حاضر مريح نهاية يهرب هنا نفسها وفير تعتاد.","2025-05-12T20:52:24.652Z"
"1782d759-f500-4c73-80b8-1031e94b8e3f","7","manual","48","ألحق الاقتراع منجلي صدر.","2025-05-13T03:48:10.660Z"
"f6ca4f90-68d3-44d7-acfd-f7ce0cc04f2c","4","auto","23","أحضر انهم صوت.","2025-05-13T14:14:05.373Z"
"9435ae7c-8be5-4627-984c-8999b0f90dd6","8","manual","77","بيئة مؤلف خشن.","2025-05-13T00:27:29.038Z"
"27b84baf-57a0-47a9-a4ac-22f1287e2591","5","manual","82","يساهم ماشية الاستخدام ضجة العمل سبب يبدو سهل.","2025-05-12T20:30:28.885Z"
"990019d7-55c7-4a11-8e3b-ccacb132e845","5","auto","25","يبعد تهور الناس.","2025-05-12T22:19:37.341Z"
"8f61aba9-6dee-4f44-8653-44cc01143076","4","manual","8","أن إدارة رسغ.","2025-05-13T15:46:23.422Z"
"096bda9d-7e25-4c03-9069-fc5c6f303ea7","2","manual","29","شيء يفحص رهيب عمر أظن الطريق ملاك تنبيه عليه الترحيل.","2025-05-13T19:09:48.353Z"
"bc4a37d9-2599-4b12-868e-d3444f8df16c","1","auto","98","تستوعب القيء عضوية المحيط ملعقة يتبنى شاب.","2025-05-13T09:28:38.484Z"
"eb233249-54b1-40e1-851f-8ec809b288cd","8","auto","38","حقا منتج يرتجف متنوع وأود ممتع عمة استوديو.","2025-05-13T17:57:41.977Z"
"8ae8b749-0aef-4ff8-91c4-b7d6a6ae2967","2","auto","1","ماء نهاية نكون أحضر.","2025-05-13T01:34:31.860Z"
"0203a0ba-ba8c-4c8d-972e-659e0e4adfc9","7","auto","8","لا بدأت مرهق شهرة معك الجرأة أركل مستمع التشقلب.","2025-05-13T18:27:35.480Z"
"b97503a2-03fb-4983-98d5-25acd1f0e731","2","auto","87","بالباص مستمر بقدر شروط.","2025-05-13T14:11:20.955Z"
"c240778d-9aaa-4cd0-a9c6-c2bc3bdbac7a","5","manual","98","كلب شئ سيل المسرح أفتح حساس حقيقي الأليف.","2025-05-12T22:29:24.676Z"
"3b60f772-bf97-4575-8d41-135c263366b5","3","auto","53","علي السعة أكون تنبيه الغزل.","2025-05-13T18:17:22.969Z"
"4d381310-dc02-4153-9000-fa257b5bad0e","3","manual","73","مدح ادافع عشاء قميص نكون.","2025-05-13T14:15:51.735Z"
"622dfca4-add0-47cd-80b7-0fe666c74e66","3","manual","17","نفع يكتسب ضعيف.","2025-05-13T08:30:51.210Z"
"239268b7-4c31-41dd-b57f-41e52c676e94","10","auto","21","أبداً صورة حقيقي فزت ايام.","2025-05-13T08:37:57.417Z"
"e21e0c0c-6c48-4690-9e91-3a3001b267e1","1","auto","17","بحرص مخزون برودة يعرفون باهظ لك رهيب محكمة.","2025-05-13T04:40:49.856Z"
"b3d33458-bbbc-4cf2-9ad6-d48ee553344c","2","auto","94","يقرر أحضر متطور.","2025-05-13T12:03:05.875Z"
"fd2091cd-2f4a-4054-81ce-1da9a901abd0","3","manual","72","حزينين بدانة بأغلبية سبورة أكون صيف فريق سبورة نفسه.","2025-05-12T21:15:34.071Z"
"3fb71e15-e960-4f26-b077-5380547d9b87","7","manual","40","دعه يحب الأكثر ملموس مرتين.","2025-05-13T04:50:26.469Z"
"49b9adc6-7645-4cf1-8d30-2ec1e9486ab7","3","auto","15","يستخدم أغنية جوية عاقل مشرق القيء أبدًا أخسر.","2025-05-12T22:40:03.008Z"
"cdf65be5-3f8f-48f7-a71f-e0494dcbb2c9","4","manual","61","أتذكر السعة يأمل.","2025-05-13T06:44:15.336Z"
"a035b683-c08c-4871-a824-eecef6cef239","6","auto","12","اتحداك مائة نفسه رجل ملائم.","2025-05-12T23:17:45.849Z"
"aebac366-6ebc-41d6-a4d1-50d84b8054e3","5","auto","66","الطريق أغطي يترتب أحب عنوان ثقافة.","2025-05-13T01:01:55.144Z"
"41c72da4-f0d1-4b63-81f4-982eade0c6fb","8","manual","61","روح المدفأة الرأفة وميض يوضح.","2025-05-13T05:45:27.568Z"
"bb13edf2-782e-493c-b26d-9c76c036273e","1","manual","91","تصدع امراء راحة وذلك يهرب يقام المدفأة يمثل بسرعة إضافي.","2025-05-13T16:52:22.307Z"
"847d4176-09cf-4ee4-9255-215695dbb7e5","2","auto","23","هو دور معماري رحلة.","2025-05-13T17:36:24.926Z"
"c0b568b4-e7b7-4791-b0f1-5503a2995f04","4","manual","40","زيادة سهم يدفع مع يقود الكل سألتصق يقارن مرحبا.","2025-05-12T20:32:47.826Z"
"428329e0-0897-40cb-ad8c-242943ebff13","1","auto","1","كشط سبورة ثلاثون يعرفون عزيزي الشاعر عزيزي.","2025-05-13T15:17:55.009Z"
"3d2bf141-d3b0-4aa6-a4ae-4fbeac6bd2f3","7","manual","97","سيارة عير يقود الخصم مخترع.","2025-05-13T06:23:55.623Z"
"0c9fb059-2cde-41ae-a623-0ebde31f0917","3","auto","91","يحفظ يكنس أوافق حقيقة اجد بالرغم الجسم رمي بشكل مقبول.","2025-05-13T02:49:04.052Z"
"87aacbcc-b781-45d5-b6c1-d0911b36ba17","3","auto","47","انهم يبدو ذهبي العنوان حضن.","2025-05-12T23:11:17.529Z"
"ae8551c0-4d84-4904-8cd3-32a7837b8812","3","manual","46","يبحث الجناح ثابت فجأة تريد حزين.","2025-05-13T06:43:12.890Z"
"e4fa2040-0411-4693-89ad-c7d104c94408","2","manual","17","علاج يفتح اهداء المحدد الريح سوف إيداع معركة خطة ألحق.","2025-05-13T00:02:32.100Z"
"5de2f65b-2e3c-4a69-925e-3b0577620824","2","manual","19","العاشر استراحة زوجة ينضم منتج اخذت تصل اختراعات أدوس.","2025-05-13T05:52:57.321Z"
"f3a86cf9-b85b-47bf-8339-9d02a5c101e8","9","manual","67","مستقر تحية تصدع حق مع ينمو ذلك حل عليه يمين.","2025-05-13T17:28:19.981Z"
"ec43c83a-9328-4f3d-b524-08c3b4da6b28","10","manual","84","خشن فقير شريك مشين مرسوم نظيف يقفز قيد.","2025-05-13T03:31:52.039Z"
"f155f7ae-b20e-47ea-8655-445f04135d0f","5","manual","47","مواطنة الناس يكون أقل سيصيبني دواء مقبول تحت.","2025-05-13T07:36:17.621Z"
"e8a3a4c0-9c8a-47e3-9641-19d442229919","6","auto","60","الأكثر بِكر جميل السترة ملائم دواء أوزة ملل.","2025-05-13T06:19:31.349Z"
"139cd730-4857-41e4-8f1b-36d03638f2e8","2","manual","44","نشأ برونز التي الغرفة مثل الشفق بكمل وسيم يلاحظ.","2025-05-13T14:56:01.622Z"
"fe25e8f2-611d-4e73-b0b6-f0fbae04c70a","5","manual","63","اغادر السماوي مكاتب.","2025-05-13T10:48:29.114Z"
"f1eabc5f-fa94-4208-b4a1-c9af86a587e9","4","auto","60","نشط أساعد نسر لو دورة مواطن ذاهب شمس.","2025-05-13T00:13:57.194Z"
"984609a7-3938-476f-888b-07be753f650c","6","auto","7","تاج خفض مقرر حزن العمل في نستنتج أبدي بيئة.","2025-05-13T13:02:15.910Z"
"d82b2223-a8d7-46c8-bcd8-f9f4901c6b94","9","manual","33","كائن لماذا تنبيه تنبيه مواطنون معبد يتقدم.","2025-05-13T03:43:34.192Z"
"63b551ac-6930-485b-9a79-013256bc9811","3","manual","76","هذا يحشد يقلق تاج منجلي.","2025-05-13T05:35:56.416Z"
"fbc5e6bc-c1a8-47b1-92c7-aff12b9fd377","9","auto","46","رقبة جهد تحدث مواطن رفض إذا.","2025-05-13T12:28:55.289Z"
"75a10784-c019-4853-bc0a-edbe501b4469","8","auto","58","سألتصق يقلق التشقلب حلها يحل يفصل.","2025-05-13T13:49:47.751Z"
"af077c1a-0c15-4f8b-85e5-d0cc7dbe851d","9","manual","77","عضوية عم احصل معك اجلس خيره.","2025-05-13T06:40:05.544Z"
"1a3f7371-9bcf-4898-a458-ba3d20d29021","5","auto","12","شمس منجلي سيارة مثاب أدعم.","2025-05-13T17:43:37.828Z"
"39308f41-2a48-416d-9443-0700c9fc2b78","10","auto","60","متزوجة مرات ماء يترتب يظهر القيء سوف كيك الضرورات.","2025-05-13T11:17:54.416Z"
"d4671627-739e-4081-8da2-60bb8e33d5a9","1","manual","75","عليه تجريبي أعلن نعسان تدوس قيمة يرتفع الملابس.","2025-05-13T05:34:30.209Z"
"010e48ac-13dd-42ca-8ffb-3c463bc0aaa9","3","auto","7","الجرأة فن يوضح مقنع قبول رجولي مريح تعرُّف.","2025-05-13T13:52:18.195Z"
"e77ad4d2-0af2-4a2b-b6ed-ce70d87641ee","2","manual","57","مدهش مقاطعة يفتح مرارًا صنعت.","2025-05-13T15:57:39.676Z"
"bc6556c0-6e32-4f70-8491-d4b0e5771df6","7","auto","51","تبني مواطن واسع مهارات وسيم ماذا.","2025-05-13T09:24:29.049Z"
"086b365b-b670-4d87-8df1-9c536ab4d5b4","5","manual","47","يتعقب المحيط ثابت طاولة من لوم.","2025-05-12T21:43:50.476Z"
"f8fc60dc-39ab-4bcd-b3bb-9c68a9674df7","7","manual","66","إنني يقفز اضفت شائع البقية متى أتفق سير.","2025-05-12T21:15:58.864Z"
"abdf76b2-32dc-4a5d-bb76-b2f37fdbf91c","2","auto","46","تم بالغ ذلك أُطرُوحَة حال آخر.","2025-05-12T20:04:12.952Z"
"557d48d5-2d27-4d6b-b7d4-d6ef0ed4320d","7","auto","91","عمل تذوق الأمل فائدة.","2025-05-13T14:04:37.685Z"
"677dbc5f-0c32-459a-8090-5193e16a5fe3","8","manual","15","سلم أرى السجلات سأفتح يبحث انهم جار يغني الضرورات.","2025-05-13T11:07:40.295Z"
"0fc37164-0ce7-445b-8c26-2e42dec2784b","5","manual","66","الموت نفسه امتياز تملق يساهم وحشي.","2025-05-13T03:50:46.688Z"
"4ee794a4-848f-4c9f-b483-7f9bbfbba96b","2","auto","42","ويفر زحف أميل خطة.","2025-05-12T23:21:54.283Z"
"e1a40a91-38b2-457c-b7b5-a226a85d6465","8","auto","41","جوية عاصف رماد يفصل يهمني.","2025-05-13T17:31:38.470Z"
"494d41a2-9a4f-4e59-89e0-0a8a5b6bab00","7","auto","74","عالميا اقف جاذبية.","2025-05-13T08:27:39.857Z"
"5655b99d-5f7d-4d26-bf43-44da0f347220","5","manual","99","مرحبا أتفق متزوجة كرس حساب بقدر يلائم اقرر ملعقة رياح.","2025-05-13T03:41:49.313Z"
"d0eb6b04-5ef5-4db2-9dc8-11a7770b154b","7","manual","86","أجبر رسغ ذيل.","2025-05-13T02:15:10.597Z"
"b5b59a0d-5953-412b-85c2-52c928c7aefc","10","manual","74","الفصل كريم خيار ينضم تتدفق.","2025-05-13T10:54:44.618Z"
"d36700aa-1a58-4385-9341-e9accae5511c","7","auto","29","ولا يفضل مستقر وذلك يترتب شعر خزان.","2025-05-13T17:18:10.115Z"
"50d58c1a-9cf0-4ed1-8919-94da14b09ef7","4","auto","84","متوسط حاضر الوصول لوم المعجل رماد نشأ قبلت منجلي.","2025-05-13T17:07:07.710Z"
"89bf86e7-caad-448e-92f9-51d56476332e","5","manual","48","لحية مرارًا واع.","2025-05-13T11:50:37.403Z"
"2f27c9b2-be23-4ad1-a35d-00152b45ea8b","9","manual","45","اجد معظم صحة طويل الخدع بعيد صنعت لوت رابطة الكل.","2025-05-13T10:50:30.147Z"
"21fc3ec0-ef89-4d06-a395-5f03ad5e7d2b","5","auto","58","آمل يرفع إذا نظيف.","2025-05-13T11:37:56.182Z"
"591393c3-b713-4ff2-85cc-0a8328dbbeef","1","auto","62","معتاد وسعنا اقود ذلك.","2025-05-13T08:47:51.943Z"
"bc5b0220-e244-45fa-9586-240e3ea802dd","2","manual","8","أشياء وقت ثابت ينظر اقف مبنى.","2025-05-13T15:22:31.510Z"
"ef9541d8-4774-4c27-89be-9e57637ded4b","4","auto","22","لوم حق وأود ايقاد إلتواء خفض أطلق.","2025-05-13T09:39:07.108Z"
"22b075d9-b347-4ad9-84aa-d5f903e4ca03","6","auto","70","عزيزتي مشط مزايا يحب تحمل ألم عاصف.","2025-05-13T11:56:34.759Z"
"86592ecc-d678-4359-8b8b-713e2d53a1f0","10","manual","70","النزاع يهمني قبل.","2025-05-13T10:46:37.069Z"
"1d0334ee-a5f8-42ee-a538-31c654899711","1","auto","9","مأخوذ أقدر باقية ملل مقرر تحت ينظف لذا صدوق اقتراح.","2025-05-13T15:57:42.568Z"
"6bcb21a5-fcaa-4a4c-beeb-3b8bb2696078","3","manual","76","نهاية أغطي بوق الرأفة البقية تعتاد كومة السجلات معبد.","2025-05-13T03:02:52.066Z"
"9982b23d-5673-420f-81a6-cf8b77ec0652","7","manual","81","وسيم بلدة انتهاء.","2025-05-13T06:36:04.198Z"
"530a3766-4454-4a59-b6b7-2de00fdddc6a","4","manual","29","مرآة محبوب شجرة يغني اتحداك الطريق ديكور يناسب.","2025-05-13T08:30:48.169Z"
"42ed002f-dd3b-4072-8dfd-4e931472d1b8","9","auto","39","يكون نعسان البقية فيما السماوي قليل.","2025-05-13T01:09:56.106Z"
"666594a9-f5ec-4a29-8bdc-7ab2092955c0","6","manual","39","الفائز المسرح امن يكنس حزن متساوي جميع جمع مصطنع.","2025-05-12T20:15:26.904Z"
"cf78bb07-9242-4095-95de-2e7019ef2045","4","manual","19","أخت أحسن هي بقدر ذهب شمس.","2025-05-13T04:20:32.830Z"
"d7c39c80-991d-42da-be2a-a4f8a4b2ee17","6","manual","26","عليه أدافع زجاجة عزيز.","2025-05-13T15:15:06.868Z"
"4946d48c-d14a-4d35-95a2-0648fbecc274","5","auto","73","خيار يستوعب تاج نكون ذهب قيد جسم حقا يقلق.","2025-05-12T22:17:02.565Z"
"c642c6f1-ca03-40a9-8dae-0b98103c8664","4","auto","58","أسود حبيب أو مبنى الفائز المجلد.","2025-05-13T18:35:21.443Z"
"1cd6ce83-bbaa-400d-9940-293c3ee9a2d7","5","auto","35","غائب تستوعب كرس شجرة اشرب.","2025-05-13T09:17:29.131Z"
"82d7951c-ee20-4872-aa5a-91f5ec1560e7","4","manual","18","نشأ أقسم قوي.","2025-05-12T22:43:56.488Z"
"cf016ef3-b9fb-4182-93cb-253d3f89140c","2","auto","64","خزان بسرعة مخمن يتحقق تحية اضع.","2025-05-13T10:07:41.341Z"
"efabd902-5c44-4c3d-9f05-89dc596d42e7","5","auto","86","تصدع أميل إذا التفاضل.","2025-05-13T06:35:32.852Z"
"968d7cb3-a745-46ca-9420-53b343b00022","9","manual","93","حزين مرارًا معك.","2025-05-13T05:14:17.395Z"
"2016f685-7aad-4420-a494-07c608fe635d","5","auto","10","أقوي اصرخ الجانبين يحشد تجمع.","2025-05-13T14:16:25.251Z"
"91e44bfd-0d32-41e8-9dae-4fea3920f518","3","manual","48","باهظ دورة ذهب زعتر أحاول الأليف السجلات.","2025-05-12T21:06:57.838Z"
"d2a1a9c8-1a35-4366-9867-6909457fe339","6","manual","41","مفيد الاقتراع ليتم أفعل لو تدريبات أبدي تعال مرتين فقير.","2025-05-12T22:20:21.404Z"
"8049b036-e6a7-4c63-a988-8d5f149f7545","2","auto","1","الوصاية المدفأة أعلى أعترف.","2025-05-13T03:48:39.780Z"
"1ef31b79-f8e6-4373-9327-029bb1f2603c","2","auto","100","سرور يصلح ابرم وَسَط.","2025-05-13T14:36:32.729Z"
"0d19f149-f7f9-4f2b-b7c3-df5bbf2d3b42","6","auto","100","فشيأ هواء وُلِدّ أفترض مكعب اشرب إلا بقرة يكتسب.","2025-05-13T01:41:09.239Z"
"19a12290-1441-47cc-b7fb-d081d00a43d7","7","manual","87","خفض كنز سنة المرسول طاولة تدوس يتمتع يحذب.","2025-05-13T17:37:04.052Z"
"42c99ff3-b269-4591-830a-f9394d645643","4","manual","61","اخر زوجة غداً نَسِيج.","2025-05-12T21:18:07.114Z"
"e3413fed-2717-473c-927e-0bb391361647","5","manual","42","الفصل الناس مواطنة.","2025-05-13T08:59:10.122Z"
"97a5b453-5586-41fe-ad87-d5c51c07ca10","6","auto","75","معظم مشين تدوس اقول أرتب عريض تصدع حياة جهد حياة.","2025-05-13T14:25:20.314Z"
"f3968730-2e1c-40d1-ab8b-420394c81b59","10","manual","59","شروط اتحداك النزاع أن الوادي.","2025-05-13T09:12:08.295Z"
"67f3deb4-6b3b-414a-99b5-d6b645ce6210","10","manual","8","يوضح خاشع مسرح عنوان ولا باقية مهارات القوي عم.","2025-05-13T18:45:13.031Z"
"3b1f846e-ad82-451b-9409-eeb56014a071","9","auto","57","صورة عجز مشين أسلم بالرغم سيصيبني مشهور بعيد خشن أقسم.","2025-05-13T17:38:34.023Z"
"0039c35f-ec2b-4292-a179-1f17457135c1","3","manual","36","ينمو مفيد أدير حجرة كنيس يغني اخر صوت.","2025-05-13T12:04:53.815Z"
"5973e261-da0f-43cd-90bc-35df5ada7551","2","manual","92","حياة فارغ مأخوذ ملاك.","2025-05-13T07:47:38.514Z"
"214c3256-c99c-487a-b0c7-435ae27b857c","1","manual","22","كيك انعش مال نشط تنبيه.","2025-05-12T23:54:40.650Z"
"d0b54e64-c159-447e-b617-68f4948f4f38","3","auto","66","ممتع متأخر يتمتع كثيرة.","2025-05-13T06:32:02.907Z"
"c7bfb4a5-edf0-42be-8c4f-861b4e7ecae3","1","auto","62","آلام نفع سويا.","2025-05-13T13:51:27.899Z"
"bd83946b-473d-4564-8829-2e1903f0d80d","8","auto","4","اهداء بدأت عقل إلتواء باهظ يدق.","2025-05-13T00:44:03.616Z"
"001ac9fe-ccf3-43f5-93a7-d9edd09e66b6","7","auto","92","صلب يكنس أستسلم اشرب.","2025-05-13T01:21:54.893Z"
"cc22e5f0-ec7c-4e2c-830d-3a1501b58942","9","auto","41","الموت ذراع بوق ثقافة صغير أشياء مكعب ليونة.","2025-05-13T11:13:08.885Z"
"3b639e58-c043-47d1-8c54-eee5612ba766","5","auto","90","باهظ لك كرس مثل نفسه شمس أساعد مرتين مقابلة علي.","2025-05-13T13:45:34.927Z"
"2a104dcf-3a6d-4b80-b89e-658a4e77101e","2","manual","39","تحية فيما أفترض.","2025-05-13T17:21:16.409Z"
"1a17873c-e8ae-409e-9407-eb2268cfbfd9","7","auto","24","يبعد عزيز القليل ذلك طويل أريد تدليك أفعل الرقص.","2025-05-13T14:01:43.632Z"
"8e52603c-ee99-4e26-a067-33aebc9ec1d6","1","manual","79","سويا متأثر يحشد مخترع ينضم أنمو.","2025-05-13T05:52:19.054Z"
"0a12c0fa-1e4e-42c5-9d16-e0700357212d","8","manual","34","يستخدم جسم صيف وفير مبنى سير أمشي.","2025-05-13T14:23:21.227Z"
"e1ab3d13-aff0-4da5-99d7-6b6ef9a43fec","7","auto","52","السترة ساطع مع أن أو.","2025-05-12T19:35:04.626Z"
"1a42427b-4be5-41fc-af5b-db2e1d0cf33f","1","manual","34","مقبول جَذّاب اللطف يستخدم.","2025-05-12T20:11:01.501Z"
"bb88b793-e0af-4d2b-bd85-c05f365423dd","7","auto","52","أبدًا سأخبرك ينضم تصل حذر.","2025-05-12T23:54:02.663Z"
"6234c21e-d0fb-44d4-9668-967d8953a718","8","auto","94","واحد كل باتجاه غائب النهر فارغ متنوع بِكر.","2025-05-13T07:18:13.567Z"
"c561c809-532a-4078-92fa-852b4b2f3ffd","5","auto","46","تجريبي يحفظ أبدًا يقارن لكن صدقة أتفق السرج.","2025-05-13T07:16:39.144Z"
"a4641317-d742-4bce-9b59-8ecc42d93726","8","manual","65","لو غداً أحسن يأمل النهر زحف عصفور متساوي ليونة المسرح.","2025-05-13T14:07:25.016Z"
"0351ce4b-2e5b-4d8c-a933-805da2f0153c","7","auto","44","الرقص الحمدون السترة الريح.","2025-05-13T12:50:20.744Z"
"93625ff3-7124-4b3e-a19d-7ce37a138aa9","1","manual","52","أعلق الشاعر مِرفَق تبني.","2025-05-13T14:04:39.835Z"
"6e6a7146-96a7-411b-a2b4-69b0a6540c0f","2","auto","48","لون عير نستنتج غالباً ماء حلها دور أحمل إخلاء.","2025-05-13T11:02:05.210Z"
"a1aa5fa9-234f-4d3c-a3f3-401522bfc0ac","8","manual","34","الموجة ماء بحرص تحية.","2025-05-12T20:35:17.914Z"
"7312354e-5189-44f4-b528-7b55bf53fd37","7","auto","40","نتيجة رجل فشيأ الموت ساطع خيره أتصل.","2025-05-13T10:57:04.046Z"
"d9eb0369-83fe-4648-9f15-faf7044edf1d","3","auto","96","تبعًا شاهد زيادة ولا ليتم حبيب استراحة الطريق.","2025-05-12T20:35:19.549Z"
"59541f6e-66ab-4787-93a8-cd24c6c34cf8","5","manual","91","فارغ دور أن المشي يسلم شخص منحنى أن عمة صريح.","2025-05-13T14:12:15.711Z"
"e630355f-37da-4b72-98dd-aac0f864e1d5","10","auto","28","غرفة متقلب أخشى بالاسفل نفع.","2025-05-13T00:10:51.221Z"
"4db0e58c-779f-4959-ae41-bcbbef0dc49a","6","auto","82","منتصف حذاء رعاية بالفعل.","2025-05-13T10:56:48.800Z"
"060c0437-75cb-42a8-9fc3-9f6c84fcda83","7","auto","85","أفضل يسلم صغير بالغ ماذا شائع اناقش.","2025-05-13T02:03:56.949Z"
"2d58db4c-ee58-4e4e-89c5-c99c883212b3","4","manual","95","كل يهرب الطريق أطلق بهجة.","2025-05-13T17:55:58.047Z"
