log_id,driver_id,operation_type,points,reason,log_date
"1d50c41c-0fe2-4c4c-b745-b8a85b4bfa2b","5","manual","40","روح بجوار يقدموا الإحسان اقرر ينتقد عشاء متأخر.","2025-05-13T10:21:12.432Z"
"8cb3381c-df98-47bd-9103-18e11fcb77fc","9","auto","51","الجانبين أخضر أوزة استراحة قبلت أغنية.","2025-05-13T12:36:44.030Z"
"4e9ae029-6dc2-4c59-9999-baff57c62a0a","8","auto","76","زال تعتاد صدر البقية الرافض.","2025-05-13T12:34:34.812Z"
"4500ddbc-0d89-466c-b086-983fdd365d74","9","auto","18","اسم أبداً هؤلاء سماء بهجة.","2025-05-12T22:13:50.071Z"
"435d77f5-3873-4b86-a0f6-9083c86f1640","2","auto","35","يقرر كافٍ حقيقي سيارة.","2025-05-13T17:08:30.125Z"
"b00a50eb-dc7d-43b3-b310-dc84bf86c32e","5","manual","51","تبني طالب أخيرا دولة رماد.","2025-05-13T05:07:00.161Z"
"655e9bc9-beb3-400b-997d-c8124a825ad1","8","manual","10","أغنية تحية أَخَّاذ الحال واع كيف آمن وقت نائب.","2025-05-13T03:09:00.705Z"
"acb34608-a907-4585-b031-65c4439ca374","4","auto","85","الوادي العزلة مرهق لذا يأتي.","2025-05-12T21:18:33.089Z"
"990ff246-9996-47e0-bf30-347ffb121ce5","10","auto","70","لأن طريق طاولة قميص.","2025-05-13T16:40:37.096Z"
"1ba20ada-03f2-40be-8291-e6a9e16a6e64","4","auto","87","عفوية أبدًا وميض تريد السجلات ينمو شراب.","2025-05-13T15:01:17.934Z"
"c8b85f27-b178-4985-88be-5f52f6b33023","8","manual","35","كومة المختارون مقابلة استوديو يتعقب.","2025-05-13T00:38:47.510Z"
"d9411c44-5c26-45ce-ae44-6bf646fd15d6","2","manual","90","هي دور تتدفق متطور مظلمة ينام اختراعات أوافق صديق أطلق.","2025-05-12T23:47:38.695Z"
"9ed1bcba-2445-47e6-97db-d7b877068db1","8","manual","67","تعرُّف بالتأكيد صندوق أركل يمارس يوضح خط العمل.","2025-05-13T11:43:18.305Z"
"e68e93a1-3f56-46b7-a636-3a07075e69dd","10","auto","59","لجأ الخدع وحشي ألم يقرر عقل صامت لوت الفراء سأفتح.","2025-05-13T02:46:31.722Z"
"4074cb3b-4d77-4087-a96c-96f54e2c1035","2","auto","52","ثقافة بشكل أعيش يعبر إمضاء جمهور.","2025-05-13T19:04:50.493Z"
"610a4af8-7238-4c6c-ae71-9845e607913d","8","manual","99","أدعم المحيط حجرة منهم فضائي عشر شائع أقدر العائلة أحد.","2025-05-13T14:34:55.971Z"
"0eca701f-c6a8-489b-a801-b1bba630d13a","9","manual","48","صحة رمي المختارون.","2025-05-12T21:36:22.162Z"
"db2b9527-ade8-4bed-a539-1bee85c203f6","7","auto","62","سير سلب مبنى احصل.","2025-05-12T23:34:06.378Z"
"a4762670-f678-45bc-8f35-e133c38def86","5","auto","92","أتفق يقدموا ويفر.","2025-05-13T11:37:38.565Z"
"91f168ac-fd44-4422-a8de-c275134ce5ed","10","manual","75","يتردد برونز نشط جهد صدوق.","2025-05-13T02:08:41.083Z"
"ac94fd18-acf1-4b86-a904-4cef330a78bc","9","auto","61","غداً سبورة معماري يحفظ عدالة متوسط تكون.","2025-05-13T14:53:07.608Z"
"8ee7b359-a5fc-4245-8fe2-28862a3816e8","6","auto","56","له بالفعل عاصف اجلس مهدئ تكون المسالك بالكاد مرحبا ثالث.","2025-05-13T08:32:22.437Z"
"c1166e34-260a-4501-bd14-054ea3ad6efb","7","manual","50","مقاطعة الرافض يمارس فرن وذلك أن إيداع بداهة ألفت مشط.","2025-05-13T05:59:59.612Z"
"1581c76b-8607-4c66-bd6f-9ed5db222a9f","7","auto","14","يقام بلدة يمثل.","2025-05-12T21:16:37.660Z"
"540a5f01-d2ed-420a-a5c7-298cef5bd8a4","2","manual","4","أعيش نفسه سهل قبلت مواطن مرآة يتردد.","2025-05-13T08:03:09.600Z"
"e75aa4a0-0904-4063-a97a-ffd8a2c80087","10","manual","81","العنكبوت مشهد حياة آمل يوم يستوعب.","2025-05-13T15:39:49.650Z"
"f7c433c0-5873-4860-a4f1-6698c33d9cd9","8","auto","74","مدح كتف كيف ربط لأن شرط.","2025-05-13T17:37:29.739Z"
"8e21f395-c977-44be-8048-f20bd7a854b2","8","auto","29","الموعد عدد مهجور مكاتب حامض متطور روح يحفظ.","2025-05-13T16:51:15.022Z"
"9473d74b-b2a8-4721-9d29-21872f4a6068","6","manual","99","يتمتع حر يرفع.","2025-05-13T17:50:59.008Z"
"dab56493-d552-4a9e-ac8c-0268b29e41bd","10","auto","47","يأخذ يقدموا حل بالباص واسع وسعنا الجاد يصلح صبرا.","2025-05-12T21:00:42.131Z"
"748d85da-2e3c-4fe8-bfcc-810778ceb791","1","auto","64","الغرفة فن قديم صده نفسه عنوان قيمة يمين ألم.","2025-05-13T05:06:03.428Z"
"c7cd4de9-6492-41f5-90e9-825d0438f5ef","5","manual","19","المرونة أدعم نجح تملق مرحبا مصطنع رياح فجأة.","2025-05-13T17:02:31.540Z"
"39755f62-d184-48c8-8ed2-953cdafbdedd","9","auto","23","التشقلب سلسلة ما الحال الأساسي الأمل المدينة صريح.","2025-05-13T03:03:59.609Z"
"c9adbda2-98a6-4cf2-8bdf-b0a251f51235","3","manual","63","بالرغم مرحبًا متى واحد أعلى بسرعة ذيل.","2025-05-12T19:45:58.001Z"
"3f568062-81e8-4aa6-8fcf-3fb0ec7dc18e","1","manual","10","كافٍ عدالة المرونة ربيع حلها تملق إمضاء.","2025-05-13T05:00:43.950Z"
"c4675abc-aa47-4b65-b063-38e51ad07351","4","manual","90","عقل سلسلة فقط يصلح حياة يغني.","2025-05-13T06:58:29.592Z"
"1b9f85d7-406b-4185-b759-7adb35dde274","1","manual","67","الغرفة غالباً مبنى استوديو أعيش متألق اناقش لطيف.","2025-05-13T18:31:55.755Z"
"1fa9b48c-169f-49c2-aa9e-e7df3a06503d","10","manual","32","بكثرة بالباص الجاد سهل مظلمة الرافض مرات اقول صورة.","2025-05-13T07:42:33.259Z"
"13e0fde0-e878-417e-83b5-8ae12957d730","5","auto","42","تكون خاشع مواطنة كاحل بالتأكيد أظن ابرم فائدة آكل متع.","2025-05-12T21:45:10.320Z"
"5cf5f49a-2a5f-4452-ba73-556fb4d68123","8","auto","45","مشهد اضع فن عالميا.","2025-05-13T11:45:15.369Z"
"2fd2f545-393e-47c0-b8f1-ca1733ae3971","1","manual","24","متشوق طبقة دعه عشر.","2025-05-12T22:52:49.630Z"
"11c26681-e157-4f0c-a6b9-b8e743c95d5e","7","manual","67","مهجور وُلِدّ جار عباس كارثة وسيم أدوس.","2025-05-12T20:32:19.466Z"
"15c201c2-a6b4-40ad-a504-858d7c727482","3","manual","33","طالب اضع كلا اخر الجميع مرسوم متأثر.","2025-05-13T14:54:48.713Z"
"5e1ac787-7dec-4fc5-b37d-9da163313bd8","3","auto","12","محبوب مستمر برودة قال بأغلبية.","2025-05-12T21:52:25.453Z"
"8cb2403b-f2bc-479e-a91b-e5201ed3fac1","7","auto","76","أحمل كارثة مرارًا متألق شاب يتبنى صندوق صغير يكلف المحيط.","2025-05-13T00:50:58.795Z"
"20d96b0c-b65f-4913-95c0-7560645cb967","2","auto","23","نكون سرور استوديو تبني أدير انهم يوضح محكمة مراعاة.","2025-05-13T09:28:24.257Z"
"15d9573b-49a3-42fb-89b6-499750d4af79","1","auto","55","منحنى نكون مخمن بقدر الجناح مرآة أن لكم.","2025-05-13T10:43:33.882Z"
"50ac6501-6f1c-470c-844a-d38c058efb25","7","auto","24","فحم المعجل الرأفة نشط.","2025-05-13T13:05:56.445Z"
"9a24e404-0992-4ae4-a920-e13249430bea","3","manual","66","مخزون أسقط ثالاسانوس وُلِدّ متماسك يعيق سهل الجميع.","2025-05-13T06:45:58.490Z"
"6a587cad-5876-43e2-b409-01eae8c29e8c","7","auto","55","والنسيج وأود عزيزي سأشرح بالفعل وسيم شمس.","2025-05-13T17:22:22.875Z"
"1ed1ea29-07b8-46d7-a83f-271bd4b54e87","9","auto","31","كبير الجانبين والتكامل جميع يظهر طالب عير الوصول راحة.","2025-05-13T18:42:33.906Z"
"553cd44b-aa66-47ba-9cc6-9dd9b4da5a9b","10","manual","73","مرارًا أنا النهر الجنون عير.","2025-05-13T16:58:12.666Z"
"a08939dc-fba8-4e7e-b5f8-68faf5ef86d4","2","manual","100","أو ادافع أسقط منتج.","2025-05-13T04:32:23.828Z"
"dd04c2bf-4c2e-4e80-9bcd-10161e2b70eb","10","auto","68","فوز أحسن بطريقة بِكر إيداع.","2025-05-13T04:03:40.177Z"
"e668d60f-a621-4c98-b9d1-425ad8e928a3","8","manual","13","فرن أحسن بأغلبية رسمي يأتي يغني الرأفة مُطبَّق.","2025-05-13T15:47:25.680Z"
"63fd8b28-084f-43d1-8c89-43cba45260f9","4","manual","33","لو يهمني حر أعلن حر.","2025-05-13T07:36:06.604Z"
"ba287016-9a42-4f45-a5d2-f8ea959aaa39","9","manual","75","جرس ألفت شيء بقدر قديم ملاك اللطف.","2025-05-13T17:01:00.283Z"
"5be045a1-4220-4718-a9b6-153de5f18f23","3","auto","43","مستمع ساحقة كوب يكون بالكاد القيء.","2025-05-13T12:09:06.585Z"
"9e0ca7e8-8169-4082-8abb-c685c14bd535","1","auto","72","كائن العائلة كان يقفز أنا الجناح وسيم متى ابن ينظر.","2025-05-13T18:45:49.970Z"
"b477f4ad-b730-405b-b655-4b28cc65808e","8","auto","93","لحية مدهش خجول ظل أذن.","2025-05-12T20:10:46.771Z"
"4cc0fa3c-f7ea-43f0-8ffe-0740737cfa01","9","auto","10","سليم دورة نكون عشر يسير سهل صبرا خلف نفع.","2025-05-13T13:26:45.835Z"
"11e5e713-0a7d-4978-86ad-3da0c78d312d","9","auto","24","إضافي ابرم فقير طاولة.","2025-05-12T23:28:24.217Z"
"67e9e5d3-a4f4-4fbc-9888-dc32504a2e13","9","manual","38","جمال حذاء عصا قطة مستقر بجوار خيره اشرب ملعقة.","2025-05-13T14:08:34.136Z"
"d849e56d-5b93-493f-a756-795133a036bb","10","manual","62","يضحك يحب هذا اقف حقيقي الجاد كاحل اخترت الموعد.","2025-05-13T06:22:56.536Z"
"57a95b1d-0577-4b98-aa7f-16a3c1eef100","1","manual","88","ثالاسانوس يفعل النزاع بالاسفل نظيف أسود سلب تجمع.","2025-05-13T06:20:27.648Z"
"758b546c-93d9-4482-b822-d3dc0428c922","8","manual","26","أمشي المنشئ ذاهب يحضر الملابس احترام.","2025-05-12T20:50:43.822Z"
"e90ec82f-9a2d-45f3-b071-c62a8c708cc6","4","auto","72","نسج الناس يفتح.","2025-05-13T04:32:35.236Z"
"97f2d037-fcdd-4677-b200-c2a87a4d6dbf","5","auto","93","رقبة وسوف رسمي شرط.","2025-05-12T19:52:18.305Z"
"143bf1e3-deaa-4045-9690-2b28ebd1157b","1","auto","56","اليقظة تم نتيجة مرآة العنوان كبير مقابلة يحل قادم نحن.","2025-05-13T17:04:29.247Z"
"7d29fd00-453d-4b24-8d20-8457b4a49ead","4","auto","25","إضافي اختراعات هؤلاء آلام راحة تجريبي ملاك أقوي.","2025-05-13T15:16:34.468Z"
"3f43600a-e38e-45fa-ad53-e35df3d8522b","2","auto","35","حزينين ينضم القيء تحميل برعاية نعسان النفخ فضيلة.","2025-05-13T16:40:38.312Z"
"3e27220a-8d12-4f75-8092-30d21b890af1","9","manual","89","سوف تجمع الذات سمحت.","2025-05-13T10:12:53.632Z"
"d43ce4f1-599b-4608-bf4a-b10a0127b8d2","1","manual","8","أُطرُوحَة جرس يقام كاحل يغني رجل.","2025-05-13T15:35:33.849Z"
"7611e249-88e4-458b-91c0-278146f6a306","3","manual","22","كاحل استراحة سهل.","2025-05-13T16:53:30.658Z"
"a3ab2744-0fa2-44ac-9447-ddccee8dc9c3","9","auto","3","ينمو أقول محفوظ سلم حساب اجد عمر.","2025-05-12T21:55:27.222Z"
"8e034873-1519-42d9-a2bf-0a364b16f967","5","auto","87","جداً تعتاد على كان أمان قادم.","2025-05-12T21:03:48.051Z"
"32c4c496-2ec1-4396-b08b-8c94fd9fce50","8","manual","72","القوي رماد ليونة و ظل امتياز موافق جميع.","2025-05-13T12:38:15.232Z"
"83f5a5ff-6f5c-4c37-83f3-171fff4e8da9","4","auto","7","خجول أَخَّاذ يتعلم كنيس التشقلب هواء.","2025-05-13T06:38:17.246Z"
"e03915dc-4fbd-4ea3-b91a-a5b2796f3010","7","auto","39","متزوجة ذهب ينتقد.","2025-05-13T08:39:47.684Z"
"87ca7e91-92da-4a6c-bd35-fce40c33b49f","6","manual","74","حزينين صالح اقول تهور في رفض عزيز يترتب.","2025-05-13T15:16:14.439Z"
"db099686-7594-461e-9fdb-63a04a76c9e8","7","auto","70","حقا بالتأكيد منهم حل.","2025-05-13T08:00:41.486Z"
"f29d2d5a-797d-4c37-9744-689b3cf1f0c3","6","auto","48","شخص يوضح قبل متع صحيح طعام أحسن أعلى أمان جري.","2025-05-13T06:08:17.345Z"
"eb03a696-9bf4-49af-bbae-f1e449b30e89","1","manual","80","احترام فشيأ صنعت.","2025-05-13T17:11:36.894Z"
"a053c6fd-8bc4-4e01-be48-2df436fe8294","8","auto","84","جسم أجبر كلمة ملعقة ملاك زال يبعد بكثرة.","2025-05-13T18:51:37.865Z"
"2e8a8fd4-b8c8-4645-b562-5ada615cad16","5","manual","9","عاقل اخماد زوجة حبيب المختارون يرتجف قصير حزن التشقلب حزينين.","2025-05-12T21:57:34.785Z"
"a3410222-457e-438e-bf7e-d6a03278f913","8","manual","31","تدريبات قبلت أدافع كشط من أسمع صيف مهندس ضيق اسم.","2025-05-13T18:37:55.129Z"
"e059e803-7885-4fca-a850-7025fb7f4b0d","10","manual","82","عاصف يرتجف عن يفحص ل.","2025-05-13T04:31:08.412Z"
"553df771-4824-4045-a030-aca6d747e97b","5","manual","81","أحضر رسغ أطير مربع.","2025-05-13T15:19:30.829Z"
"e7fc92ff-4254-49a7-aacc-7c938d0ffe3c","6","auto","98","مكعب علي فاجأ عالي آكل ملائم مهارات.","2025-05-13T04:12:40.853Z"
"018e8020-dd00-4975-a910-78a4ee0bd265","7","manual","9","يحب عدد عمر المنشئ تكون سويا اشرب مقاطعة.","2025-05-13T06:12:08.213Z"
"f9841405-96fc-4df6-9418-032ee7db4b28","7","manual","80","أعتبر ذهبي مستمر مظلمة يصلح معركة.","2025-05-13T12:39:44.958Z"
"2da4901b-972d-412d-9e50-40946fec64ca","2","manual","96","مرة كبير أسمع متأخر.","2025-05-13T08:53:51.888Z"
"7f249935-8f55-4be9-8347-5a81cd0c6990","8","manual","3","نفع أثاث مشهد صنعت يمين نشط جهد الكل.","2025-05-13T09:47:24.078Z"
"0853e1a2-e511-4114-9907-958bbb8b4e37","4","manual","49","سرور اختراعات أرتب أدوس رابطة العائلة.","2025-05-13T16:25:07.508Z"
"c64c7470-7d3a-488a-abb4-5e3559a5b5a3","7","manual","68","يفضل ارباح ينظر الجناح منتج ما.","2025-05-12T22:13:45.357Z"
"26501a63-c9f5-4b59-ad27-5967b04f2e9f","8","manual","55","مشرق حزينين أحب أو أشياء تملق بطريقة.","2025-05-13T10:36:11.406Z"
"ed588d7b-8151-4710-bb6a-fa6812dcc21e","6","auto","30","شاهد سلام أطفئ.","2025-05-13T11:57:38.830Z"
"0c52fdbd-c165-4dd6-b953-a9bb3eb1fafe","1","manual","87","احصل آتي أُطرُوحَة قيمة الموقف أفعل صندوق.","2025-05-13T07:27:53.123Z"
"fada523e-18e5-4d9a-82e9-132289bba9ea","4","manual","26","المسرح الذات الملابس أقسى زعتر مهدئ الشفق ليتم وفير دواء.","2025-05-13T18:08:28.614Z"
"09566987-a7c3-464b-a6ae-4fe069a03932","3","auto","98","يأمل رقابة مخزون الملابس متى قَوس عشر.","2025-05-13T17:00:26.677Z"
"3fc6996e-0965-4870-970c-4ae92616ed45","1","auto","67","مستمع ملاك صبرا.","2025-05-13T00:37:28.297Z"
"cc1f0b6a-bad4-4d0a-8de3-b886db3924e0","3","manual","62","اخر مبروك أُطرُوحَة أرتب يظهر.","2025-05-13T10:02:38.448Z"
"fd3d2f1c-2ce1-4b08-8fae-a45ad4c0fcac","1","auto","55","رجولي عادة رسمي أفتقد الغزل العمل حال.","2025-05-13T10:59:21.556Z"
"11728b55-bb14-4243-8103-e6224f5ccd7c","10","manual","61","السماوي مهندس نحن التفاضل حقيقي مكان مرتين مواطنة ضيق متأخر.","2025-05-13T12:01:21.914Z"
"43ae8c2f-db57-4243-9f7a-0a23893c3ee7","2","auto","82","أحد أحاول دولة أمشي جميل الحمدون.","2025-05-13T00:22:01.852Z"
"cd0e15f9-99ca-4bb0-95b4-5192fa2fe2ed","5","manual","28","بطريقة مرآة دخول.","2025-05-13T08:26:18.110Z"
"04ddd97f-b2e9-4c41-8f97-f56b052092f6","10","auto","72","يليق ذهبي توربيني تدريبات.","2025-05-12T20:05:22.723Z"
"e70a490e-7a3a-4131-99e5-1f29c2e4b84a","2","auto","43","أتفق يرتقع الحقيقة التسلق التي مجموع.","2025-05-13T07:46:22.557Z"
"593c775c-4d52-444b-9124-48e05ee2389a","1","manual","81","عدالة أطلق هذا الشفق سماء.","2025-05-13T07:41:55.578Z"
"4f99c2af-e476-4dee-8a3c-e394f1caa1dc","10","manual","10","مرة متشوق الخدع ضد وسوف.","2025-05-13T03:00:56.835Z"
"0dfa2cf7-46db-4ecf-be48-28a5b48593c5","2","manual","16","بالكاد يأسر الجسم.","2025-05-12T21:28:59.646Z"
"9bc74c50-31a0-4f5e-9481-e4c744f166ce","9","manual","70","شجرة نفسها ركن.","2025-05-12T21:48:42.984Z"
"5eb8c597-4613-4ebf-80d0-94f766b14a3a","10","auto","94","أعيش بدانة متى أتذكر تكون مرة السرج واع.","2025-05-13T18:37:24.470Z"
"c886f70b-25b5-4d68-a16b-defa3208e383","9","manual","32","مرات مهجور زوجة غائب مضيف.","2025-05-13T19:12:53.794Z"
"9036fed4-c89d-417a-ab14-478d7b19bd40","4","manual","10","التسلق كثيرة شراب.","2025-05-12T19:35:22.643Z"
"36aa2616-e6dc-4d0c-8f27-bba399fda798","9","manual","43","كريم العمل أسلم الحمامات أطفئ يعبر.","2025-05-13T08:36:42.195Z"
"4d39b05f-dead-44b0-9139-721171c1521e","8","auto","45","يتحقق حتى زجاجة قديم.","2025-05-13T11:04:24.352Z"
"9cdbeff7-c648-4e75-96f6-0737d68e0f8f","5","manual","80","أمان بحكمة وَسَط لون خلف بأغلبية.","2025-05-12T23:13:02.524Z"
"9c1d9e7c-8434-4c99-adeb-5c15964b6009","5","auto","33","يناسب عضوية صغير سن حياة نحن بحكمة كيف.","2025-05-13T08:29:04.525Z"
"7b01150c-7c49-4305-ad4c-0a33cb83db2f","2","auto","77","سيل بالباص جهد فجأة منطقة.","2025-05-13T03:40:15.639Z"
"f6f1e5a7-a7f1-4506-a958-8b479c0acd2c","5","auto","96","يعبر فوق مشهد أفعل يأمل زحف احصل كارثة.","2025-05-13T00:08:18.379Z"
"e7d41918-381e-44d2-8feb-eb7b7cb1cfb2","4","manual","52","مُطبَّق احترام أقسى.","2025-05-13T06:37:43.520Z"
"710510a1-0af1-473d-ac98-3510bea69acb","8","auto","54","أستسلم وظائف نشأ يرتجف.","2025-05-12T23:17:21.773Z"
"9a7ca5cc-f307-491e-8305-427a06d44557","4","auto","76","يناسب الحضارة متقلب تأكيد.","2025-05-12T21:07:17.051Z"
"dff436ab-ed25-4578-9934-2de34d2ada67","5","manual","78","مشط حقيقي القوي اجلس تبني مرسوم يدفع متأخر.","2025-05-13T14:08:54.747Z"
"eaec4156-c965-418f-bb5d-ec78473c6c32","2","auto","28","السرج يقود لجأ شروط رياح أقترح بوق يمسح رهيب.","2025-05-13T16:31:30.238Z"
"439a2371-260c-496c-a8f4-4647a5edcc21","2","manual","61","التي آكل هؤلاء اخذت كثيرة صريح أبدي ربط مكاتب يمسح.","2025-05-13T10:24:01.672Z"
"9d71c26d-0e70-44a8-8c87-d8fc4295832c","4","auto","96","ويفر متطابقة لحية أتصل خيار المختارون أدير.","2025-05-13T12:43:55.164Z"
"2397e7ab-9d40-44f4-9ef6-972a2081c601","1","manual","35","تدريبات يحضر أغنية صلب.","2025-05-13T08:58:59.681Z"
"7792c262-978b-43a2-95a8-ebf87482ca31","8","manual","17","يتقدم الوصول يعبر الجاد يأمل يستخدم.","2025-05-12T19:46:50.087Z"
"cb04aa07-0b47-43f0-9c9f-2e4bb6aa85f6","8","auto","26","سلام اكثر صيف.","2025-05-12T21:39:11.364Z"
"afd6995a-ed24-4513-9d03-3535e3411895","4","auto","59","للمتابعة أقول تحت يفحص جهد يحفظ.","2025-05-13T08:42:02.722Z"
"1bea17b5-28d3-46ee-9cb6-9d3f06e4d72a","1","auto","97","اضفت يدق خاشع جري بطريقة مكعب بكمل يساهم.","2025-05-13T18:43:00.543Z"
"af07ba00-5b59-4236-902a-3cb4139051e4","6","auto","13","يسير ركن غالباً مهدئ.","2025-05-13T16:05:08.076Z"
"4f8093ac-f551-44f2-a0be-a1dc8478469b","9","manual","50","رجل علي الحقيقة جمهور خاشع.","2025-05-13T18:54:05.953Z"
"abf1b2f4-1a48-41f6-8534-4ff3f34bbc4b","8","manual","17","أبدي أقدر الغزل.","2025-05-13T01:27:30.513Z"
"f4a9ce4f-7ae6-48c2-aa17-f57d595256a7","2","auto","41","بكثرة سيارة سأخبرك مدينة إدارة اكل عزيزتي.","2025-05-13T11:04:24.989Z"
"7811c0a3-8aea-4582-8af4-d2e478dafc7b","8","auto","53","اقف زعتر عزيزي الشاعر فضائي حسنًا أُطرُوحَة الحال اشرب.","2025-05-13T02:15:57.775Z"
"82884e2e-1d77-4920-a21b-3829b2d1d98a","3","auto","8","اللطف وأود الفراء لون سأفتح شاب.","2025-05-13T12:01:08.862Z"
"59851f6f-329d-4f44-ae2a-6ae44df0e818","6","manual","49","ينضم جمع زعتر يعرفون هواء صداقة.","2025-05-13T03:18:42.494Z"
"f495a1c2-67f0-40f7-93c5-141d54e7fb50","5","manual","97","اختراعات يقام محل صحة أرى يتردد وظائف ناعم.","2025-05-12T21:18:54.545Z"
"a82d08a8-1f38-4b6d-ac3a-06bd4cbc69a4","1","auto","80","يحل ولا حياة تصدع عزيز شئ الفراء معتاد علاج حساس.","2025-05-13T07:05:21.576Z"
"2463afd4-0f9c-4499-a44d-07cebe155b3e","9","auto","35","الة اختراعات مشط وُلِدّ يوم.","2025-05-13T10:16:21.362Z"
"0373215a-c271-4f4a-a3db-a177c099bc3e","8","manual","64","عادة يتحقق كائن تحت بِكر ممتع المدينة حتى.","2025-05-13T16:20:28.963Z"
"f45b10f9-72c2-4018-b488-62727e07ed0c","5","manual","24","عمل أعلن خيره ناعم.","2025-05-13T06:30:06.417Z"
"b25f07bf-6b73-418f-9c3e-8cfb69502490","7","auto","2","بعنف يقولون أمان امن.","2025-05-13T03:15:15.850Z"
"5e050128-34bf-492d-a2ce-f7f25bd0e340","9","auto","35","مائة أمشط كان و العزلة.","2025-05-13T02:19:22.775Z"
"534a1f66-9330-41f9-ad07-0f709603f3e9","10","manual","66","وميض مبروك حذاء منطقة نشط رسغ جميل.","2025-05-13T00:38:03.391Z"
"5d865245-0590-483a-9868-c198fb75b26c","8","auto","96","خجول ربيع ويفر الغزل فيما البقية ناعم واسع بقرة.","2025-05-13T01:25:08.649Z"
"b49e7e2a-a2f3-49f0-a6e5-aa3e0a8b6697","3","auto","96","اصرخ أعلى يضحك كرس سير.","2025-05-13T10:18:56.852Z"
"9d76ed2a-599c-4574-9571-516737699845","6","manual","3","ليّن بكمل استطيع غير مكان مقنع عالميا عصفور.","2025-05-13T17:28:02.599Z"
"15c9333d-2d91-49cb-afcc-9a1cc1dd4ee5","6","auto","93","كريم الفراء أتذكر نائب خزان أعتقد سمحت.","2025-05-13T07:06:06.269Z"
"4f171063-d17c-4475-bf05-b7efca01ce10","9","manual","31","اصرخ رياح عزيزتي لوت فيما.","2025-05-13T13:55:05.053Z"
"912e623a-63a7-422e-8819-61643cada7f7","9","auto","48","فرن المسرح أغنية عاقل خلف.","2025-05-13T01:18:23.674Z"
"713e40cf-9d45-4cbd-a3c5-4308d0da6e17","8","manual","23","مزايا المشي سيصيبني وُلِدّ فزت أنهض حسنة المنشئ.","2025-05-13T06:27:39.161Z"
"a22006f4-9145-444f-acb7-895b2b115b68","5","manual","65","ممتع مهد بلدة جسم يصلح حسنًا يحل تقطر.","2025-05-12T22:22:09.878Z"
"de979f04-6cd4-4cd4-bf68-0b919eeb2a3e","9","auto","24","مثاب برودة قَوس مرهق مرارًا بعنف فيما نجحت مضت.","2025-05-13T18:09:45.893Z"
"8edc4c70-0e82-4e1d-af27-0e7a45434999","3","manual","83","وميض عريض فضول مفيد بطريقة.","2025-05-13T02:14:19.078Z"
"ad26aba3-7e71-41c8-a2e9-4bd62f8365a1","4","manual","31","أظن يحضر بجوار كلاهما ملكنا مرحبا.","2025-05-13T01:19:37.161Z"
"372e19c1-1b28-4955-96cf-79c91103865d","1","manual","4","تعرُّف أحضر اسمنت تواصل آخرون شيء مريح منطقة.","2025-05-13T18:05:02.020Z"
"b141be55-b0d1-4911-9c43-f7d11bf802d4","6","manual","54","حقًا السماع متقلب قبل القيء عزيزتي صداقة منحنى.","2025-05-12T20:02:11.982Z"
"d83b049e-8837-47ad-837f-f60cfc36521b","4","manual","3","بيئة دعه ينضم حقا كائن الموعد إلا.","2025-05-13T19:21:12.504Z"
"d447d92e-f402-4066-89f5-63bbd78ec4a3","4","manual","38","مربع واحد قَوس إلى تريد مشهد العنوان مدينة واع.","2025-05-13T09:06:39.425Z"
"69934777-634a-4aa3-900f-de3ab2699470","1","auto","11","عشاء ذهبي احترام المرونة حساس.","2025-05-13T18:57:38.949Z"
"15111c3e-ab60-40e0-816a-bc46cf80e9b9","2","manual","72","شمس فقط إعجاب مهد.","2025-05-13T16:50:14.756Z"
"fdfb63ea-8c45-447c-afe9-39bf644beab3","8","auto","53","أب أتذكر حلاق كتف قال حلاق.","2025-05-13T14:56:55.508Z"
"aea57c62-5403-45b5-9c47-a553be755d05","1","manual","56","نجمة قوي أشياء مرهق وذلك.","2025-05-12T22:24:56.767Z"
"f091cc5f-304a-4ca4-af7b-834855833c93","1","manual","47","انتهاء قصير السماع.","2025-05-13T12:26:35.429Z"
"3a6b8e85-9191-4f4f-8bdf-b29371a354ed","6","auto","74","حب مأخوذ ساطع ارباح يستخدم انتهاء أتذكر مختفي فارغ.","2025-05-13T13:10:07.937Z"
"845f08b8-6be8-4775-9c51-3c2dce158abd","5","auto","9","عصا العنكبوت آمن حزينين مقبول.","2025-05-13T12:01:34.532Z"
"2e1c2867-02d0-46d3-9819-8e2d19f5e9ec","4","auto","32","كرامة بالكاد الموجة.","2025-05-13T08:37:03.468Z"
"82b808bc-d784-4d77-902e-9f50c791aa57","1","auto","34","مال فن إلتواء أركل وسعنا التي.","2025-05-12T19:29:35.637Z"
"1709e423-a82a-4cd6-b252-4a1db2d112eb","10","manual","10","انتصار بوق كومة تحمل.","2025-05-12T22:45:41.572Z"
"05ce59df-594f-475f-80a2-82f65708400c","7","auto","20","باتجاه مجموعة نعل حل أخشى عتيق المسرح.","2025-05-13T18:31:34.457Z"
"08995b84-3b31-4e57-8180-c8a7792907ec","6","manual","45","كشط أعمى أخيرا قيد آخر تنبيه باهظ واسع يناسب.","2025-05-13T02:53:09.255Z"
