log_id,driver_id,operation_type,points,reason,log_date
"ef2ea43c-7381-4b34-8e0c-78ba1d6ad787","1","manual","9","اجد رجل مضت متى معبد ما ديون.","2025-05-13T16:17:12.483Z"
"6100d36a-44a8-4854-9f47-1a44b021c693","5","auto","20","آخر حر حزينين متى ينضم باستمرار.","2025-05-13T19:04:59.282Z"
"42e659f5-4a8f-491f-8d0d-6f40eec5f709","2","auto","16","أعلن امن قادم مجمع متشوق يوضح تواصل كثيرة امن.","2025-05-12T22:08:51.935Z"
"30d369df-2b4c-49d5-9cac-2e43bd446ee0","5","manual","54","فاجأ عمل مشرق نتهم يحب بالاسفل استراحة خطة.","2025-05-13T06:11:10.831Z"
"5446ab17-531f-4129-9d8d-0066b4ce6c73","8","auto","20","هم تحية يوم.","2025-05-13T14:53:05.732Z"
"dc0c339d-167c-4351-ab17-5bee513d7b54","2","manual","51","السماوي النفخ بكمل.","2025-05-13T00:26:16.858Z"
"9fb1421a-fccb-470e-8da4-8f5106cd5c6d","2","manual","28","وميض حتى أتفق والنسيج بدانة أن العمل ينضم الجناح وسوف.","2025-05-13T08:45:50.764Z"
"353cf6b6-8215-4bdc-957f-99b827350a33","10","manual","99","رهيب المعجل عشر عاصف يمارس خاشع تدوس مضيف.","2025-05-13T17:43:30.718Z"
"f5367bc5-e206-4c48-bb25-bedab1ee0fac","3","manual","77","سأخبرك قف خطة ممتع اخر أسود معتاد صندوق.","2025-05-13T12:39:35.049Z"
"c7127338-164c-4a0e-9111-a2864e090b29","1","auto","59","قَوس قيد بالكاد غالباً يقام أفترض الذات فيما.","2025-05-13T04:50:56.511Z"
"05d04b55-d8f4-4871-890d-4ff615c1245b","5","auto","25","يمين مزيج عزيزي يفعل مهجور خزانة حضن المحدد ألحق يحضر.","2025-05-13T18:00:49.546Z"
"9c6ba30f-a21a-4c52-a5c6-43d9c38bff65","9","manual","87","تحمل الموجة مظلمة رجل الحمدون الكل سيارة أو حتى.","2025-05-13T18:34:37.332Z"
"65fd0796-62bf-430d-8c3c-9dda85676bf0","8","auto","4","جداً يفعل ملعقة أغطي تتدفق أركل هو.","2025-05-13T11:34:33.420Z"
"69456cf9-04ac-43b2-9de1-ad32545b89be","2","manual","85","خفض أقدر مع مقاطعة مقابلة أسود.","2025-05-13T17:42:52.878Z"
"ef223bfa-6130-46de-ae27-eeec9e010e83","5","auto","46","زحف ركن يأسر خشن المحدد أتذكر مخمن أقوي عتيق.","2025-05-13T19:01:01.574Z"
"44b16215-0fc9-47db-8694-b446f9af3e44","1","manual","58","أقوي تدوس مقبول أميل.","2025-05-13T15:00:31.704Z"
"0550f91e-382d-44a5-adc2-e43c5d9414a9","6","auto","10","نكون أرتب ملل العائلة.","2025-05-13T15:55:48.773Z"
"815c57e2-07fa-41c9-a7e5-a3fa383282e3","4","auto","11","الناس عريض مائة ديون أعتبر أعتقد أحب.","2025-05-13T08:37:41.057Z"
"f56d8575-64d6-4c57-9c66-cf4d7298529e","6","auto","62","القليل فقط أوافق تنبيه.","2025-05-13T17:58:07.093Z"
"a05c84ab-71f5-45a1-845f-10cafb444cf9","4","auto","94","بطريقة يظهر أقترح اتحداك اضع الشاعر العزلة صالح الجميع حلاق.","2025-05-13T16:53:56.042Z"
"5a5660fa-3d7d-4b7f-92a2-5fe84c786952","10","manual","93","علاج مرارًا نجحت ذلك.","2025-05-13T12:05:20.332Z"
"234d575f-3281-4079-a84a-8229390610f4","5","manual","26","بشكل فضة مهدئ ثم ربيع العليا.","2025-05-13T04:23:12.306Z"
"d0a5d69c-74c8-4536-a5c9-be727c1dcfad","4","auto","37","كنز شاهد عم كتف تستوعب مجموع الة أخيرا ليّن.","2025-05-13T01:50:43.642Z"
"9080cb01-46b6-43c3-b0fd-0d806134df94","6","manual","34","اضفت تقطر طاولة من رماد.","2025-05-13T17:27:08.518Z"
"6c42e82e-e4f2-4af2-8aeb-cd56cf07e3d3","10","manual","76","دواء ساطع إدارة جَذّاب تواصل باقية السماوي يقلق سأخبرك.","2025-05-13T16:31:58.719Z"
"09b1efbe-0f95-400d-ac38-c0bf7a5e5e38","10","auto","95","اتحداك حسنة عمة الحضارة الة علاج.","2025-05-13T00:49:02.053Z"
"795a2d87-b340-4e86-b8b9-b24e3017d7f4","5","auto","16","نحن ربط احترام جيد صامت.","2025-05-13T10:38:00.809Z"
"5827741b-0980-43b6-8e6a-5f7082de9a66","2","auto","52","يناسب شيء عزيزي ايقاد أحضر استوديو رأى أركل مادة صده.","2025-05-13T06:24:18.250Z"
"31f97ede-d806-41f1-9e48-3ec28eb36ff0","10","auto","96","يترتب الموجة رسمي وفير أطفئ اللطف ليونة تقطر.","2025-05-13T06:59:46.386Z"
"127e0d75-6d59-4aff-ac4a-ef8be8f16dfc","6","auto","38","مريح شعر نتيجة باستمرار.","2025-05-13T18:26:32.961Z"
"449cf8a8-62f4-464b-90b8-d3a92ff60be8","5","auto","91","الغزل باتجاه الوادي الفصل ليّن يكتسب.","2025-05-12T23:51:19.849Z"
"81b2ba67-d144-4e8a-ace4-00b9840bd1b5","8","manual","16","مجمع رحلة مهجور أطفئ الموسم يرفع الإحسان.","2025-05-13T13:39:56.251Z"
"1d87cc8e-590a-44d0-bf51-e7189b9b338b","4","manual","77","ساحقة جمع يفصل أنهض أحد مرة اقول.","2025-05-13T03:22:35.853Z"
"40c2dcbc-2753-45da-9236-a710bca47ec4","4","auto","87","نظيف تصويت أوزة أَخَّاذ كنيس نتيجة.","2025-05-13T14:08:11.504Z"
"b9097768-e786-4fb8-9f7f-0accc684c7cc","1","auto","32","مرسوم ديكور ينمو.","2025-05-13T00:07:15.137Z"
"ae57d1aa-cede-4f87-9fde-ff8052edc058","3","manual","97","للمتابعة أغنية جمهور اضفت تكون دعه.","2025-05-13T10:23:00.833Z"
"81a95412-f98a-4753-bade-ed390fc6c2e2","8","manual","45","خلف الغزل هؤلاء يقام.","2025-05-13T12:07:34.060Z"
"da4a4145-7dbf-468e-b6ec-235cad6d870c","4","manual","80","وذلك زجاجة سلسلة عضوية فضائي حقًا عمر.","2025-05-13T05:55:41.253Z"
"85b78a60-76be-421d-b9f3-d50fc8a7b479","5","auto","20","يقي قادم قال حل انهم مُطبَّق أتفق بداهة.","2025-05-13T09:10:57.784Z"
"5f0b0013-de61-4fb0-b84b-6a222074fceb","8","auto","76","بدانة يفترض مواطنة.","2025-05-13T01:52:35.831Z"
"7433b659-2465-4bd2-b320-1e2e7ed8769d","5","manual","74","دعوى للرفض يوضح يبحث قبلت أحد سأشرح الذي كبير.","2025-05-13T09:15:34.943Z"
"71969940-faf2-455b-bb83-92f2b3d1bca8","5","manual","17","مصلح كتف شخص منتج عمل فشيأ.","2025-05-12T23:25:51.020Z"
"8325d755-4c78-42a3-b7ba-d6277bf5b133","9","manual","60","الحمامات برعاية إدارة ابن متساوي أعلق ويفر جهاز أتذكر.","2025-05-13T04:35:13.983Z"
"e42faf13-3683-4a21-b2b0-c38e5e87054a","8","manual","31","طبقة أسمع فشيأ اجل أسقط تأكيد ينتقد بشكل زحف محل.","2025-05-12T23:02:47.364Z"
"7d73ee40-1a3c-461e-b929-f96f07fc0ce8","7","auto","11","دعوى وَرَاءَ اخر.","2025-05-13T11:18:58.384Z"
"98062170-157f-4a2e-a9ee-53a86b993e31","3","manual","92","شاب بوق والتكامل يحضر حزينين صيف بحكمة جمال.","2025-05-12T22:00:43.498Z"
"09341459-b5e1-4180-b20b-3f35ea019a84","2","manual","85","استوديو بالكاد لطيف أحد سهل بكثرة اتحداك تكون سير يسلم.","2025-05-13T05:29:49.540Z"
"a528a50a-349a-46c8-915f-a8f76090ca54","8","auto","63","ذيل تجريبي متى سيصيبني إذا يناسب قبول.","2025-05-13T00:01:22.249Z"
"88b95fa8-e67b-43ba-bdec-15f3d2e51fe2","5","auto","54","تواصل استراحة متطابقة المرونة هو السرج أفعل.","2025-05-12T21:52:43.789Z"
"236b4f1c-8af3-482e-9273-6b3c497f0b6c","10","auto","44","فزت الثعالب علاج حب.","2025-05-12T23:01:08.063Z"
"e1ab9544-d02b-4ef7-9d44-011fca00977d","8","auto","13","ساطع اجل ملائم ازعم المحيط المعجل زيادة تواصل ماشية.","2025-05-13T03:27:23.935Z"
"4e1f4169-e0bd-4fe5-a36a-f77c01639cd6","1","auto","50","تريد يرتقع ملاك السجلات يتذكر صدوق آمن.","2025-05-13T03:14:08.918Z"
"d0fa4f3d-e984-444c-b0c4-d25ce2d8aa56","9","auto","64","ماء بِكر أمشي يرتجف اكثر بيئة المحيط شريك ملل أن.","2025-05-13T15:24:27.160Z"
"d6a318e8-80cf-402b-bdb8-dfa6b47971c9","5","manual","51","يناسب يهمني يفتح محل بالرغم رسمي منهم مخمن.","2025-05-13T15:16:33.641Z"
"2511c8bb-291d-4ef0-9d97-aa2d7e3727b4","10","manual","88","تريد الوصول الرافض جاذبية ضيق برعاية الة سنة الموقف طريق.","2025-05-13T07:03:42.465Z"
"612cc446-52f7-4e3f-ae17-b9a8ffef6cc1","2","manual","8","طاولة القيء إلى ألحق.","2025-05-13T15:26:41.992Z"
"535a8622-88c2-4ffd-9a90-4628b8105382","4","auto","6","سيصيبني لطيف كنز حاضر جاذبية.","2025-05-13T02:27:37.337Z"
"98ec2dba-bce6-466e-8c77-ab6947ee3e39","2","auto","20","باهظ طاولة معماري يحب اقتراح القليل جري يليق.","2025-05-13T19:24:30.691Z"
"e52d7de2-fc53-4430-ab59-c9f7795d261f","5","auto","52","يأخذ كلمة على أطفئ أفتح.","2025-05-13T14:59:32.495Z"
"35b5288a-7948-4036-a0ce-f8b83d0e6442","5","manual","94","حقًا اسمنت بسرعة.","2025-05-12T22:15:42.377Z"
"204fe7bf-1cb9-43b5-a988-ee2f6f31e0dd","3","manual","48","سألتصق اقول يفصل.","2025-05-13T15:28:03.818Z"
"23b9bed2-a9cc-4008-aa19-fa7f86f802c6","5","auto","4","مِرفَق النزاع نهاية وفير الغرفة المشي على زوجة وسيم.","2025-05-13T14:14:52.937Z"
"9a206d8a-8f92-43b1-8f20-355b779abaa7","5","auto","15","جمال وظائف فضيلة أقسى قميص ذهب متوسط تذوق قادم.","2025-05-13T13:36:57.450Z"
"1d198a6f-adaa-40ea-969a-1d189f86a792","2","manual","26","إدارة كما شخص باستمرار متنوع مفيد عجز بجوار مضيف.","2025-05-13T03:04:54.473Z"
"58280ba6-770b-45e3-8295-e7b40ca854ea","1","auto","88","المجلد مائة سهم كائن جمع سبب الة زحف.","2025-05-13T16:45:47.895Z"
"b7c7dbc0-6676-4baf-9887-ed089ade5c85","6","manual","78","يسامح صغير زيادة ثقافة اليقظة نشأ أسقط عادة.","2025-05-13T07:15:33.987Z"
"e584378d-be3c-4e25-a23f-b9f3ddadfaed","5","auto","19","متطابقة يحضر تخمين مرتين انزعها بلدة اتحداك وفير يعبر.","2025-05-13T03:22:07.537Z"
"6484df43-a7bb-45db-8f29-a63b555b7a43","2","auto","19","حزينين زوجة جري نفع عمر لكم يتبنى الفراء جرس يحفظ.","2025-05-13T01:04:48.636Z"
"2deb9e46-01c0-4b8a-9b74-46c3acecc30c","4","manual","85","هنا محبوب ألفت حل أدافع سلم تعتاد فجأة.","2025-05-13T13:51:17.308Z"
"434d150f-bc73-48fe-b699-848e816c1a2c","8","auto","80","ثالث مريح احصل جمال ظل الغزل.","2025-05-13T03:55:24.648Z"
"6a6b80db-b550-42ac-b1f7-6aab879746a0","3","manual","59","أفضل امن يحل راحة جداً يقي.","2025-05-13T01:28:29.967Z"
"91393049-8a43-4152-a554-fb166563eda1","6","auto","90","يتدحرج يقدموا إعجاب لك يساعد اسم أنهض أطفئ ذلك.","2025-05-13T10:58:14.232Z"
"c3965a67-ed1c-47e9-90ea-e17a634bb27e","10","manual","17","شائع أخيرا ماهر اجد آكل صبرا.","2025-05-13T12:02:38.025Z"
"3ff1483c-d61a-4c61-a785-abac049980e5","1","manual","50","حب مدينة حزينين أدعم في لجأ عمل.","2025-05-13T02:29:34.371Z"
"9f6d9d2d-8a1e-43eb-a26e-dd13aae78a88","1","manual","90","السترة عزيز مهندس آمن مرة أغنية عن التسلق دعه.","2025-05-13T10:45:40.359Z"
"7cb54b2b-22b2-48cf-a8b1-d581b01bc89c","10","manual","77","تنبيه صحيح نشأ نفسها دولة ما زجاجة زعتر.","2025-05-13T08:58:28.097Z"
"e2539520-61fb-4cb0-baf9-ff29242f19ec","6","manual","28","مرارًا سأفتح بدانة.","2025-05-13T09:36:19.383Z"
"32e18a72-2a8e-49f2-b610-9d7edc28fe5d","2","auto","64","تحية نجحت تتدفق أعلى لجأ دعوى يكون جميل يمثل الة.","2025-05-13T18:51:58.699Z"
"5c4deffc-aa74-49b3-8db7-ecf82236c676","3","auto","35","أنمو ثالاسانوس نجمة يظهر خلوق و يتمتع وَرَاءَ منحن عضوية.","2025-05-13T06:10:44.189Z"
"5eaad9bf-65a3-4b41-83f9-696891950abc","10","manual","97","صغير سلم أجوف.","2025-05-13T03:15:51.597Z"
"522fcc4e-e343-4907-998e-b7a18f6a3b69","3","auto","9","رقابة بوق إنني آخر ملل بالباص شهرة.","2025-05-12T23:32:28.623Z"
"18445ab3-0615-4a05-b177-625190d1de89","10","manual","35","أحمل سأفتح مربع الجميع أو القيء صامت يفتح التسلق.","2025-05-13T10:10:17.398Z"
"647a328f-5cad-4b5d-a811-a42da2dcdec0","9","manual","5","مريح ثقافة السعة ماذا يمارس تماثيل بهجة مجال مفيد ينظف.","2025-05-13T18:23:59.349Z"
"ded6c99c-21c6-41c3-99ae-36940ceb7be5","4","manual","59","اعتدال مبنى خادمة يقلق بطريقة عير تحت رأس.","2025-05-13T10:52:53.445Z"
"6a92f932-45be-431b-93d4-304d82e1e27f","9","manual","46","المحيط أخت الحمامات يظهر قوي يمسح مشط.","2025-05-13T10:46:05.194Z"
"c02488c6-8a6a-4eb3-b03b-4dece01b3d3b","5","auto","30","انتهاء أدوس لكم رمي صوت.","2025-05-13T18:11:36.033Z"
"d4d5f840-bbb7-4358-982b-4a19c3e50eb9","2","manual","18","احترام الموت سنة ثقافة اقود.","2025-05-13T04:12:46.598Z"
"96cb9ec3-63bb-4bf7-acf2-4c95a74dd61b","8","auto","81","نجح ثلاثة المشي خفض كشط عريض تأكيد تجمع عشر أفتح.","2025-05-13T02:38:08.730Z"
"8495c5c9-5e34-4f47-828f-66f63bb468aa","1","auto","29","أغنية حياة تصويت بشكل.","2025-05-13T06:41:54.600Z"
"cc8103e1-eccb-47b5-9a94-5860e73c13e1","9","auto","78","امتعة مقاطعة سهل.","2025-05-12T21:41:52.192Z"
"0c44b720-05f4-4976-8a5e-3ee932faacb9","2","auto","81","صنعت ادافع دعوى الطريق سيصيبني اتحداك خط فوز.","2025-05-13T19:08:36.257Z"
"f37f5595-fa69-42e3-a21f-378c8b8a2801","7","auto","69","وظائف متطور نتيجة شئ بالكاد ملائم انهم واع بلطف شجرة.","2025-05-13T10:51:59.606Z"
"da35e431-faa2-4d7b-8742-98852d6f86b9","3","manual","64","مهندس مرارًا حسنًا يفتح اكل أفتح أي.","2025-05-13T07:05:18.425Z"
"29562a1e-154e-444b-a39e-9e6a9f086c3e","5","manual","90","امتعة أفترض مشط الكبرى.","2025-05-13T16:47:35.425Z"
"2dc119e0-6e3e-4e26-946f-cca103614d40","1","manual","63","مساء شروط اتحداك آخرون دور أجوف أركل.","2025-05-12T19:41:15.340Z"
"bf524382-0fb0-46c4-8c33-167bd4066bdb","10","manual","56","اقرر العليا كثيرة وظائف الرافض السعة أغطي نعسان إخلاء.","2025-05-13T10:02:10.275Z"
"d0ae898e-b743-40d8-b0a3-2816aed85cc7","5","manual","52","شمس اضفت انعش بالكاد مثل أوزة الموت فن شرط.","2025-05-13T17:59:46.554Z"
"357ab13b-c582-4148-83eb-5639975f5cb7","8","auto","29","قديم أخسر مرهق مضيف لكن.","2025-05-13T14:04:57.293Z"
"c4dbf537-5368-456b-8a14-0b3e24e810ec","8","manual","1","الغزل أشياء حجرة تجمع متساوي.","2025-05-12T23:24:27.152Z"
"106a9189-a6cd-497b-8c6a-15cc41e3a2c4","2","manual","87","تذوق العائلة ملائم العمل عير.","2025-05-13T16:29:41.810Z"
"838cf9ef-652e-459e-962b-c528d68b8928","1","manual","97","الموسم مستمع الفراء أدوس يفحص.","2025-05-13T00:23:22.240Z"
"d9e5fe60-0838-4a99-aed2-59d2957cb4b1","2","auto","4","متأثر اقتراح تم شجرة سرور.","2025-05-13T15:39:33.334Z"
"e442dc43-c8d4-4847-b229-6c5756880240","6","manual","87","شهرة إضافي زحف مدينة أغنية.","2025-05-13T05:32:09.255Z"
"0df4e36a-38ef-4f52-90b9-73c25386b222","7","manual","59","حتى أقترح ألفت عالميا.","2025-05-13T09:29:50.516Z"
"35519a8f-eb19-4a8e-b92c-085285246d1b","4","auto","39","انعش كومة أعلى رحلة العمل رقبة.","2025-05-12T23:55:56.740Z"
"c2a95058-2c5b-4e96-8d49-bf527b7a96ba","9","manual","37","بكمل يغني قبل كلمة.","2025-05-13T16:07:15.356Z"
"397f4a1d-63dc-43d4-b4ed-f3a8235d7b42","5","auto","14","أغطي أدير حذاء وَرَاءَ رفض سلسلة.","2025-05-13T07:29:11.145Z"
"cfbf133a-4b6b-4da3-8dc2-4d6f87e9af00","1","auto","5","أستسلم يعرفون رجولي جسم مشرق.","2025-05-13T19:09:32.723Z"
"519fce10-80e2-4f0c-b00c-dc301572a8db","10","manual","5","العزلة الجناح أتفق ماء.","2025-05-13T06:56:52.918Z"
"ded79a4f-b078-4c27-bf37-df22048f8a52","1","auto","78","كرامة تاج مواطنون اليقظة يمين دعه ذهبي سيصيبني منحن.","2025-05-13T06:19:28.298Z"
"fe17023a-2f75-4300-a52a-5a6cc003e25c","5","manual","21","ويل سأشرح عصفور.","2025-05-12T21:26:23.863Z"
"29e331fc-da05-44cd-9b94-3b43c86785a4","4","manual","39","يترتب ينظر طعام نتيجة ربيع الموقف.","2025-05-12T21:32:21.086Z"
"85377fa1-f989-473f-bfde-73de168f4f55","7","auto","69","يلمس عزيزتي حق غائب أقدر الذات الأمل تكون.","2025-05-13T12:48:14.188Z"
"5985684a-c382-4f06-adae-1d2094a99242","4","manual","17","الجسم حر يسير باستمرار صداقة فضول إلى.","2025-05-13T14:56:15.171Z"
"14619314-3e07-4d93-b4b8-82501e98f243","6","manual","95","المرونة تعتاد صيف نكون.","2025-05-13T03:31:54.891Z"
"1306a897-9d51-4c6e-9c85-162da43a58ef","3","auto","22","صوت لذا أكون أدافع.","2025-05-13T07:27:22.638Z"
"ae395402-a128-4314-a93a-da185dc41ddd","1","manual","89","قيد أَخَّاذ الرافض أوافق مرهق.","2025-05-13T16:34:17.834Z"
"1362976b-9370-4923-b81e-f1a1e8bcb3ec","10","auto","33","جيد فضول صوت فضول فائدة فحم أدوس الشاعر الملابس حصلت.","2025-05-12T22:31:27.482Z"
"84ce4d1a-601d-42e2-adfa-18d994119d13","3","manual","67","الرقص رأس يقارن حزن آخرون بالكاد مريح تدوس.","2025-05-13T17:39:25.277Z"
"acdce45a-5bdf-4e60-b285-24b699cd9d9a","3","manual","55","ويل جمع زيادة وميض أجوف يحل.","2025-05-13T19:11:05.338Z"
"33160978-eff6-4e8a-bcf8-2b413d6ac4e1","2","auto","87","متطور الغزل صالح مادة تم ثلاث ماذا.","2025-05-13T15:08:41.249Z"
"edede919-7f86-4ac2-b737-0b1c020782c5","4","auto","84","أجوف تملق أخرى منتج التسلق.","2025-05-13T12:53:45.057Z"
"459aec74-6aa9-4af3-9b30-82b13af423cc","1","auto","32","الجنون رماد ثالاسانوس مقبول أعلق.","2025-05-13T15:08:17.368Z"
"2d3afcc9-3eee-4d4f-92b3-ee7fb1d9d094","7","auto","48","شئ يرتجف صحيح ازعم نتيجة غربال تواصل أخضر أستسلم.","2025-05-13T15:43:32.820Z"
"9346d8b5-7a5f-40d8-8677-9518d690ce38","3","auto","78","لك خادمة أعتقد صدوق مرتين سلام ثلاثون.","2025-05-13T14:26:04.991Z"
"de4e79e3-1b19-4e16-9565-c950187c66c9","7","manual","25","وفير هي حصلت نهاية ايام منتصف برودة حقيقة أمان يقي.","2025-05-13T09:32:47.095Z"
"2c4ebc2b-19e1-4f9b-9244-3e9f76166187","9","manual","96","بيئة عباس أميل طالب.","2025-05-13T01:56:15.297Z"
"6953de1f-92c1-484d-ac1b-0e28047a7075","4","auto","89","حامض منجلي أقسى بجوار التسلق الذات سبب جهد.","2025-05-13T15:56:13.707Z"
"9d396a93-f93b-4438-9f96-30b7623cc97d","3","manual","30","اناقش رأس بسرعة يرفع الحياة ظل ينام يبحث.","2025-05-12T22:04:08.754Z"
"baac7d82-a295-498c-a00a-38f5932388b1","6","manual","59","مصلح الوصول مزايا إلتواء العنكبوت حذر.","2025-05-13T04:19:15.202Z"
"4561c154-5c0d-4272-b002-832e39454c39","1","auto","59","دورة استوديو البقية.","2025-05-13T16:19:29.613Z"
"8fa2e87f-9966-4096-8384-21ba5e9a8290","7","auto","63","الوادي طويل ملعقة مربع اقود جاذبية رمي أفترض حصلت.","2025-05-12T21:01:50.060Z"
"da9db101-23dc-464e-b80f-fb6dbb47c313","3","manual","85","بِكر مرهق ازعم مسرح الذات دورة.","2025-05-13T18:16:26.255Z"
"25f80f92-1ac1-4633-b8f0-db6f9dc205c7","5","manual","41","العنوان ثلاثون يأخذ السترة حال أعتقد حسنة كما.","2025-05-13T06:02:26.885Z"
"17fbb753-37bf-4a57-8a85-ac5189cda667","9","auto","1","قبل عمل شمس فاجأ واسع أخشى أتفق نظيف مجموعة.","2025-05-13T16:03:27.327Z"
"fa52c9b4-1d8a-423a-9c55-f97463094330","1","manual","76","أخت سلم ساحقة فقير وظائف يأخذ.","2025-05-12T21:04:38.915Z"
"47dda8ed-9e55-47e8-98aa-f5f99a6f0495","8","manual","85","أتفق بالطبع أميل العليا زعتر ثالاسانوس ثالث.","2025-05-13T05:49:23.465Z"
"1d28ed73-227a-49d6-a8f6-eb6c62481634","10","manual","91","ضد أخسر رقابة صحة عزيزي نجح.","2025-05-13T11:54:05.729Z"
"57e42eb0-ccbd-44e0-ad70-2a33669b4136","3","auto","96","خلوق منحن الغزل يقفز يهمني رفض قوة رماد كلا.","2025-05-13T05:53:26.265Z"
"bb2f850e-7e40-49f6-b29e-fe990620ee80","4","auto","61","إنها من أذن دولة مواطنة حياة أخرى فائدة بوق.","2025-05-13T17:02:46.145Z"
"35f80c26-db75-441e-b0e7-3139ae8d3033","9","auto","8","أعلق العاشر أساس مأخوذ آخر زحف.","2025-05-13T09:30:03.417Z"
"2ff6c69b-dbe6-41f8-8e10-ab2a97c1e398","3","auto","85","أعمى هذا احصل وظائف مرات.","2025-05-13T19:17:43.905Z"
"7a0d6bd4-9c2e-40dc-972a-5ddd0000bdb7","4","auto","93","خيار أقسى لكن واسع وَرَاءَ منجلي شجرة العليا الموسم.","2025-05-12T21:44:06.373Z"
"9a1887ce-526f-4773-b87e-033e8841b02a","9","manual","22","سأشرح مخمن بدأت ينضم قادم يتذكر.","2025-05-13T17:28:06.494Z"
"260546de-e68a-4d4f-b9e7-56c040b49acb","6","manual","71","طالب منحن الجبر يستوعب يأتي متأثر بكمل الماء حسنة حساس.","2025-05-13T14:15:18.126Z"
"8c1edce8-4d4a-472f-88c2-3d3a4941a7fd","1","manual","2","إلا قيد أبدًا بوق يقدموا.","2025-05-12T21:53:00.923Z"
"89b72706-d7e1-4142-859d-376f16047954","2","manual","59","وميض اناقش إذا غرفة يتدحرج صالح.","2025-05-12T22:12:09.542Z"
"d66147b4-e07f-4891-9544-495d6d15489e","6","manual","89","يأمل سيل صندوق عنوان تذوق ثقافة وسوف صوت بوق.","2025-05-13T07:42:12.293Z"
"1338384a-535c-4e9e-8955-0fb231a480bc","9","auto","41","الأساسي حل نستنتج.","2025-05-12T21:03:21.393Z"
"d1889ff3-de51-4f79-b89c-fcfb16703792","3","manual","61","أتفق آدم يضحك العائلة.","2025-05-13T19:00:31.612Z"
"1d35472b-4f7c-4e3d-ac69-c25bc19b4de2","3","manual","78","يقام وسعنا المحسنات واع أُطرُوحَة فزت السجلات حل.","2025-05-13T08:34:12.058Z"
"118d6ee8-2031-42f4-9d5e-6decb19a2e8e","10","auto","5","غرفة قبلت يحذب أعترف اقود النزاع فزت مواطن دعوى.","2025-05-13T08:18:43.327Z"
"6664776f-7130-4554-a13c-2e383b34d19b","6","auto","83","سهم متأخر ويل بعيد وسيم الجسم الحال أحسن زوجة اجل.","2025-05-13T09:50:53.530Z"
"b92d805a-94e4-4eab-83a0-3b99ce884453","9","manual","61","سن ابرم قبل يليق فضائي يقلق عزيزتي منجلي.","2025-05-13T14:49:59.737Z"
"b787263e-b446-4f14-ad20-2bbe4ef50957","6","auto","69","يهرب امتياز يصلح مستقر.","2025-05-13T11:48:25.831Z"
"88043f90-f2ed-4379-878c-f34f1c790cd5","2","auto","44","سيصيبني الجانبين روح سنة الاقتراع أخت متنوع شروط مواطن.","2025-05-13T02:17:57.790Z"
"3e0db97d-163f-49c4-bc8d-133ae958c2aa","5","auto","51","علاج ماشية وميض أركل جمال الضرورات ازعم.","2025-05-13T02:03:42.813Z"
"656fcd41-eb69-4a66-92e7-c6e1f67d8cc8","3","auto","6","أخت اغادر المعجل آدم بلدة.","2025-05-13T18:08:18.226Z"
"90b4f6de-934e-4536-96ae-91310151aa5c","1","auto","33","صداقة مادة مزايا تجريبي مظلمة جمال متنوع يلمس صدوق.","2025-05-13T17:44:02.452Z"
"929a3b19-01d9-4552-adff-890b5cc6d585","5","auto","7","مدهش أنهض واحد.","2025-05-13T06:59:35.542Z"
"73a39168-413b-4d77-8592-a08841f9cb52","10","manual","36","شرط مصطنع فضيلة خشن آمل مهجور لذا.","2025-05-13T08:11:14.052Z"
"1f8bc709-59d5-4712-87da-e2c277c8a0a9","9","manual","89","للمتابعة اضحك ما مزايا متنوع.","2025-05-12T22:19:52.253Z"
"27cad239-3b14-4581-9fe7-001963d2400d","8","manual","60","أساعد أوافق صحيح يقام شخص.","2025-05-13T06:58:51.510Z"
"a340dbcc-9ecc-4388-81de-54313c77c5be","8","manual","63","غرفة صدقة معركة ينمو نكون عن الأساسي.","2025-05-13T18:34:22.464Z"
"d9225f7a-e5f5-4ece-8b46-567f16e40a2a","8","auto","67","يتدحرج مبروك آمن بوق الوادي فريق مهد يترتب سأشرح.","2025-05-13T05:25:36.510Z"
"032ba952-19af-49e3-ada8-1876acd5b125","5","manual","13","المنشئ جسم فزت أوافق سأخبرك يناسب صده الرافض الحضارة زحف.","2025-05-13T01:13:50.473Z"
"8f15ee20-8003-4970-8be8-99bb5b7a2cfd","5","auto","40","أُطرُوحَة قديم شهرة حضن.","2025-05-13T09:59:38.981Z"
"0e4d975b-aad1-4d5f-9d1a-b79952df479c","7","auto","83","إخلاء خزانة اغادر ضد يناسب أمشي.","2025-05-13T17:05:31.525Z"
"c62d5812-c344-49f2-b707-8d868b06ff3c","2","manual","59","مؤلف الأليف ابرم حب معك مواطنون أفترض.","2025-05-13T15:20:29.794Z"
"a9a911eb-34b2-4665-be3c-623b4ed90cd5","10","auto","80","أُطرُوحَة برودة فجأة مهجور صوت حر أخيرا ينتقد كوب.","2025-05-12T20:08:16.990Z"
